Партія,Місцева організація,Географічний обʼєкт,Ідентифікаційний код юридичної особи за ЄДРПОУ,Місцезнаходження,Фактичне місцезнаходження,"Реквізити банків, у яких відкрито рахунки"
ПАРТІЯ ПЕНСІОНЕРІВ УКРАЇНИ,Харківська міська організація ППУ,Харківська область,33673616,"Харківська обл., м. Харків, Павлівський майдан, 2","Харківська обл., м. Харків, Павлівський майдан, 2",
ПАРТІЯ ПЕНСІОНЕРІВ УКРАЇНИ,Харківська обласна організація ППУ,Харківська область,26525295,"Харківська обл., м. Харків, вул. Шевченка, буд. 142","Харківська обл., м. Харків, вул. Шевченка, буд. 142",
ПАРТІЯ ПЕНСІОНЕРІВ УКРАЇНИ,Бердичівська міська організація ППУ,Житомирська область,26393764,"Житомирська обл., Бердичівський р-н, вул. Козацька, буд. 7","Житомирська обл., Бердичівський р-н, вул. Козацька, буд. 7",
ПАРТІЯ ПЕНСІОНЕРІВ УКРАЇНИ,Бердичівська районна організація ППУ,Житомирська область,26393793,"Житомирська обл., Бердичівський р-н, вул. Руська, буд. 4А","Житомирська обл., Бердичівський р-н, вул. Руська, буд. 4А",
ПАРТІЯ ПЕНСІОНЕРІВ УКРАЇНИ,Березівська районна організація ППУ,Одеська область,33490601,"Одеська обл., Березівський р-н, вул. Шевченко, буд. 22","Одеська обл., Березівський р-н, вул. Шевченко, буд. 22",
ПАРТІЯ ПЕНСІОНЕРІВ УКРАЇНИ,Березнегуватьська районна організація ППУ,Миколаївська область,34168634,"Миколаївська обл., Баштанський р-н, вул. Дружби, буд. 2","Миколаївська обл., Баштанський р-н, вул. Дружби, буд. 2",
ПАРТІЯ ПЕНСІОНЕРІВ УКРАЇНИ,Білоцерківська міська організація ППУ,Київська область,35785028,"Київська обл., Білоцерківський р-н, вул. Привокзальна, буд. 7","Київська обл., Білоцерківський р-н, вул. Привокзальна, буд. 7",
ПАРТІЯ ПЕНСІОНЕРІВ УКРАЇНИ,Білоцерківська районна організація ППУ,Київська область,35785075,"Київська обл., Білоцерківський р-н, вул. Привокзальна, буд. 7","Київська обл., Білоцерківський р-н, вул. Привокзальна, буд. 7",
ПАРТІЯ ПЕНСІОНЕРІВ УКРАЇНИ,Борзнянська районна організація ППУ,Чернігівська область,26350855,"Чернігівська обл., Ніжинський р-н, вул. Куліша Пантелеймона, буд. 59","Чернігівська обл., Ніжинський р-н, вул. Куліша Пантелеймона, буд. 59",
ПАРТІЯ ПЕНСІОНЕРІВ УКРАЇНИ,Бородянська районна організація ППУ,Київська область,35008679,"Київська обл., Бучанський р-н, вул. Будівельників, буд. 5","Київська обл., Бучанський р-н, вул. Будівельників, буд. 5",
ПАРТІЯ ПЕНСІОНЕРІВ УКРАЇНИ,Бородянська селищна організація ППУ,Київська область,34779720,"Київська обл., Бучанський р-н, вул. Будівельників, буд. 5","Київська обл., Бучанський р-н, вул. Будівельників, буд. 5",
ПАРТІЯ ПЕНСІОНЕРІВ УКРАЇНИ,Боярська міська організація ППУ,Київська область,34232772,"Київська обл., Фастівський р-н, вул. Садова, буд. 3","Київська обл., Фастівський р-н, вул. Садова, буд. 3",
ПАРТІЯ ПЕНСІОНЕРІВ УКРАЇНИ,Брусилівська районна організація ППУ,Житомирська область,26393646,"Житомирська обл., Житомирський р-н, вул. Братерська, буд. 22","Житомирська обл., Житомирський р-н, вул. Братерська, буд. 22",
ПАРТІЯ ПЕНСІОНЕРІВ УКРАЇНИ,Волинська обласна організація ППУ,Волинська область,33990569,"Волинська обл., Луцький р-н, вул. Рівненська, буд. 87/25","Волинська обл., Луцький р-н, вул. Рівненська, буд. 87/25",
ПАРТІЯ ПЕНСІОНЕРІВ УКРАЇНИ,Володарсько-Волинська районна організація ППУ,Житомирська область,26393741,"Житомирська обл., Житомирський р-н, вул. Ринкова, буд. 3","Житомирська обл., Житомирський р-н, вул. Ринкова, буд. 3",
ПАРТІЯ ПЕНСІОНЕРІВ УКРАЇНИ,Глухівська районна організація ППУ,Сумська область,39100041,"Сумська обл., Шосткинський р-н, вул. Шевченка, буд. 4","Сумська обл., Шосткинський р-н, вул. Шевченка, буд. 4",
ПАРТІЯ ПЕНСІОНЕРІВ УКРАЇНИ,Голопристанська районна організація ППУ,Херсонська область,34137543,"Херсонська обл., Скадовський р-н, вул. Горького, буд. 70","Херсонська обл., Скадовський р-н, вул. Горького, буд. 70",
ПАРТІЯ ПЕНСІОНЕРІВ УКРАЇНИ,Дніпропетровська обласна організація ППУ,Дніпропетровська область,33612490,"Дніпропетровська обл., м. Дніпро, вул. Пальмова, буд. 18","Дніпропетровська обл., м. Дніпро, вул. Пальмова, буд. 18",
ПАРТІЯ ПЕНСІОНЕРІВ УКРАЇНИ,Дрогобицька міська організація ППУ,Львівська область,39670296,"Львівська обл., Дрогобицький р-н, вул. Стрийська, буд. 179","Львівська обл., Дрогобицький р-н, вул. Стрийська, буд. 179",
ПАРТІЯ ПЕНСІОНЕРІВ УКРАЇНИ,Житомирська міська організація ППУ,Житомирська область,26393652,"Житомирська обл., м. Житомир, вул. Кафедральна, буд. 5А","Житомирська обл., м. Житомир, вул. Кафедральна, буд. 5А",
ПАРТІЯ ПЕНСІОНЕРІВ УКРАЇНИ,Золотоніська міська організація ППУ,Черкаська область,33827804,"Черкаська обл., Золотоніський р-н, вул. Садовий проїзд, буд. 4","Черкаська обл., Золотоніський р-н, вул. Садовий проїзд, буд. 4",
ПАРТІЯ ПЕНСІОНЕРІВ УКРАЇНИ,Золотоніська районна організація ППУ,Черкаська область,33827818,"Черкаська обл., Золотоніський р-н, вул. Садовий проїзд, буд. 4","Черкаська обл., Золотоніський р-н, вул. Садовий проїзд, буд. 4",
ПАРТІЯ ПЕНСІОНЕРІВ УКРАЇНИ,Івано-Франківська обласна організація ППУ,Івано-франківська область,39948342,"Івано-франківська обл., Івано-Франківський р-н, вул. Івасюка В., буд. 32","Івано-франківська обл., Івано-Франківський р-н, вул. Івасюка В., буд. 32",
ПАРТІЯ ПЕНСІОНЕРІВ УКРАЇНИ,Ірпінська міська організація ППУ,Київська область,26025782,"Київська обл., Бучанський р-н, вул. Михайлівська, буд. 20Б","Київська обл., Бучанський р-н, вул. Михайлівська, буд. 20Б",
ПАРТІЯ ПЕНСІОНЕРІВ УКРАЇНИ,Київська обласна організація ППУ,Київська область,25980653,"Київська обл., Фастівський р-н, пров. Ткаченка О., буд. 36А","Київська обл., Фастівський р-н, пров. Ткаченка О., буд. 36А",
ПАРТІЯ ПЕНСІОНЕРІВ УКРАЇНИ,Київська міська організація ППУ,київ,37973861,"м.. київ, Оболонський, просп. Порика Василя, буд. 7Б","м.. київ, Оболонський, просп. Порика Василя, буд. 7Б",
ПАРТІЯ ПЕНСІОНЕРІВ УКРАЇНИ,Кіровоградська обласна організація ППУ,Кіровоградська область,39767573,"Кіровоградська обл., м. Кропивницький, вул. Преображенська, буд. 2","Кіровоградська обл., м. Кропивницький, вул. Преображенська, буд. 2",
ПАРТІЯ ПЕНСІОНЕРІВ УКРАЇНИ,Коростишівська районна організація ППУ,Житомирська область,26393617,"Житомирська обл., Житомирський р-н, вул. Різдвяна, буд. 70","Житомирська обл., Житомирський р-н, вул. Різдвяна, буд. 70",
ПАРТІЯ ПЕНСІОНЕРІВ УКРАЇНИ,Львівська міська організація ППУ,Львівська область,26095593,"Львівська обл., м. Львів, вул. Лесі Українки, буд. 14","Львівська обл., м. Львів, вул. Лесі Українки, буд. 14",
ПАРТІЯ ПЕНСІОНЕРІВ УКРАЇНИ,Львівська обласна організація ППУ,Львівська область,34259471,"Львівська обл., м. Львів, вул. Лесі Українки, буд. 14","Львівська обл., м. Львів, вул. Лесі Українки, буд. 14",
ПАРТІЯ ПЕНСІОНЕРІВ УКРАЇНИ,Любарська районна організація ППУ,Житомирська область,26393758,"Житомирська обл., Житомирський р-н, вул. Гагаріна, буд. 34","Житомирська обл., Житомирський р-н, вул. Гагаріна, буд. 34",
ПАРТІЯ ПЕНСІОНЕРІВ УКРАЇНИ,Малинська міська організація ППУ,Житомирська область,26393712,"Житомирська обл., Коростенський р-н, вул. Чкалова, буд. 8","Житомирська обл., Коростенський р-н, вул. Чкалова, буд. 8",
ПАРТІЯ ПЕНСІОНЕРІВ УКРАЇНИ,Малинська районна організація ППУ,Житомирська область,26393729,"Житомирська обл., Коростенський р-н, вул. Чкалова, буд. 8","Житомирська обл., Коростенський р-н, вул. Чкалова, буд. 8",
ПАРТІЯ ПЕНСІОНЕРІВ УКРАЇНИ,Марганецька міська організація ППУ,Дніпропетровська область,40046743,"Дніпропетровська обл., Нікопольський р-н, вул. Центральна, буд. 51","Дніпропетровська обл., Нікопольський р-н, вул. Центральна, буд. 51",
ПАРТІЯ ПЕНСІОНЕРІВ УКРАЇНИ,Миколаївська обласна організація ППУ,Миколаївська область,34034179,"Миколаївська обл., м. Миколаїв, вул. Будівельників, буд. 1","Миколаївська обл., м. Миколаїв, вул. Будівельників, буд. 1",
ПАРТІЯ ПЕНСІОНЕРІВ УКРАЇНИ,Обласна організація ППУ в Закарпатській обл.,Закарпатська область,25452074,"Закарпатська обл., Ужгородський р-н, вул. Виннична, буд. 17","Закарпатська обл., Ужгородський р-н, вул. Виннична, буд. 17",
ПАРТІЯ ПЕНСІОНЕРІВ УКРАЇНИ,Овідіопольська районна організація ППУ,Одеська область,39597007,"Одеська обл., Одеський р-н, вул. Сонячна, буд. 32","Одеська обл., Одеський р-н, вул. Сонячна, буд. 32",
ПАРТІЯ ПЕНСІОНЕРІВ УКРАЇНИ,Овруцька районна організація ППУ,Житомирська область,26393669,"Житомирська обл., Коростенський р-н, вул. Богуна І., буд. 71","Житомирська обл., Коростенський р-н, вул. Богуна І., буд. 71",
ПАРТІЯ ПЕНСІОНЕРІВ УКРАЇНИ,Одеська обласна організація ППУ,Одеська область,25832049,"Одеська обл., м. Одеса, вул. Балківська, буд. 14","Одеська обл., м. Одеса, вул. Балківська, буд. 14",
ПАРТІЯ ПЕНСІОНЕРІВ УКРАЇНИ,Одеська міська організація ППУ,Одеська область,25932590,"Одеська обл., м. Одеса, вул. Балківська, буд. 14","Одеська обл., м. Одеса, вул. Балківська, буд. 14",
ПАРТІЯ ПЕНСІОНЕРІВ УКРАЇНИ,Полтавська обласна організація ППУ,Полтавська область,33804478,"Полтавська обл., м. Полтава, вул. Шведська, буд. 58","Полтавська обл., м. Полтава, вул. Шведська, буд. 58",
ПАРТІЯ ПЕНСІОНЕРІВ УКРАЇНИ,Попільнянська районна організація ППУ,Житомирська область,26393706,"Житомирська обл., Житомирський р-н, пров. Фомічова, буд. 3","Житомирська обл., Житомирський р-н, пров. Фомічова, буд. 3",
ПАРТІЯ ПЕНСІОНЕРІВ УКРАЇНИ,Придніпровська районна організація ППУ,Черкаська область,26423784,"Черкаська обл., м. Черкаси, вул. Нарбутівська, буд. 160/1","Черкаська обл., м. Черкаси, вул. Нарбутівська, буд. 160/1",
ПАРТІЯ ПЕНСІОНЕРІВ УКРАЇНИ,Приморська районна організація ППУ,Одеська область,26455181,"Одеська обл., м. Одеса, вул. Торгова, буд. 26","Одеська обл., м. Одеса, вул. Торгова, буд. 26",
ПАРТІЯ ПЕНСІОНЕРІВ УКРАЇНИ,Ріпкінська районна організація ППУ,Чернігівська область,33450621,"Чернігівська обл., Чернігівський р-н, вул. Дніпровська, буд. 9","Чернігівська обл., Чернігівський р-н, вул. Дніпровська, буд. 9",
ПАРТІЯ ПЕНСІОНЕРІВ УКРАЇНИ,Саратська районна організація ППУ,Одеська область,33485518,"Одеська обл., Білгород-Дністровський р-н, вул. Ліндла Ігнаца, буд. 46","Одеська обл., Білгород-Дністровський р-н, вул. Ліндла Ігнаца, буд. 46",
ПАРТІЯ ПЕНСІОНЕРІВ УКРАЇНИ,Смілянська міська організація ППУ,Черкаська область,26424051,"Черкаська обл., Черкаський р-н, вул. Мірошниченко, буд. 5","Черкаська обл., Черкаський р-н, вул. Мірошниченко, буд. 5",
ПАРТІЯ ПЕНСІОНЕРІВ УКРАЇНИ,Смілянська районна організація ППУ,Черкаська область,26423910,"Черкаська обл., Черкаський р-н, вул. Мірошниченко, буд. 5","Черкаська обл., Черкаський р-н, вул. Мірошниченко, буд. 5",
ПАРТІЯ ПЕНСІОНЕРІВ УКРАЇНИ,Соснівська районна організація ППУ,Черкаська область,26423838,"Черкаська обл., м. Черкаси, вул. Дашковича Остафія, буд. 30","Черкаська обл., м. Черкаси, вул. Дашковича Остафія, буд. 30",
ПАРТІЯ ПЕНСІОНЕРІВ УКРАЇНИ,Сумська обласна організація ППУ,Сумська область,24018111,"Сумська обл., м. Суми, вул. Привокзальна, буд. 25","Сумська обл., м. Суми, вул. Привокзальна, буд. 25",
ПАРТІЯ ПЕНСІОНЕРІВ УКРАЇНИ,Токмакська районна організація ППУ,Запорізька область,33913861,"Запорізька обл., Пологівський р-н, вул. Центральна, буд. 51","Запорізька обл., Пологівський р-н, вул. Центральна, буд. 51",
ПАРТІЯ ПЕНСІОНЕРІВ УКРАЇНИ,Фрунзівська селищна організація ППУ,Одеська область,32651900,"Одеська обл., Роздільнянський р-н, вул. Першого Травня, буд. 42А","Одеська обл., Роздільнянський р-н, вул. Першого Травня, буд. 42А",
ПАРТІЯ ПЕНСІОНЕРІВ УКРАЇНИ,Херсонська міська організація ППУ,Херсонська область,34073862,"Херсонська обл., м. Херсон, вул. Воронцовська, буд. 22","Херсонська обл., м. Херсон, вул. Воронцовська, буд. 22",
ПАРТІЯ ПЕНСІОНЕРІВ УКРАЇНИ,Херсонська обласна організація ППУ,Херсонська область,34073925,"Херсонська обл., м. Херсон, вул. Церковна, буд. 4","Херсонська обл., м. Херсон, вул. Церковна, буд. 4",
ПАРТІЯ ПЕНСІОНЕРІВ УКРАЇНИ,Хмельницька обласна організація ППУ,Хмельницька область,34007208,"Хмельницька обл., Хмельницький р-н, вул. Свободи, буд. 16А","Хмельницька обл., Хмельницький р-н, вул. Свободи, буд. 16А",
ПАРТІЯ ПЕНСІОНЕРІВ УКРАЇНИ,Червоноармійська районна організація ППУ,Житомирська область,26393770,"Житомирська обл., Житомирський р-н, пров. Базарний, буд. 11А","Житомирська обл., Житомирський р-н, пров. Базарний, буд. 11А",
ПАРТІЯ ПЕНСІОНЕРІВ УКРАЇНИ,Чернівецька обласна організація ППУ,Чернівецька область,26398230,"Чернівецька обл., Чернівецький р-н, вул. Українська, буд. 44","Чернівецька обл., Чернівецький р-н, вул. Українська, буд. 44",
ПАРТІЯ ПЕНСІОНЕРІВ УКРАЇНИ,Чернігівська обласна організація ППУ,Чернігівська область,26575962,"Чернігівська обл., м. Чернігів, вул. Мезенцева Юрія, буд. 80","Чернігівська обл., м. Чернігів, вул. Мезенцева Юрія, буд. 80",
ПАРТІЯ ПЕНСІОНЕРІВ УКРАЇНИ,Чернігівська районна організація ППУ,Чернігівська область,36805982,"Чернігівська обл., Чернігівський р-н, вул. Сновська, буд. 39","Чернігівська обл., Чернігівський р-н, вул. Сновська, буд. 39",
ПАРТІЯ ПЕНСІОНЕРІВ УКРАЇНИ,Шепетівська міська організація ППУ,Хмельницька область,36745227,"Хмельницька обл., Шепетівський р-н, просп. Миру, буд. 46","Хмельницька обл., Шепетівський р-н, просп. Миру, буд. 46",
ПАРТІЯ ПЕНСІОНЕРІВ УКРАЇНИ,Шепетівська районна організація ППУ,Хмельницька область,36745283,"Хмельницька обл., Шепетівський р-н, просп. Миру, буд. 46","Хмельницька обл., Шепетівський р-н, просп. Миру, буд. 46",
ПАРТІЯ ПЕНСІОНЕРІВ УКРАЇНИ,Черкаська обласна організація ППУ,Черкаська область,34257603,"Черкаська обл., м. Черкаси, вул. Благовісна, буд. 1","Черкаська обл., м. Черкаси, вул. Благовісна, буд. 1",
ПАРТІЯ ПЕНСІОНЕРІВ УКРАЇНИ,Центральний офіс,Одеська область,21710421,"Одеська обл., м. Одеса, вул. Балківська, буд. 14","Одеська обл., м. Одеса, вул. Балківська, буд. 14","ПАТ КБ ""ПРАВЕКС-БАНК"", ЄДРПОУ: 14360920, р/р № UA303808380000026004799961555; ХВ №14 ""СКАЙ-БАНК"", ЄДРПОУ: 09620081, р/р № UA753512540000026006140119615"
