Партія,Місцева організація,Географічний обʼєкт,Ідентифікаційний код юридичної особи за ЄДРПОУ,Місцезнаходження,Фактичне місцезнаходження,"Реквізити банків, у яких відкрито рахунки"
ДЕМОКРАТИ,БАБУШКІНСЬКА РАЙОННА ОРГАНІЗАЦІЯ ПОЛІТИЧНОЇ ПАРТІЇ НАЦІОНАЛЬНО-ЕКОМІЧНОГО РОЗВИТКУ УКРАЇНИ У М. ДНІПРОПЕТРОВСЬКУ,Дніпропетровська область,26236326,"Дніпропетровська обл., м. Дніпро, вул. Свєтлова, буд. 41А","Дніпропетровська обл., м. Дніпро, вул. Свєтлова, буд. 41А",
ДЕМОКРАТИ,БОРИСПІЛЬСЬКИЙ МІСЬКИЙ ОСЕРЕДОК ПАРТІЇ НАЦІОНАЛЬНО-ЕКОНОМІЧНОГО РОЗВИТКУ УКРАЇНИ,Київська область,26170219,"Київська обл., м. Бориспіль, вул. Глибоцька, буд. 5","Київська обл., м. Бориспіль, вул. Глибоцька, буд. 5",
ДЕМОКРАТИ,ПАРТІЯ НАЦІОНАЛЬНО-ЕКОНОМІЧНОГО РОЗВИТКУ УКРАЇНИ В КИЇВСЬКОМУ РАЙОНІ М.ПОЛТАВИ,Полтавська область,25160928,"Полтавська обл., м. Полтава, вул. Соборності, буд. 54","Полтавська обл., м. Полтава, вул. Соборності, буд. 54",
ДЕМОКРАТИ,ВАСИЛЬКІВСЬКА МІСЬКА ОРГАНІЗАЦІЯ ПАРТІЇ НАЦІОНАЛЬНО-ЕКОНОМІЧНОГО РОЗВИТКУ УКРАЇНИ,Київська область,34268809,"Київська обл., м. Васильків, вул. Соборна, буд. 72","Київська обл., м. Васильків, вул. Соборна, буд. 72",
ДЕМОКРАТИ,ВЕРХНЬОДНІПРОВСЬКА РАЙОНА ОРГАНІЗАЦІЯ ПАРТІЇ НАЦІОНАЛЬНО-ЕКОНОМІЧНОГО РОЗВИТКУ УКРАЇНИ,Дніпропетровська область,26139570,"Дніпропетровська обл., Верхньодніпровський р-н, вул. Поля, буд. 38","Дніпропетровська обл., Верхньодніпровський р-н, вул. Поля, буд. 38",
ДЕМОКРАТИ,ВІННИЦЬКА МІСЬКА ОРГАНІЗАЦІЯ ПОЛІТИЧНОЇ ПАРТІЇ НАЦІОНАЛЬНО-ЕКОНОМІЧНОГО РОЗВИТКУ УКРАЇНИ,Вінницька область,34213786,"Вінницька обл., м. Вінниця, Хмельницьке шосе, 23А","Вінницька обл., м. Вінниця, Хмельницьке шосе, 23А",
ДЕМОКРАТИ,ЖИТОМИРСЬКА ОБЛАСНА ОРГАНІЗАЦІЯ ПАРТІЇ НАЦІОНАЛЬНО-ЕКОНОМІЧНОГО РОЗВИТКУ УКРАЇНИ,Житомирська область,25777221,"Житомирська обл., м. Житомир, бульв. Новий, буд. 5","Житомирська обл., м. Житомир, бульв. Новий, буд. 5",
ДЕМОКРАТИ,ЖОВТОВОДСЬКА ОРГАНІЗАЦІЯ ПАРТІЇ НАЦІОНАЛЬНО-ЕКОНОМІЧНОГО РОЗВИТКУ УКРАЇНИ,Дніпропетровська область,26048731,"Дніпропетровська обл., м. Жовті Води, вул. Богуна І., буд. 75А","Дніпропетровська обл., м. Жовті Води, вул. Богуна І., буд. 75А",
ДЕМОКРАТИ,ІВАНО-ФРАНКІВСЬКА ОБЛАСНА ОРГАНІЗАЦІЯ ПАРТІЇ НАЦІОНАЛЬНО-ЕКОНОМІЧНОГО РОЗВИТКУ УКРАЇНИ,Івано-франківська область,26022982,"Івано-франківська обл., м. Івано-Франківськ, вул. Дністровська, буд. 32","Івано-франківська обл., м. Івано-Франківськ, вул. Дністровська, буд. 32",
ДЕМОКРАТИ,ІРШАВСЬКА РАЙОННА ОРГАНІЗАЦІЯ ПАРТІЇ НАЦІОНАЛЬНО-ЕКОНОМІЧНОГО РОЗВИТКУ УКРАЇНИ,Закарпатська область,33874812,"Закарпатська обл., Іршавський р-н, вул. Шевченка, буд. 24","Закарпатська обл., Іршавський р-н, вул. Шевченка, буд. 24",
ДЕМОКРАТИ,КАНІВСЬКА ПЕРВИННА ОРГАНІЗАЦІЯ ПАРТІЇ НАЦІОНАЛЬНО-ЕКОНОМІЧНОГО РОЗВИТКУ УКРАЇНИ,Черкаська область,26490071,"Черкаська обл., м. Канів, вул. 206 Дивізії, буд. 10А","Черкаська обл., м. Канів, вул. 206 Дивізії, буд. 10А",
ДЕМОКРАТИ,КРИВОРІЗЬКА МІСЬКА ОРГАНІЗАЦІЯ ПАРТІЇ НАЦІОНАЛЬНО-ЕКОНОМІЧНОГО РОЗВИТКУ УКРАЇНИ,Дніпропетровська область,26048493,"Дніпропетровська обл., м. Кривий Ріг, вул. Героїв АТО, буд. 13","Дніпропетровська обл., м. Кривий Ріг, вул. Героїв АТО, буд. 13",
ДЕМОКРАТИ,КРЮКІВСЬКИЙ РАЙОННИЙ В М.КРЕМЕНЧУЦІ ОСЕРЕДОК ПАРТІЇ НАЦІОНАЛЬНО-ЕКОНОМІЧНОГО РОЗВИТКУ УКРАЇНИ,Полтавська область,26163308,"Полтавська обл., м. Кременчук, вул. Небесної Сотні, буд. 12","Полтавська обл., м. Кременчук, вул. Небесної Сотні, буд. 12",
ДЕМОКРАТИ,МІСТО ЛЬВІВСЬКА ОБЛАСНА ОРГАНІЗАЦІЯ ПАРТІЇ НАЦІОНАЛЬНО-ЕКОНОМІЧНОГО РОЗВИТКУ УКРАЇНИ,Львівська область,25235483,"Львівська обл., м. Львів, вул. Гнатюка В. академіка, буд. 2","Львівська обл., м. Львів, вул. Гнатюка В. академіка, буд. 2",
ДЕМОКРАТИ,МИКОЛАЇВСЬКА ОБЛАСНА ОРГАНІЗАЦІЯ ПОЛІТИЧНОЇ ПАРТІЇ НАЦІОНАЛЬНО-ЕКОНОМІЧНОГО РОЗВИТКУ УКРАЇНИ,Миколаївська область,24797463,"Миколаївська обл., м. Миколаїв, вул. Декабристів (Заводський, Центральний р-ни), 4А","Миколаївська обл., м. Миколаїв, вул. Декабристів (Заводський, Центральний р-ни), 4А",
ДЕМОКРАТИ,МІСЬКА ОРГАНІЗАЦІЯ ПАРТІЇ НАЦІОНАЛЬНО-ЕКОНОМІЧНОГО РОЗВИТКУ УКРАЇНИ,Одеська область,25428615,"Одеська обл., м. Одеса, вул. Пушкінська, буд. 36","Одеська обл., м. Одеса, вул. Пушкінська, буд. 36",
ДЕМОКРАТИ,МІСЬКА ПЕРВИННА ОРГАНІЗАЦІЯ ПАРТІЇ НАЦІОНАЛЬНО-ЕКОНОМІЧНОГО РОЗВИТКУ УКРАЇНИ,Кіровоградська область,24709884,"Кіровоградська обл., м. Світловодськ, вул. Героїв України, буд. 50","Кіровоградська обл., м. Світловодськ, вул. Героїв України, буд. 50",
ДЕМОКРАТИ,МІСЬКИЙ ОСЕРЕДОК ПАРТІЇ НАЦІОНАЛЬНО-ЕКОНОМІЧНОГО РОЗВИТКУ УКРАЇНИ В МІСТІ КОРОСТЕНЬ,Житомирська область,33991253,"Житомирська обл., м. Коростень, вул. Грушевського, буд. 44","Житомирська обл., м. Коростень, вул. Грушевського, буд. 44",
ДЕМОКРАТИ,НОВОГРАД-ВОЛИНСЬКА РАЙОННА ОРГАНІЗАЦІЯ ПАРТІЇ НАЦІОНАЛЬНО-ЕКОНОМІЧНОГО РОЗВИТКУ УКРАЇНИ,Житомирська область,34096633,"Житомирська обл., м. Новоград-Волинський, вул. Шевченка, буд. 17","Житомирська обл., м. Новоград-Волинський, вул. Шевченка, буд. 17",
ДЕМОКРАТИ,ОДЕСЬКА ОБЛАСНА ОРГАНІЗАЦІЯ ПАРТІЇ НАЦІОНАЛЬНО-ЕКОНОМІЧНОГО РОЗВИТКУ УКРАЇНИ,Одеська область,25044369,"Одеська обл., м. Одеса, вул. Велика Арнаутська, буд. 44","Одеська обл., м. Одеса, вул. Велика Арнаутська, буд. 44",
ДЕМОКРАТИ,ОСЕРЕДОК ПАРТІЇ НАЦІОНАЛЬНО-ЕКОНОМІЧНОГО РОЗВИТКУ УКРАЇНИ,Київська область,25822536,"Київська обл., м. Бровари, бульв. Незалежності, буд. 14А","Київська обл., м. Бровари, бульв. Незалежності, буд. 14А",
ДЕМОКРАТИ,ОСЕРЕДОК ПАРТІЇ НАЦІОНАЛЬНО-ЕКОНОМІЧНОГО РОЗВИТКУ УКРАЇНИ ПО КОВПАКІВСЬКОМУ РАЙОНУ М.СУМИ,Сумська область,24005597,"Сумська обл., м. Суми, вул. Металургів, буд. 16","Сумська обл., м. Суми, вул. Металургів, буд. 16",
ДЕМОКРАТИ,ПЕРВИННА ПАРТІЙНА ОРГАНІЗАЦІЯ ПАРТІЇ НАЦІОНАЛЬНО-ЕКОНОМІЧНОГО РОЗВИТКУ УКРАЇНИ В МІСТІ СТРИЙ,Львівська область,25241093,"Львівська обл., м. Стрий, вул. Успенська, буд. 58","Львівська обл., м. Стрий, вул. Успенська, буд. 58",
ДЕМОКРАТИ,ПЕРВИННА ОРГАНІЗАЦІЯ ПАРТІЇ НАЦІОНАЛЬНО-ЕКОНОМІЧНОГО РОЗВИТКУ УКРАЇНИ В М.ІРПІНЬ,Київська область,20583216,"Київська обл., м. Ірпінь, вул. Покровська, буд. 1А","Київська обл., м. Ірпінь, вул. Покровська, буд. 1А",
ДЕМОКРАТИ,ПЕРШОТРАВЕНСЬКА МІСЬКА ОРГАНІЗАЦІЯ ПАРТІЇ НАЦІОНАЛЬНО-ЕКОНОМІЧНОГО РОЗВИТКУ УКРАЇНИ,Дніпропетровська область,26329163,"Дніпропетровська обл., м. Першотравенськ, вул. Кобзаря, буд. 3Б","Дніпропетровська обл., м. Першотравенськ, вул. Кобзаря, буд. 3Б",
ДЕМОКРАТИ,ПОЛТАВСЬКА ОБЛАСНА ОРГАНІЗАЦІЯ ПАРТІЇ НАЦІОНАЛЬНО-ЕКОНОМІЧНОГО РОЗВИТКУ УКРАЇНИ,Полтавська область,25162353,"Полтавська обл., м. Полтава, вул. Котляревського, буд. 1/27","Полтавська обл., м. Полтава, вул. Котляревського, буд. 1/27",
ДЕМОКРАТИ,ОБЛАСНА ОРГАНІЗАЦІЯ ПОЛІТИЧНОЇ ПАРТІЇ НАЦІОНАЛЬНО-ЕКОНОМІЧНОГО РОЗВИТКУ УКРАЇНИ,Рівненська область,25316023,"Рівненська обл., м. Рівне, вул. Бандери Степана, буд. 41","Рівненська обл., м. Рівне, вул. Бандери Степана, буд. 41",
ДЕМОКРАТИ,СЛАВУТИЦЬКА МІСЬКА ОРГАНІЗАЦІЯ ПАРТІЇ НАЦІОНАЛЬНО-ЕКОНОМІЧНОГО РОЗВИТКУ УКРАЇНИ,Київська область,26146379,"Київська обл., м. Славутич, вул. Героїв Дніпра, буд. 2","Київська обл., м. Славутич, вул. Героїв Дніпра, буд. 2",
ДЕМОКРАТИ,СУМСЬКА ОБЛАСНА ПАРТІЙНА ОРГАНІЗАЦІЯ ПАРТІЇ НАЦІОНАЛЬНО-ЕКОНОМІЧНОГО РОЗВИТКУ УКРАЇНИ,Сумська область,23818967,"Сумська обл., м. Суми, вул. Кондратьєва Герасима, буд. 20","Сумська обл., м. Суми, вул. Кондратьєва Герасима, буд. 20",
ДЕМОКРАТИ,ТЕРНІВСЬКА МІСЬКА ОРГАНІЗАЦІЯ ПАРТІЇ НАЦІОНАЛЬНО-ЕКОНОМІЧНОГО РОЗВИТКУ УКРАЇНИ В ДНІПРОПЕТРОВСЬКІЙ ОБЛАСТІ,Дніпропетровська область,26329174,"Дніпропетровська обл., м. Тернівка, вул. Західно-Донбаська, буд. 1","Дніпропетровська обл., м. Тернівка, вул. Західно-Донбаська, буд. 1",
ДЕМОКРАТИ,ТЯЧІВСЬКА МІСЬКА ОРГАНІЗАЦІЯ ПАРТІЇ НАЦІОНАЛЬНО-ЕКОНОМІЧНОГО РОЗВИТКУ УКРАЇНИ,Закарпатська область,36594663,"Закарпатська обл., Тячівський р-н, вул. Кошута, буд. 36","Закарпатська обл., Тячівський р-н, вул. Кошута, буд. 36",
ДЕМОКРАТИ,ТЯЧІВСЬКИЙ ОСЕРЕДОК ПАРТІЇ НАЦІОНАЛЬНО-ЕКОНОМІЧНОГО РОЗВИТКУ УКРАЇНИ,Закарпатська область,34153539,"Закарпатська обл., Тячівський р-н, вул. Кошута, буд. 36Б","Закарпатська обл., Тячівський р-н, вул. Кошута, буд. 36Б",
ДЕМОКРАТИ,УСТИНІВСЬКА РАЙОННА ОРГАНІЗАЦІЯ ПАРТІЇ НАЦІОНАЛЬНО-ЕКОНОМІЧНОГО РОЗВИТКУ УКРАЇНИ,Кіровоградська область,26143317,"Кіровоградська обл., Устинівський р-н, вул. Ювілейна, буд. 2","Кіровоградська обл., Устинівський р-н, вул. Ювілейна, буд. 2",
ДЕМОКРАТИ,ФАСТІВСЬКА МІСЬКА ОРГАНІЗАЦІЯ ПАРТІЇ НАЦІОНАЛЬНО-ЕКОНОМІЧНОГО РОЗВИТКУ УКРАЇНИ,Київська область,33921741,"Київська обл., м. Фастів, вул. Київська, буд. 22","Київська обл., м. Фастів, вул. Київська, буд. 22",
ДЕМОКРАТИ,ХМЕЛЬНИЦЬКА МІСЬКА ОРГАНІЗАЦІЯ ПАРТІЇ НАЦІОНАЛЬНО-ЕКОНОМІЧНОГО РОЗВИТКУ УКРАЇНИ,Хмельницька область,26157302,"Хмельницька обл., м. Хмельницький, вул. Чорновола В. м. ., буд. 88/1","Хмельницька обл., м. Хмельницький, вул. Чорновола В. м. ., буд. 88/1",
ДЕМОКРАТИ,ХМЕЛЬНИЦЬКА ОБЛАСНА ОРГАНІЗАЦІЯ ПАРТІЇ НАЦІОНАЛЬНО-ЕКОНОМІЧНОГО РОЗВИТКУ УКРАЇНИ,Хмельницька область,21344502,"Хмельницька обл., м. Хмельницький, пров. Театральний, буд. 13","Хмельницька обл., м. Хмельницький, пров. Театральний, буд. 13",
ДЕМОКРАТИ,ХУСТСЬКА МІСЬКА ОРГАНІЗАЦІЯ ПАРТІЇ НАЦІОНАЛЬНО-ЕКОНОМІЧНОГО РОЗВИТКУ УКРАЇНИ,Закарпатська область,26099906,"Закарпатська обл., м. Хуст, вул. Франка І., буд. 6","Закарпатська обл., м. Хуст, вул. Франка І., буд. 6",
ДЕМОКРАТИ,ЧЕРНІВЕЦЬКА ОБЛАСНА ОРГАНІЗАЦІЯ ПАРТІЇ НАЦІОНАЛЬНО-ЕКОНОМІЧНОГО РОЗВИТКУ УКРАЇНИ,Чернівецька область,26075873,"Чернівецька обл., м. Чернівці, вул. Головна, буд. 205","Чернівецька обл., м. Чернівці, вул. Головна, буд. 205",
ДЕМОКРАТИ,ЮЖНЕНСЬКА МІСЬКА ПЕРВИННА ОРГАНІЗАЦІЯ ПАРТІЇ НАЦІОНАЛЬНО-ЕКОНОМІЧНОГО РОЗВИТКУ УКРАЇНИ,Одеська область,25415995,"Одеська обл., м. Южне, просп. Миру, буд. 7","Одеська обл., м. Южне, просп. Миру, буд. 7",
ДЕМОКРАТИ,ОЛЕКСАНДРІЙСЬКА МІСЬКА ОРГАНІЗАЦІЯ ПАРТІЇ НАЦІОНАЛЬНО-ЕКОНОМІЧНОГО РОЗВИТКУ УКРАЇНИ,Кіровоградська область,24708844,"Кіровоградська обл., м. Олександрія, вул. Першотравнева, буд. 14","Кіровоградська обл., м. Олександрія, вул. Першотравнева, буд. 14",
ДЕМОКРАТИ,ЧОПСЬКИЙ МІСЬКИЙ ОСЕРЕДОК ПАРТІЇ НАЦІОНАЛЬНО-ЕКОНОМІЧНОГО РОЗВИТКУ УКРАЇНИ,Закарпатська область,26099059,"Закарпатська обл., м. Чоп, вул. Головна, буд. 1","Закарпатська обл., м. Чоп, вул. Головна, буд. 1",
ДЕМОКРАТИ,КІЦМАНСЬКИЙ РАЙОННИЙ ОСЕРЕДОК ПАРТІЇ НАЦІОНАЛЬНО-ЕКОНОМІЧНОГО РОЗВИТКУ УКРАЇНИ,Чернівецька область,26035450,"Чернівецька обл., Кіцманський р-н, вул. Павлюк І., буд. 16","Чернівецька обл., Кіцманський р-н, вул. Павлюк І., буд. 16",
ДЕМОКРАТИ,НОВОМОСКОВСЬКА РАЙОННА ОРГАНІЗАЦІЯ ПАРТІЇ НАЦІОНАЛЬНО-ЕКОНОМІЧНОГО РОЗВИТКУ УКРАЇНИ В НОВОМОСКОВСЬКОМУ РАЙОНІ,Дніпропетровська область,26460035,"Дніпропетровська обл., Новомосковський р-н, вул. Гагаріна, буд. 2","Дніпропетровська обл., Новомосковський р-н, вул. Гагаріна, буд. 2",
ДЕМОКРАТИ,ДНІПРОПЕТРОВСЬКА ОБЛАСНА організація ЧНА ПАРТІЯ),Дніпропетровська область,25015161,"Дніпропетровська обл., м. Дніпро, житловий масив Тополя-2, 1","Дніпропетровська обл., м. Дніпро, житловий масив Тополя-2, 1",
ДЕМОКРАТИ,БОРИСЛАВСЬКИЙ МІСЬКИЙ ОСЕРЕДОК ПАРТІЇ НАЦІОНАЛЬНО-ЕКОНОМІЧНОГО РОЗВИТКУ УКРАЇНИ,Львівська область,26411870,"Львівська обл., м. Борислав, вул. Шевченка, буд. 2","Львівська обл., м. Борислав, вул. Шевченка, буд. 2",
ДЕМОКРАТИ,Центральний офіс,київ,00013285,"м.. київ, Дарницький, вул. Ново-Дарницька, буд. 6","м.. київ, Дарницький, вул. Ново-Дарницька, буд. 6",
