Дата здійснення платежу з рахунку політичної партії,Найменування банку,Номер розрахункового документа,ПІБ (для фіз. осіб)/Назва (для юр. осіб),Ідентифікаційний код (для фіз. осіб)/Код ЄДРПОУ (для юр. осіб),Місце проживання (для фіз. осіб)/Юридична адреса (для юр. осіб),Цільове призначення платежу,Код рядка,Текстова розшифровка коду витрат,Сума (грн),Тип бенефіціара,Вид рахунку,Партія,Місцева організація,Код ЄДРПОУ осередку,Номер рахунку,Географічний обʼєкт,Квартал,Рік,Внутрішньопартійні транзакції
11.01.2024,"АТ КБ ""ПРИВАТБАНК""","Договір оренди №86 від 01.01.2021 року, Рахунок-фактура №855 від 29.12.2023 року","ТОВАРИСТВО З ОБМЕЖЕНОЮ ВІДПОВІДАЛЬНІСТЮ ""БПК БРОВАРИ""",38337247,"Київська обл., Броварський р-н, м. Бровари, вул. Гагаріна, буд. 26","плата за оренду згідно договору оренди №86 від 01.01.2021 року та рахунку-фактури №855 від 29.12.2023 року, без пдв",311,"Оренда будинків і приміщень та експлуатаційні витрати (прибирання, страхування орендованих будинків, охорона, сигналізація, ремонт, вивіз сміття, тощо)",3000.0,Юридична особа,Поточний рахунок,КОМАНДА ІГОРЯ САПОЖКА - ЄДНІСТЬ,КИЇВСЬКА ОБЛАСНА організація,43764332,UA103052990000026008040127294,Київська область,1,2024,
29.03.2024,"АТ КБ ""ПРИВАТБАНК""",Договір оренди (найму) нежилого приміщення №01/17 від 01.10.2017 року та акту приймання-передачі б/н від 31.12.2019 року,"ТОВАРИСТВО З ОБМЕЖЕНОЮ ВІДПОВІДАЛЬНІСТЮ ""ІТАК""",16476839,"м. Київ, вул. Вінстона Черчилля, буд. 44","плата за оренду згідно договору оренди (найму) нежилого приміщення №01/17 від 01.10.2017 року та акту приймання-передачі б/н від 31.12.2019 року. у сумі 19166,67 грн, пдв 20% 3833,33 грн",311,"Оренда будинків і приміщень та експлуатаційні витрати (прибирання, страхування орендованих будинків, охорона, сигналізація, ремонт, вивіз сміття, тощо)",23000.0,Юридична особа,Поточний рахунок,КОМАНДА ІГОРЯ САПОЖКА - ЄДНІСТЬ,Центральний офіс,39341474,UA193052990000026007030103865,Київська область,1,2024,
11.01.2024,"АТ КБ ""ПРИВАТБАНК""",Відкрита оферта банку б/н від 15.09.2020 року,"АТ КБ ""ПРИВАТБАНК""",14360570,"м. Київ, вул. Грушевського, буд. 1Д","комісія за виконання платежів в національній валюті, згідно з відкритою офертою банку б/н від 15.09.2020 року та тарифів банку, без пдв",381,Банківські послуги,5.0,Юридична особа,Поточний рахунок,КОМАНДА ІГОРЯ САПОЖКА - ЄДНІСТЬ,КИЇВСЬКА ОБЛАСНА організація,43764332,UA103052990000026008040127294,Київська область,1,2024,
25.01.2024,"АТ КБ ""ПРИВАТБАНК""",Відкрита оферта банку б/н від 15.09.2020 року,"АТ КБ ""ПРИВАТБАНК""",14360570,"м. Київ, вул. Грушевського, буд. 1Д","комісія за виконання платежів в національній валюті, згідно з відкритою офертою банку б/н від 15.09.2020 року та тарифів банку, без пдв",381,Банківські послуги,5.0,Юридична особа,Поточний рахунок,КОМАНДА ІГОРЯ САПОЖКА - ЄДНІСТЬ,КИЇВСЬКА ОБЛАСНА організація,43764332,UA103052990000026008040127294,Київська область,1,2024,
01.02.2024,"АТ КБ ""ПРИВАТБАНК""",Договір банківського рахунку б/н від 15.09.2020 року,"АТ КБ ""ПРИВАТБАНК""",14360570,"м. Київ, вул. Грушевського, буд. 1Д","комісія за обслуговування рахунку за січень 2024 року згідно з договором банківського рахунку б/н від 15.09.2020 року, без пдв",381,Банківські послуги,225.0,Юридична особа,Поточний рахунок,КОМАНДА ІГОРЯ САПОЖКА - ЄДНІСТЬ,КИЇВСЬКА ОБЛАСНА організація,43764332,UA103052990000026008040127294,Київська область,1,2024,
25.03.2024,"АТ КБ ""ПРИВАТБАНК""",Договір банківського рахунку б/н від 09.09.2020 року,"АТ КБ ""ПРИВАТБАНК""",14360570,"м. Київ, вул. Грушевського, буд. 1Д",комісія за обслуговування рахунків згідно з договором банківського рахунку б/н від 09.09.2020 року,381,Банківські послуги,100.0,Юридична особа,Поточний рахунок,КОМАНДА ІГОРЯ САПОЖКА - ЄДНІСТЬ,Центральний офіс,39341474,UA193052990000026007030103865,Київська область,1,2024,
29.03.2024,"АТ КБ ""ПРИВАТБАНК""",Відкрита оферта банку б/н від 09.09.2020 року,"АТ КБ ""ПРИВАТБАНК""",14360570,"м. Київ, вул. Грушевського, буд. 1Д","комісія за виконання платежів в національній валюті, згідно з відкритою офертою банку б/н від 09.09.2020 року та тарифів банку, без пдв",381,Банківські послуги,5.0,Юридична особа,Поточний рахунок,КОМАНДА ІГОРЯ САПОЖКА - ЄДНІСТЬ,Центральний офіс,39341474,UA193052990000026007030103865,Київська область,1,2024,
25.01.2024,"АТ КБ ""ПРИВАТБАНК""",Виконавче провадження 65906654,БРОВАРСЬКИЙ ВІДДІЛ ДЕРЖАВНОЇ ВИКОНАВЧОЇ СЛУЖБИ У БРОВАРСЬКОМУ РАЙОНІ КИЇВСЬКОЇ ОБЛАСТІ ЦЕНТРАЛЬНОГО МІЖРЕГІОНАЛЬНОГО УПРАВЛІННЯ МІНІСТЕРСТВА ЮСТИЦІЇ (М.КИЇВ),34837745,"Київська обл., Броварський р-н, м. Бровари, бульв. Незалежності, буд. 39","101, 43764332, виконавче провадження 65906654, без пдв",364,Інші податки,3100.99,Юридична особа,Поточний рахунок,КОМАНДА ІГОРЯ САПОЖКА - ЄДНІСТЬ,КИЇВСЬКА ОБЛАСНА організація,43764332,UA103052990000026008040127294,Київська область,1,2024,
