НАРОДНА РАДА,ЧЕРНІГІВСЬКА ОБЛАСНА організація,Чернігівська область,36570773,"Чернігівська обл., м. Чернігів, просп. Миру, буд. 32","Чернігівська обл., м. Чернігів, просп. Миру, буд. 32",
НАРОДНА РАДА,ЗАКАРПАТСЬКА ОБЛАСНА організація,Закарпатська область,36254871,"Закарпатська обл., Ужгородський р-н, вул. Духновича О., буд. 3","Закарпатська обл., Ужгородський р-н, вул. Духновича О., буд. 3",
НАРОДНА РАДА,ІВАНО-ФРАНКІВСЬКА ОБЛАСНА організація,Івано-франківська область,36112735,"Івано-франківська обл., Верховинський р-н, присілок Параджино, 256","Івано-франківська обл., Верховинський р-н, присілок Параджино, 256",
НАРОДНА РАДА,ЛЬВІВСЬКА ОБЛАСНА організація,Львівська область,36119175,"Львівська обл., Львівський р-н, вул. Юність, буд. 1","Львівська обл., Львівський р-н, вул. Юність, буд. 1",
НАРОДНА РАДА,ІВАНО-ФРАНКІВСЬКА МІСЬКА ПАРТІЙНА ОРГАНІЗАЦІЯ ПОЛІТИЧНОЇ ПАРТІЇ КОЗАЦЬКА УКРАЇНСЬКА ПАРТІЯ,Івано-франківська область,36733185,"Івано-франківська обл., Івано-Франківський р-н, бульв. Південний, буд. 24Б","Івано-франківська обл., Івано-Франківський р-н, бульв. Південний, буд. 24Б",
НАРОДНА РАДА,ЧЕРКАСЬКА ОБЛАСНА організація,Черкаська область,38368893,"Черкаська обл., Золотоніський р-н, вул. Новоселівська, буд. 11","Черкаська обл., Золотоніський р-н, вул. Новоселівська, буд. 11",
НАРОДНА РАДА,КІРОВОГРАДСЬКА ОБЛАСНА організація,Кіровоградська область,36098501,"Кіровоградська обл., м. Кропивницький, вул. Велика Перспективна, буд. 15/7","Кіровоградська обл., м. Кропивницький, вул. Велика Перспективна, буд. 15/7",
НАРОДНА РАДА,ДОНЕЦЬКА РЕГІОНАЛЬНА ПАРТІЙНА ОРГАНІЗАЦІЯ ПОЛІТИЧНОЇ ПАРТІЇ КОЗАЦЬКА УКРАЇНСЬКА ПАРТІЯ,Донецька область,36615782,"Донецька обл., м. Донецьк, вул. Туполєва, буд. 11","Донецька обл., м. Донецьк, вул. Туполєва, буд. 11",
НАРОДНА РАДА,ЖИТОМИРСЬКА ОБЛАСНА ОРГАНІЗАЦІЯ ПОЛІТИЧНОЇ ПАРТІЇ НАРОДНА,Житомирська область,45121022,"Житомирська обл., м. Житомир, пров. Косачів, буд. 220","Житомирська обл., м. Житомир, пров. Косачів, буд. 220",
НАРОДНА РАДА,ЧЕРНІВЕЦЬКА ОБЛАСНА організація,Чернівецька область,36429869,"Чернівецька обл., Чернівецький р-н, вул. Обнорського Сергія Академіка, буд. 19","Чернівецька обл., Чернівецький р-н, вул. Обнорського Сергія Академіка, буд. 19",
НАРОДНА РАДА,МИКОЛАЇВСЬКА ОБЛАСНА організація,Миколаївська область,36153635,"Миколаївська обл., м. Миколаїв, вул. Погранична, буд. 148","Миколаївська обл., м. Миколаїв, вул. Погранична, буд. 148",
НАРОДНА РАДА,ЛУГАНСЬКА ОБЛАСНА організація,Луганська область,37057864,"Луганська обл., м. Луганськ, 10 квартал, 6","Луганська обл., м. Луганськ, 10 квартал, 6",
НАРОДНА РАДА,ТЕРНОПІЛЬСЬКА ОБЛАСНА організація,Тернопільська область,36508930,"Тернопільська обл., Тернопільський р-н, вул. Живова, буд. 28","Тернопільська обл., Тернопільський р-н, вул. Живова, буд. 28",
НАРОДНА РАДА,ДНІПРОПЕТРОВСЬКА ОБЛАСНА організація,Дніпропетровська область,36075594,"Дніпропетровська обл., м. Дніпро, вул. Сугака, буд. 6","Дніпропетровська обл., м. Дніпро, вул. Сугака, буд. 6",
НАРОДНА РАДА,СЕВАСТОПОЛЬСЬКА МІСЬКА організація,севастополь,36567907,"м.. севастополь, Балаклавський, вул. Гоголя, буд. 31","м.. севастополь, Балаклавський, вул. Гоголя, буд. 31",
НАРОДНА РАДА,ОДЕСЬКА ОБЛАСНА організація,Одеська область,35697026,"Одеська обл., Ізмаїльський р-н, вул. Аеродромна, буд. 419","Одеська обл., Ізмаїльський р-н, вул. Аеродромна, буд. 419",
НАРОДНА РАДА,ТЯЧІВСЬКА РАЙОННА У ЗАКАРПАТСЬКІЙ ОБЛАСТІ ПАРТІЙНА ОРГАНІЗАЦІЯ ПОЛІТИЧНОЇ ПАРТІЇ КОЗАЦЬКА УКРАЇНСЬКА ПАРТІЯ,Закарпатська область,36594401,"Закарпатська обл., Тячівський р-н, вул. Вайди С., буд. 15","Закарпатська обл., Тячівський р-н, вул. Вайди С., буд. 15",
НАРОДНА РАДА,ВОЛИНСЬКА ОБЛАСНА ОРГАНІЗАЦІЯ ПОЛІТИЧНОЇ ПАРТІЇ НАРОДНА,Волинська область,37107396,"Волинська обл., Ковельський р-н, вул. Незалежності, буд. 23","Волинська обл., Ковельський р-н, вул. Незалежності, буд. 23",
НАРОДНА РАДА,ЛЕНІНСЬКА РАЙОННА У М. МИКОЛАЄВІ ПАРТІЙНА ОРГАНІЗАЦІЯ ПОЛІТИЧНОЇ ПАРТІЇ КОЗАЦЬКА УКРАЇНСЬКА ПАРТІЯ,Миколаївська область,36700594,"Миколаївська обл., м. Миколаїв, Херсонське шосе, 46","Миколаївська обл., м. Миколаїв, Херсонське шосе, 46",
НАРОДНА РАДА,ПОЛТАВСЬКА ОБЛАСНА організація,Полтавська область,45064965,"Полтавська обл., м. Полтава, вул. Курчатова, буд. 18А","Полтавська обл., м. Полтава, вул. Курчатова, буд. 18А",
НАРОДНА РАДА,СТАХАНОВСЬКА МІСЬКА У ЛУГАНСЬКІЙ ОБЛАСТІ ПАРТІЙНА ОРГАНІЗАЦІЯ ПОЛІТИЧНОЇ ПАРТІЇ КОЗАЦЬКА УКРАЇНСЬКА ПАРТІЯ,Луганська область,36654753,"Луганська обл., Алчевський р-н, вул. Мананкова, буд. 94","Луганська обл., Алчевський р-н, вул. Мананкова, буд. 94",
НАРОДНА РАДА,ОЛЕКСАНДРІЙСЬКА МІСЬКА У КІРОВОГРАДСЬКІЙ ОБЛАСТІ ПАРТІЙНА ОРГАНІЗАЦІЯ ПОЛІТИЧНОЇ ПАРТІЇ КОЗАЦЬКА УКРАЇНСЬКА ПАРТІЯ,Кіровоградська область,37015232,"Кіровоградська обл., Олександрійський р-н, вул. Іванівська, буд. 10","Кіровоградська обл., Олександрійський р-н, вул. Іванівська, буд. 10",
НАРОДНА РАДА,КИЇВСЬКА МІСЬКА ОРГАНІЗАЦІЯ ПОЛІТИЧНОЇ ПАРТІЇ НАРОДНА,київ,36126549,"м.. київ, Оболонський, вул. Мацієвича Левка, буд. 1","м.. київ, Оболонський, вул. Мацієвича Левка, буд. 1",
НАРОДНА РАДА,ХЕРСОНСЬКА ОБЛАСНА організація,Херсонська область,36130602,"Херсонська обл., м. Херсон, вул. Комкова, буд. 76В","Херсонська обл., м. Херсон, вул. Комкова, буд. 76В",
НАРОДНА РАДА,СВАЛЯВСЬКА РАЙОННА ОРГАНІЗАЦІЯ ПОЛІТИЧНОЇ ПАРТІЇ КОЗАЦЬКА УКРАЇНСЬКА ПАРТІЯ,Закарпатська область,36586406,"Закарпатська обл., Мукачівський р-н, пров. Достоєвського, буд. 7","Закарпатська обл., Мукачівський р-н, пров. Достоєвського, буд. 7",
НАРОДНА РАДА,КИЇВСЬКА ОБЛАСНА ОРГАНІЗАЦІЯ ПОЛІТИЧНОЇ ПАРТІЇ НАРОДНА,Київська область,36999187,"Київська обл., Вишгородський р-н, пров. Валовий, буд. 13","Київська обл., Вишгородський р-н, пров. Валовий, буд. 13",
НАРОДНА РАДА,МИРГОРОДСЬКА МІСЬКА ПАРТІЙНА ОРГАНІЗАЦІЯ КОЗАЦЬКОЇ УКРАЇНСЬКОЇ ПАРТІЇ,Полтавська область,36328707,"Полтавська обл., Миргородський р-н, вул. Воскресінська, буд. 16","Полтавська обл., Миргородський р-н, вул. Воскресінська, буд. 16",
НАРОДНА РАДА,ПЕРЕЯСЛАВ-ХМЕЛЬНИЦЬКА РАЙОННА У КИЇВСЬКІЙ ОБЛАСТІ ПАРТІЙНА ОРГАНІЗАЦІЯ ПОЛІТИЧНОЇ ПАРТІЇ КОЗАЦЬКА УКРАЇНСЬКА ПАРТІЯ,Київська область,36870386,"Київська обл., Бориспільський р-н, вул. Лагерна, буд. 7","Київська обл., Бориспільський р-н, вул. Лагерна, буд. 7",
НАРОДНА РАДА,НОВОСАНЖАРСЬКА РАЙОННА ПАРТІЙНА ОРГАНІЗАЦІЯ ПОЛІТИЧНОЇ ПАРТІЇ КОЗАЦЬКА УКРАЇНСЬКА ПАРТІЯ,Полтавська область,35010562,"Полтавська обл., Полтавський р-н, вул. Ковалівська, буд. 44А","Полтавська обл., Полтавський р-н, вул. Ковалівська, буд. 44А",
НАРОДНА РАДА,БЕРЕГІВСЬКА РАЙОННА ОРГАНІЗАЦІЯ ПОЛІТИЧНОЇ ПАРТІЇ КОЗАЦЬКА УКРАЇНСЬКА ПАРТІЯ,Закарпатська область,36465143,"Закарпатська обл., Берегівський р-н, вул. Венеліна-Гуци, буд. 52","Закарпатська обл., Берегівський р-н, вул. Венеліна-Гуци, буд. 52",
НАРОДНА РАДА,КАНІВСЬКА РАЙОННА У ЧЕРКАСЬКІЙ ОБЛАСТІ ПАРТІЙНА ОРГАНІЗАЦІЯ ПОЛІТИЧНОЇ ПАРТІЇ КОЗАЦЬКА УКРАЇНСЬКА ПАРТІЯ,Черкаська область,36488218,"Черкаська обл., Черкаський р-н, вул. Шевченка, буд. 5","Черкаська обл., Черкаський р-н, вул. Шевченка, буд. 5",
НАРОДНА РАДА,БЕРЕГІВСЬКА МІСЬКА ОРГАНІЗАЦІЯ ПОЛІТИЧНОЇ ПАРТІЇ КОЗАЦЬКА УКРАЇНСЬКА ПАРТІЯ,Закарпатська область,36465138,"Закарпатська обл., Берегівський р-н, вул. Корятовича, буд. 3А","Закарпатська обл., Берегівський р-н, вул. Корятовича, буд. 3А",
НАРОДНА РАДА,Центральний офіс,київ,35962952,"м.. київ, Шевченківський, вул. Багговутівська, буд. 40","м.. київ, Шевченківський, вул. Багговутівська, буд. 40",
