Партія,Місцева організація,Географічний обʼєкт,Ідентифікаційний код юридичної особи за ЄДРПОУ,Місцезнаходження,Фактичне місцезнаходження,"Реквізити банків, у яких відкрито рахунки"
СИЛА НАЦІЇ,ХАРКІВСЬКА ОБЛАСНА організація,Харківська область,39687493,"Харківська обл., м. Харків, вул. Єнісейська, буд. 1","Харківська обл., м. Харків, вул. Єнісейська, буд. 1",
СИЛА НАЦІЇ,ЖИТОМИРСЬКА ОБЛАСНА організація,Житомирська область,39449357,"Житомирська обл., м. Житомир, вул. Перемоги, буд. 10","Житомирська обл., м. Житомир, вул. Перемоги, буд. 10",
СИЛА НАЦІЇ,ЗАКАРПАТСЬКА ОБЛАСНА організація,Закарпатська область,39549828,"Закарпатська обл., Ужгородський р-н, вул. Кошицька, буд. 7","Закарпатська обл., Ужгородський р-н, вул. Кошицька, буд. 7",
СИЛА НАЦІЇ,ЗАПОРІЗЬКА ОБЛАСНА організація,Запорізька область,39683656,"Запорізька обл., м. Запоріжжя, вул. Патріотична, буд. 52","Запорізька обл., м. Запоріжжя, вул. Патріотична, буд. 52",
СИЛА НАЦІЇ,ХМЕЛЬНИЦЬКА ОБЛАСНА організація,Хмельницька область,39720996,"Хмельницька обл., Хмельницький р-н, вул. Сковороди, буд. 9/2","Хмельницька обл., Хмельницький р-н, вул. Сковороди, буд. 9/2",
СИЛА НАЦІЇ,ЛЬВІВСЬКА ОБЛАСНА організація,Львівська область,39700854,"Львівська обл., м. Львів, вул. Шараневича І., буд. 1","Львівська обл., м. Львів, вул. Шараневича І., буд. 1",
СИЛА НАЦІЇ,РІВНЕНСЬКА ОБЛАСНА організація,Рівненська область,39638755,"Рівненська обл., Рівненський р-н, вул. Соборна, буд. 432","Рівненська обл., Рівненський р-н, вул. Соборна, буд. 432",
СИЛА НАЦІЇ,ТЕРНОПІЛЬСЬКА ОБЛАСНА організація,Тернопільська область,39660361,"Тернопільська обл., Тернопільський р-н, вул. За Рудкою, буд. 23","Тернопільська обл., Тернопільський р-н, вул. За Рудкою, буд. 23",
СИЛА НАЦІЇ,Центральний офіс,київ,39334006,"м. київ, Святошинський, вул. Кучера Василя, буд. 2","м. київ, Святошинський, вул. Кучера Василя, буд. 2",
