"Вид фінансових зобовʼязань","Дата виникнення","Сума (вартість) зобовʼязання на момент виникнення","Дата припинення","Сума (вартість) зобовʼязання на момент припинення","ПІБ (для фіз. осіб)/Назва (для юр. осіб)","Ідентифікаційний код (для фіз. осіб)/Код ЄДРПОУ (для юр. осіб)","Місце проживання (для фіз. осіб)/Юридична адреса (для юр. осіб)","Сума (вартість) на кінець звітного періоду, грн","Тип особи","Партія","Місцева організація","Код ЄДРПОУ осередку","Географічний об'єкт","Квартал","Рік"
"За оренду автомобіля у липні","2019-07-30","8050,0",,,"Бардаш Олег Миколайович",,"Київська обл., с. Шибене,","8050,0","фізична особа","Радикальна партія Олега Ляшка","Центральний офіс",37279703,"Україна",3,2020
"Відшкодування витрат за користування електромережами за грудень","2020-09-25","2226,5",,,"ТОВ ""Житло-Сервіс""",30167045,"м. Київ, вул. Протасів яр, 8","2226,5","юридична особа","Радикальна партія Олега Ляшка","Центральний офіс",37279703,"Україна",3,2020
"Інформаційні послуги на телебаченні","2019-03-31","3000000,0",,,"ТОВ МЕДІА ПАРТНЕРСТВО ""БАІНГ""",38990495,"м. Київ, вул. Героїв Космосу, 4","3000000,0","юридична особа","Радикальна партія Олега Ляшка","Центральний офіс",37279703,"Україна",3,2020
"Відшкодування комунальних послуг, оренда приміщення","2020-09-16","1550,16",,,"ПП ""ФК"" Здорова родина""",34078368,"м. Івано-Франківськ, вул. Галицька, 130, кв. 8","1550,16","юридична особа","Радикальна партія Олега Ляшка","Центральний офіс",37279703,"Україна",3,2020
"Плакати","2019-04-24","0,5",,,"ТОВ ""ЦЕРЕЙРА ГРУП""",40818311,"м. Київ, вул. Степана Руданського, 3А, оф. 535","0,5","юридична особа","Радикальна партія Олега Ляшка","Центральний офіс",37279703,"Україна",3,2020
