ЄВРОПЕЙСЬКА ПАРТІЯ УКРАЇНИ,ПУТИЛЬСЬКА РАЙОННА організація,Чернівецька обл.,34831649,"Чернівецька обл.,  Вижницький р-н, вул. Українська, 37","Чернівецька обл.,  Вижницький р-н, вул. Українська, 37",
ЄВРОПЕЙСЬКА ПАРТІЯ УКРАЇНИ,ПУСТОМИТІВСЬКА РАЙОННА організація,Львівська обл.,35347975,"Львівська обл.,  Пустомитівський р-н, вул. Вознесіння, 9","Львівська обл.,  Пустомитівський р-н, вул. Вознесіння, 9",
ЄВРОПЕЙСЬКА ПАРТІЯ УКРАЇНИ,ПУСТОМИТІВСЬКА МІСЬКА організація,Львівська обл.,37278495,"Львівська обл.,  Львівський р-н, вул. Нова, 12","Львівська обл.,  Львівський р-н, вул. Нова, 12",
ЄВРОПЕЙСЬКА ПАРТІЯ УКРАЇНИ,ПОЛТАВСЬКА ОБЛАСНА організація,Полтавська обл.,34962684,"Полтавська обл., м. Полтава, пров. Ветеринарний, 10","Полтавська обл., м. Полтава, пров. Ветеринарний, 10",
ЄВРОПЕЙСЬКА ПАРТІЯ УКРАЇНИ,ПОДІЛЬСЬКА РАЙОННА організація У МІСТІ КИЄВІ,М.київ,34818057,"М.київ,  Подільський, просп. Свободи, 24-Б","М.київ,  Подільський, просп. Свободи, 24-Б",
ЄВРОПЕЙСЬКА ПАРТІЯ УКРАЇНИ,ПЕЧЕРСЬКА РАЙОННА організація,М.київ,36149922,"М.київ,  Печерський, бульв. Дружби народів, 8-А","М.київ,  Печерський, бульв. Дружби народів, 8-А",
ЄВРОПЕЙСЬКА ПАРТІЯ УКРАЇНИ,ПЕРЕМИШЛЯНСЬКА РАЙОННА організація,Львівська обл.,36848146,"Львівська обл.,  Львівський р-н, вул. Липова Алея, 4/7","Львівська обл.,  Львівський р-н, вул. Липова Алея, 4/7",
ЄВРОПЕЙСЬКА ПАРТІЯ УКРАЇНИ,ПЕРВОМАЙСЬКА МІСЬКА організація,Миколаївська обл.,34712247,"Миколаївська обл.,  Первомайський р-н, вул. Жуковського Василя, 91","Миколаївська обл.,  Первомайський р-н, вул. Жуковського Василя, 91",
ЄВРОПЕЙСЬКА ПАРТІЯ УКРАЇНИ,ПЕРВОМАЙСЬКА РАЙОННА організація,Миколаївська обл.,34712199,"Миколаївська обл.,  Первомайський р-н, вул. Жуковського Василя, 91","Миколаївська обл.,  Первомайський р-н, вул. Жуковського Василя, 91",
ЄВРОПЕЙСЬКА ПАРТІЯ УКРАЇНИ,СТАРОСИНЯВСЬКА РАЙОННА організація,Хмельницька обл.,34638986,"Хмельницька обл.,  Хмельницький р-н, вул. Корчагіна, 8","Хмельницька обл.,  Хмельницький р-н, вул. Корчагіна, 8",
ЄВРОПЕЙСЬКА ПАРТІЯ УКРАЇНИ,СОКИРЯНСЬКА РАЙОННА організація,Чернівецька обл.,34091148,"Чернівецька обл.,  Дністровський р-н, вул. Шевченка, 12 А","Чернівецька обл.,  Дністровський р-н, вул. Шевченка, 12 А",
ЄВРОПЕЙСЬКА ПАРТІЯ УКРАЇНИ,СОЛОМʼЯНСЬКА РАЙОННА організація У МІСТІ КИЄВІ,М.київ,34879696,"М.київ,  Солом'янський, вул. Єреванська, 3","М.київ,  Солом'янський, вул. Єреванська, 3",
ЄВРОПЕЙСЬКА ПАРТІЯ УКРАЇНИ,САРАТСЬКА РАЙОННА організація,Одеська обл.,34505304,"Одеська обл.,  Білгород-Дністровський р-н, вул. Вернера Крістіана, 1/48","Одеська обл.,  Білгород-Дністровський р-н, вул. Вернера Крістіана, 1/48",
ЄВРОПЕЙСЬКА ПАРТІЯ УКРАЇНИ,СВЯТОШИНСЬКА РАЙОННА організація У М. КИЄВІ,М.київ,37099705,"М.київ,  Святошинський, просп. Перемоги, 127","М.київ,  Святошинський, просп. Перемоги, 127",
ЄВРОПЕЙСЬКА ПАРТІЯ УКРАЇНИ,САМБІРСЬКА МІСЬКА організація,Львівська обл.,36741877,"Львівська обл.,  Самбірський р-н, вул. Головацького, 16","Львівська обл.,  Самбірський р-н, вул. Головацького, 16",
ЄВРОПЕЙСЬКА ПАРТІЯ УКРАЇНИ,САМБІРСЬКА РАЙОННА організація,Львівська обл.,36741861,"Львівська обл.,  Самбірський р-н, вул. Січових Стрільців, 5","Львівська обл.,  Самбірський р-н, вул. Січових Стрільців, 5",
ЄВРОПЕЙСЬКА ПАРТІЯ УКРАЇНИ,РЖИЩІВСЬКА МІСЬКА організація,Київська обл.,33065578,"Київська обл.,  Обухівський р-н, вул. Пушкіна, 6","Київська обл.,  Обухівський р-н, вул. Пушкіна, 6",
ЄВРОПЕЙСЬКА ПАРТІЯ УКРАЇНИ,РІВНЕНСЬКИЙ ОБЛАСНИЙ ОСЕРЕДОК ПОЛІТИЧНОЇ ПАРТІЇ ЄВРОПЕЙСЬКА ПАРТІЯ УКРАЇНИ,Рівненська обл.,36121378,"Рівненська обл.,  Рівненський р-н, вул. Шкільна, 11","Рівненська обл.,  Рівненський р-н, вул. Шкільна, 11",
ЄВРОПЕЙСЬКА ПАРТІЯ УКРАЇНИ,САВРАНСЬКА РАЙОННА організація,Одеська обл.,34457544,"Одеська обл.,  Подільський р-н, вул. Молодіжна, 14","Одеська обл.,  Подільський р-н, вул. Молодіжна, 14",
ЄВРОПЕЙСЬКА ПАРТІЯ УКРАЇНИ,ФРУНЗІВСЬКА РАЙОННА організація,Одеська обл.,32651921,"Одеська обл.,  Роздільнянський р-н, вул. Гагаріна, 2","Одеська обл.,  Роздільнянський р-н, вул. Гагаріна, 2",
ЄВРОПЕЙСЬКА ПАРТІЯ УКРАЇНИ,ХАРКІВСЬКА ОБЛАСНА організація,Харківська обл.,34859879,"Харківська обл., м. Харків, пров. Причепилівський, 4","Харківська обл., м. Харків, пров. Причепилівський, 4",
ЄВРОПЕЙСЬКА ПАРТІЯ УКРАЇНИ,ТРУСКАВЕЦЬКА МІСЬКА організація,Львівська обл.,35826137,"Львівська обл.,  Дрогобицький р-н, вул. Івасюка В., 3","Львівська обл.,  Дрогобицький р-н, вул. Івасюка В., 3",
ЄВРОПЕЙСЬКА ПАРТІЯ УКРАЇНИ,ФРАНКІВСЬКА РАЙОННА організація,Львівська обл.,34904748,"Львівська обл., м. Львів, вул. Наукова, 64","Львівська обл., м. Львів, вул. Наукова, 64",
ЄВРОПЕЙСЬКА ПАРТІЯ УКРАЇНИ,ТАТАРБУНАРСЬКА РАЙОННА організація,Одеська обл.,34890505,"Одеська обл.,  Білгород-Дністровський р-н, вул. Мічуріна, 1","Одеська обл.,  Білгород-Дністровський р-н, вул. Мічуріна, 1",
ЄВРОПЕЙСЬКА ПАРТІЯ УКРАЇНИ,ТАЛЬНІВСЬКА РАЙОННА організація,Черкаська обл.,34527202,"Черкаська обл.,  Звенигородський р-н, вул. Чумацька, 49","Черкаська обл.,  Звенигородський р-н, вул. Чумацька, 49",
ЄВРОПЕЙСЬКА ПАРТІЯ УКРАЇНИ,ТЕРНОПІЛЬСЬКА ОБЛАСНА організація,Тернопільська обл.,36314151,"Тернопільська обл.,  Тернопільський р-н, вул. Вербицького М., 5","Тернопільська обл.,  Тернопільський р-н, вул. Вербицького М., 5",
ЄВРОПЕЙСЬКА ПАРТІЯ УКРАЇНИ,СТРИЙСЬКА МІСЬКА організація,Львівська обл.,34962354,"Львівська обл.,  Стрийський р-н, вул. Грабовецька, 64","Львівська обл.,  Стрийський р-н, вул. Грабовецька, 64",
ЄВРОПЕЙСЬКА ПАРТІЯ УКРАЇНИ,СУМСЬКА ОБЛАСНА організація,Сумська обл.,34743610,"Сумська обл., м. Суми, вул. Покровська, 7","Сумська обл., м. Суми, вул. Покровська, 7",
ЄВРОПЕЙСЬКА ПАРТІЯ УКРАЇНИ,СТОРОЖИНЕЦЬКА РАЙОННА організація,Чернівецька обл.,34324564,"Чернівецька обл.,  Чернівецький р-н, вул. Поповича П., 12","Чернівецька обл.,  Чернівецький р-н, вул. Поповича П., 12",
ЄВРОПЕЙСЬКА ПАРТІЯ УКРАЇНИ,ХЕРСОНСЬКА ОБЛАСНА організація,Херсонська обл.,36236365,"Херсонська обл., м. Херсон, вул. Чорноморська, 6","Херсонська обл., м. Херсон, вул. Чорноморська, 6",
ЄВРОПЕЙСЬКА ПАРТІЯ УКРАЇНИ,ХМЕЛЬНИЦЬКА МІСЬКА організація,Хмельницька обл.,34912874,"Хмельницька обл.,  Хмельницький р-н, вул. Героїв АТО, 6","Хмельницька обл.,  Хмельницький р-н, вул. Героїв АТО, 6",
ЄВРОПЕЙСЬКА ПАРТІЯ УКРАЇНИ,ЧЕРНІВЕЦЬКА ОБЛАСНА організація,Чернівецька обл.,34913108,"Чернівецька обл.,  Чернівецький р-н, вул. Івасюка Володимира, 17","Чернівецька обл.,  Чернівецький р-н, вул. Івасюка Володимира, 17",
ЄВРОПЕЙСЬКА ПАРТІЯ УКРАЇНИ,ЧЕРНІВЕЦЬКА МІСЬКА організація,Чернівецька обл.,34913145,"Чернівецька обл.,  Чернівецький р-н, вул. Івасюка Володимира, 17","Чернівецька обл.,  Чернівецький р-н, вул. Івасюка Володимира, 17",
ЄВРОПЕЙСЬКА ПАРТІЯ УКРАЇНИ,ХОТИНСЬКА РАЙОННА організація,Чернівецька обл.,34907548,"Чернівецька обл.,  Дністровський р-н, вул. Яремчука Назарія, 31А","Чернівецька обл.,  Дністровський р-н, вул. Яремчука Назарія, 31А",
ЄВРОПЕЙСЬКА ПАРТІЯ УКРАЇНИ,ХРИСТИНІВСЬКА РАЙОННА організація,Черкаська обл.,34891577,"Черкаська обл.,  Уманський р-н, вул. Панченків, 47","Черкаська обл.,  Уманський р-н, вул. Панченків, 47",
ЄВРОПЕЙСЬКА ПАРТІЯ УКРАЇНИ,ЧЕРКАСЬКА ОБЛАСНА організація,Черкаська обл.,34863487,"Черкаська обл., м. Черкаси, вул. Небесної Сотні, 3","Черкаська обл., м. Черкаси, вул. Небесної Сотні, 3",
ЄВРОПЕЙСЬКА ПАРТІЯ УКРАЇНИ,ШЕВЧЕНКІВСЬКА РАЙОННА організація,Львівська обл.,34904507,"Львівська обл., м. Львів, вул. Турянського О., 18","Львівська обл., м. Львів, вул. Турянського О., 18",
ЄВРОПЕЙСЬКА ПАРТІЯ УКРАЇНИ,ШЕВЧЕНКІВСЬКА РАЙОННА організація У МІСТІ КИЄВІ,М.київ,34795915,"М.київ,  Шевченківський, вул. Златоустівська, 51","М.київ,  Шевченківський, вул. Златоустівська, 51",
ЄВРОПЕЙСЬКА ПАРТІЯ УКРАЇНИ,ШЕПЕТІВСЬКА МІСЬКА організація,Хмельницька обл.,34639293,"Хмельницька обл.,  Шепетівський р-н, вул. Українська, 65","Хмельницька обл.,  Шепетівський р-н, вул. Українська, 65",
ЄВРОПЕЙСЬКА ПАРТІЯ УКРАЇНИ,ШИРЯЇВСЬКА РАЙОННА організація,Одеська обл.,34858084,"Одеська обл.,  Березівський р-н, вул. Гордійчука генерала, 4","Одеська обл.,  Березівський р-н, вул. Гордійчука генерала, 4",
ЄВРОПЕЙСЬКА ПАРТІЯ УКРАЇНИ,ХМІЛЬНИЦЬКА МІСЬКА організація,Вінницька обл.,40034009,"Вінницька обл.,  Хмільницький р-н, вул. Котляревського, 84","Вінницька обл.,  Хмільницький р-н, вул. Котляревського, 84",
ЄВРОПЕЙСЬКА ПАРТІЯ УКРАЇНИ,ХМІЛЬНИЦЬКА РАЙОННА організація,Вінницька обл.,34849216,"Вінницька обл.,  Хмільницький р-н, вул. Джерельна, 18","Вінницька обл.,  Хмільницький р-н, вул. Джерельна, 18",
ЄВРОПЕЙСЬКА ПАРТІЯ УКРАЇНИ,ВІННИЦЬКА МІСЬКА організація,Вінницька обл.,34939421,"Вінницька обл.,  Вінницький р-н, вул. 600-річчя, 25","Вінницька обл.,  Вінницький р-н, вул. 600-річчя, 25","Філія ВІННИЦЬКЕ ОУ АТ ""ОЩАДБАНК"", ЄДРПОУ: 09302607, р/р № UA493020760000026002300155749"
ЄВРОПЕЙСЬКА ПАРТІЯ УКРАЇНИ,ДНІПРОВСЬКА РАЙОННА організація У М.КИЄВІ,М.київ,34806015,"М.київ,  Дніпровський, вул. Марганецька, 24","М.київ,  Дніпровський, вул. Марганецька, 24",
ЄВРОПЕЙСЬКА ПАРТІЯ УКРАЇНИ,ДНІПРОДЗЕРЖИНСЬКА МІСЬКА організація,Дніпропетровська обл.,34827475,"Дніпропетровська обл., м. Кам'янське, просп. Шевченка Тараса, 6","Дніпропетровська обл., м. Кам'янське, просп. Шевченка Тараса, 6",
ЄВРОПЕЙСЬКА ПАРТІЯ УКРАЇНИ,ЗОЛОЧІВСЬКА РАЙОННА організація,Львівська обл.,35263398,"Львівська обл.,  Золочівський р-н, вул. Труша І., 1","Львівська обл.,  Золочівський р-н, вул. Труша І., 1","АТ ""ОЩАДБАНК"", ЄДРПОУ: 09325703, р/р № UA843257960000026009300740265"
ЄВРОПЕЙСЬКА ПАРТІЯ УКРАЇНИ,КІРОВОГРАДСЬКА ОБЛАСНА організація,Кіровоградська обл.,34869834,"Кіровоградська обл., м. Кропивницький, вул. Маланюка Євгена, 2","Кіровоградська обл., м. Кропивницький, вул. Маланюка Євгена, 2","АТ КБ ""ПРИВАТБАНК"", ЄДРПОУ: 14360570, р/р № UA053052990000026000045104726"
ЄВРОПЕЙСЬКА ПАРТІЯ УКРАЇНИ,ЛЬВІВСЬКА ОБЛАСНА організація,Львівська обл.,34942977,"Львівська обл., м. Львів, вул. Липинського В., 36","Львівська обл., м. Львів, вул. Липинського В., 36","АТ ""РАЙФФАЙЗЕН БАНК АВАЛЬ"", ЄДРПОУ: 14305909, р/р № UA093808050000000026006700829"
ЄВРОПЕЙСЬКА ПАРТІЯ УКРАЇНИ,ЧЕРНІГІВСЬКА РЕГІОНАЛЬНА ОРГАНІЗАЦІЯ ПОЛІТИЧНОЇ ПАРТІЇ ЄВРОПЕЙСЬКА ПАРТІЯ УКРАЇНИ,Чернігівська обл.,35884052,"Чернігівська обл., м. Чернігів, просп. Миру, 204","Чернігівська обл., м. Чернігів, просп. Миру, 204","АТ КБ ""ПРИВАТБАНК"", ЄДРПОУ: 14360570, р/р № UA493052990000026000046305182"
ЄВРОПЕЙСЬКА ПАРТІЯ УКРАЇНИ,Центральний офіс,М.київ,34494649,"М.київ,  Подільський, вул. Оболонська, 13-15","М.київ,  Подільський, вул. Оболонська, 13-15","АТ ""Райффайзен Банк"", ЄДРПОУ: 14305909, р/р № UA353808050000000026007128325"
