Партія,Місцева організація,Географічний обʼєкт,Ідентифікаційний код юридичної особи за ЄДРПОУ,Місцезнаходження,Фактичне місцезнаходження,"Реквізити банків, у яких відкрито рахунки"
ЄВРОПЕЙСЬКА ПАРТІЯ УКРАЇНИ,АРБУЗИНСЬКА РАЙОННА організація,Миколаївська обл.,34799637,"Миколаївська обл.,  Первомайський р-н, вул. Шевченка, 208","Миколаївська обл.,  Первомайський р-н, вул. Шевченка, 208",
ЄВРОПЕЙСЬКА ПАРТІЯ УКРАЇНИ,БЕРЕЗІВСЬКА РАЙОННА організація,Одеська обл.,34712671,"Одеська обл.,  Березівський р-н, вул. Набережна, 8","Одеська обл.,  Березівський р-н, вул. Набережна, 8",
ЄВРОПЕЙСЬКА ПАРТІЯ УКРАЇНИ,БЕРЕЗНЕГУВАТСЬКА РАЙОННА організація,Миколаївська обл.,34515443,"Миколаївська обл.,  Баштанський р-н, вул. 1 Травня, 96","Миколаївська обл.,  Баштанський р-н, вул. 1 Травня, 96",
ЄВРОПЕЙСЬКА ПАРТІЯ УКРАЇНИ,БІЛГОРОД-ДНІСТРОВСЬКА РАЙОННА організація,Одеська обл.,34611917,"Одеська обл.,  Білгород-Дністровський р-н, вул. Зелена, 22","Одеська обл.,  Білгород-Дністровський р-н, вул. Зелена, 22",
ЄВРОПЕЙСЬКА ПАРТІЯ УКРАЇНИ,БІЛЯЇВСЬКА РАЙОННА організація,Одеська обл.,34890217,"Одеська обл.,  Одеський р-н, nan, 10","Одеська обл.,  Одеський р-н, nan, 10",
ЄВРОПЕЙСЬКА ПАРТІЯ УКРАЇНИ,БОГОДУХІВСЬКА РАЙОННА ОРГАНІЗАЦІЯ ЄВРОПЕЙСЬКОЇ ПАРТІЇ УКРАЇНИ,Харківська обл.,34970790,"Харківська обл.,  Богодухівський р-н, вул. Первухінська, 37","Харківська обл.,  Богодухівський р-н, вул. Первухінська, 37",
ЄВРОПЕЙСЬКА ПАРТІЯ УКРАЇНИ,БОЛГРАДСЬКА РАЙОННА організація,Одеська обл.,34559957,"Одеська обл.,  Болградський р-н, вул. Паризької Комуни, 34","Одеська обл.,  Болградський р-н, вул. Паризької Комуни, 34",
ЄВРОПЕЙСЬКА ПАРТІЯ УКРАЇНИ,БРОВАРСЬКА РАЙОННА організація,Київська обл.,34837310,"Київська обл.,  Броварський р-н, вул. Шевченка, 6","Київська обл.,  Броварський р-н, вул. Шевченка, 6",
ЄВРОПЕЙСЬКА ПАРТІЯ УКРАЇНИ,БУСЬКА РАЙОННА ОРГАНІЗАЦІЯ ЛЬВІВСЬКОЇ ОБЛАСТІ ПОЛІТИЧНОЇ ПАРТІЇ ЕВРОПЕЙСЬКА ПАРТІЯ УКРАЇНИ,Львівська обл.,35313904,"Львівська обл.,  Золочівський р-н, nan,  ","Львівська обл.,  Золочівський р-н, nan,  ",
ЄВРОПЕЙСЬКА ПАРТІЯ УКРАЇНИ,ВИЖНИЦЬКА РАЙОННА організація,Чернівецька обл.,34831518,"Чернівецька обл.,  Вижницький р-н, вул. Соборна, 11","Чернівецька обл.,  Вижницький р-н, вул. Соборна, 11",
ЄВРОПЕЙСЬКА ПАРТІЯ УКРАЇНИ,ВИННИКІВСЬКА МІСЬКА організація,Львівська обл.,35047765,"Львівська обл.,  Львівський р-н, вул. Галицька, 2 А","Львівська обл.,  Львівський р-н, вул. Галицька, 2 А",
ЄВРОПЕЙСЬКА ПАРТІЯ УКРАЇНИ,ВІННИЦЬКА ОБЛАСНА організація,Вінницька обл.,34939571,"Вінницька обл.,  Вінницький р-н, вул. Пирогова, 23","Вінницька обл.,  Вінницький р-н, вул. Пирогова, 23",
ЄВРОПЕЙСЬКА ПАРТІЯ УКРАЇНИ,ВОЗНЕСЕНСЬКА МІСЬКА ОРГАНІЗАЦІЯ ЄВРОПЕЙСЬКОЇ ПАРТІЇ УКРАЇНИ,Миколаївська обл.,34784217,"Миколаївська обл.,  Вознесенський р-н, вул. Соборності, 53","Миколаївська обл.,  Вознесенський р-н, вул. Соборності, 53",
ЄВРОПЕЙСЬКА ПАРТІЯ УКРАЇНИ,ВОЗНЕСЕНСЬКА РАЙОННА ОРГАНІЗАЦІЯ ЄВРОПЕЙСЬКОЇ ПАРТІЇ УКРАЇНИ,Миколаївська обл.,34792343,"Миколаївська обл.,  Вознесенський р-н, пров. Фонтанний, 7","Миколаївська обл.,  Вознесенський р-н, пров. Фонтанний, 7",
ЄВРОПЕЙСЬКА ПАРТІЯ УКРАЇНИ,ВОЛИНСЬКА ОБЛАСНА організація,Волинська обл.,35782273,"Волинська обл.,  Луцький р-н, вул. Сверстюка Євгена, 1","Волинська обл.,  Луцький р-н, вул. Сверстюка Євгена, 1",
ЄВРОПЕЙСЬКА ПАРТІЯ УКРАЇНИ,ВОЛОДАРСЬК-ВОЛИНСЬКА РАЙОННА організація,Житомирська обл.,35689151,"Житомирська обл.,  Житомирський р-н, вул. Героїв України, 50","Житомирська обл.,  Житомирський р-н, вул. Героїв України, 50",
ЄВРОПЕЙСЬКА ПАРТІЯ УКРАЇНИ,ГАЛИЦЬКА РАЙОННА організація,Львівська обл.,35101442,"Львівська обл., м. Львів, пл. Князя Святослава, 5В","Львівська обл., м. Львів, пл. Князя Святослава, 5В",
ЄВРОПЕЙСЬКА ПАРТІЯ УКРАЇНИ,ГЕРЦАЇВСЬКА РАЙОННА організація,Чернівецька обл.,34634562,"Чернівецька обл.,  Чернівецький р-н, nan,  ","Чернівецька обл.,  Чернівецький р-н, nan,  ",
ЄВРОПЕЙСЬКА ПАРТІЯ УКРАЇНИ,ГЛИБОЦЬКА РАЙОННА організація,Чернівецька обл.,34864119,"Чернівецька обл.,  Чернівецький р-н, вул. Стасюка, 2А","Чернівецька обл.,  Чернівецький р-н, вул. Стасюка, 2А",
ЄВРОПЕЙСЬКА ПАРТІЯ УКРАЇНИ,ГОЛОСІЇВСЬКА РАЙОННА організація У М.КИЄВІ,М.київ,36376504,"М.київ,  Голосіївський, вул. Велика Китаївська, 10","М.київ,  Голосіївський, вул. Велика Китаївська, 10",
ЄВРОПЕЙСЬКА ПАРТІЯ УКРАЇНИ,ЖОВКІВСЬКА РАЙОННА організація,Львівська обл.,35344089,"Львівська обл.,  Львівський р-н, вул. Шевченка, 45","Львівська обл.,  Львівський р-н, вул. Шевченка, 45",
ЄВРОПЕЙСЬКА ПАРТІЯ УКРАЇНИ,ЖИТОМИРСЬКА РАЙОННА організація,Житомирська обл.,35185048,"Житомирська обл.,  Житомирський р-н, вул. Першотравнева, 22","Житомирська обл.,  Житомирський р-н, вул. Першотравнева, 22",
ЄВРОПЕЙСЬКА ПАРТІЯ УКРАЇНИ,ЖАШКІВСЬКА РАЙОННА організація,Черкаська обл.,34678772,"Черкаська обл.,  Уманський р-н, вул. Соборна, 27","Черкаська обл.,  Уманський р-н, вул. Соборна, 27",
ЄВРОПЕЙСЬКА ПАРТІЯ УКРАЇНИ,ЄМІЛЬЧИНСЬКА РАЙОННА організація,Житомирська обл.,35078950,"Житомирська обл.,  Новоград-Волинський р-н, вул. Добровольського, 9","Житомирська обл.,  Новоград-Волинський р-н, вул. Добровольського, 9",
ЄВРОПЕЙСЬКА ПАРТІЯ УКРАЇНИ,ДРАБІВСЬКА РАЙОННА організація,Черкаська обл.,34238292,"Черкаська обл.,  Золотоніський р-н, вул. Центральна, 67","Черкаська обл.,  Золотоніський р-н, вул. Центральна, 67",
ЄВРОПЕЙСЬКА ПАРТІЯ УКРАЇНИ,ДОЛИНСЬКА РАЙОННА організація,Івано-франківська обл.,36734262,"Івано-франківська обл.,  Калуський р-н, вул. Хмельницького, 13","Івано-франківська обл.,  Калуський р-н, вул. Хмельницького, 13",
ЄВРОПЕЙСЬКА ПАРТІЯ УКРАЇНИ,ДЕСНЯНСЬКА РАЙОННА організація,М.київ,34751031,"М.київ,  Деснянський, вул. Мілютенка, 28-В","М.київ,  Деснянський, вул. Мілютенка, 28-В",
ЄВРОПЕЙСЬКА ПАРТІЯ УКРАЇНИ,ДАРНИЦЬКА РАЙОННА організація У М. КИЄВІ,М.київ,34770969,"М.київ,  Дарницький, просп. Бажана Миколи, 24","М.київ,  Дарницький, просп. Бажана Миколи, 24",
ЄВРОПЕЙСЬКА ПАРТІЯ УКРАЇНИ,ГОРОДОЦЬКА РАЙОННА організація,Хмельницька обл.,34891205,"Хмельницька обл.,  Хмельницький р-н, вул. Гончара О., 4","Хмельницька обл.,  Хмельницький р-н, вул. Гончара О., 4",
ЄВРОПЕЙСЬКА ПАРТІЯ УКРАЇНИ,ГОРОДИЩЕНСЬКА РАЙОННА організація,Черкаська обл.,34793986,"Черкаська обл.,  Звенигородський р-н, вул. Молодіжна, 11","Черкаська обл.,  Звенигородський р-н, вул. Молодіжна, 11",
ЄВРОПЕЙСЬКА ПАРТІЯ УКРАЇНИ,ЖОВТНЕВА РАЙОННА організація,Миколаївська обл.,34472803,"Миколаївська обл.,  Миколаївський р-н, вул. Лісна, 2","Миколаївська обл.,  Миколаївський р-н, вул. Лісна, 2",
ЄВРОПЕЙСЬКА ПАРТІЯ УКРАЇНИ,ЗАКАРПАТСЬКА ОБЛАСНА організація,Закарпатська обл.,36254960,"Закарпатська обл.,  Ужгородський р-н, просп. Свободи, 2","Закарпатська обл.,  Ужгородський р-н, просп. Свободи, 2",
ЄВРОПЕЙСЬКА ПАРТІЯ УКРАЇНИ,ЗАЛІЗНИЧНА РАЙОННА організація,Львівська обл.,34904418,"Львівська обл., м. Львів, вул. Гушалевича І., 8А","Львівська обл., м. Львів, вул. Гушалевича І., 8А",
ЄВРОПЕЙСЬКА ПАРТІЯ УКРАЇНИ,ЗАПОРІЗЬКА ОБЛАСНА організація,Запорізька обл.,34976016,"Запорізька обл., м. Запоріжжя, вул. Яценка, 4","Запорізька обл., м. Запоріжжя, вул. Яценка, 4",
ЄВРОПЕЙСЬКА ПАРТІЯ УКРАЇНИ,ЗАСТАВНІВСЬКА РАЙОННА організація,Чернівецька обл.,34907890,"Чернівецька обл.,  Чернівецький р-н, nan,  ","Чернівецька обл.,  Чернівецький р-н, nan,  ",
ЄВРОПЕЙСЬКА ПАРТІЯ УКРАЇНИ,ЗОЛОЧІВСЬКА МІСЬКА організація,Львівська обл.,39967100,"Львівська обл.,  Золочівський р-н, вул. Труша І., 1","Львівська обл.,  Золочівський р-н, вул. Труша І., 1",
ЄВРОПЕЙСЬКА ПАРТІЯ УКРАЇНИ,ЗОЛОЧІВСЬКА РАЙОННА організація,Харківська обл.,34923273,"Харківська обл.,  Богодухівський р-н, вул. Комарова, 73","Харківська обл.,  Богодухівський р-н, вул. Комарова, 73",
ЄВРОПЕЙСЬКА ПАРТІЯ УКРАЇНИ,КАНІВСЬКА РАЙОННА організація,Черкаська обл.,34863340,"Черкаська обл.,  Черкаський р-н, вул. Гагаріна, 11","Черкаська обл.,  Черкаський р-н, вул. Гагаріна, 11",
ЄВРОПЕЙСЬКА ПАРТІЯ УКРАЇНИ,КАМʼЯНКА-БУЗЬКА РАЙОННА організація,Львівська обл.,35581695,"Львівська обл.,  Львівський р-н, nan,  ","Львівська обл.,  Львівський р-н, nan,  ",
ЄВРОПЕЙСЬКА ПАРТІЯ УКРАЇНИ,КАМʼЯНЕЦЬ-ПОДІЛЬСЬКА МІСЬКА організація,Хмельницька обл.,35028868,"Хмельницька обл.,  Кам'янець-Подільський р-н, вул. Драй-Хмари, 44","Хмельницька обл.,  Кам'янець-Подільський р-н, вул. Драй-Хмари, 44",
ЄВРОПЕЙСЬКА ПАРТІЯ УКРАЇНИ,КАЛИНІВСЬКА РАЙОННА організація,Вінницька обл.,38628133,"Вінницька обл.,  Хмільницький р-н, вул. Промислова, 28","Вінницька обл.,  Хмільницький р-н, вул. Промислова, 28",
ЄВРОПЕЙСЬКА ПАРТІЯ УКРАЇНИ,ІВАНО-ФРАНКІВСЬКА ОБЛАСНА організація,Івано-франківська обл.,36117335,"Івано-франківська обл.,  Івано-Франківський р-н, вул. Військових ветеранів, 10","Івано-франківська обл.,  Івано-Франківський р-н, вул. Військових ветеранів, 10",
ЄВРОПЕЙСЬКА ПАРТІЯ УКРАЇНИ,ІВАНІВСЬКА РАЙОННА організація,Одеська обл.,34397391,"Одеська обл.,  Березівський р-н, вул. Виноградна, 42-А","Одеська обл.,  Березівський р-н, вул. Виноградна, 42-А",
ЄВРОПЕЙСЬКА ПАРТІЯ УКРАЇНИ,КРАСНООКНЯНСЬКА РАЙОННА організація,Одеська обл.,34254288,"Одеська обл.,  Подільський р-н, вул. Терехова, 9","Одеська обл.,  Подільський р-н, вул. Терехова, 9",
ЄВРОПЕЙСЬКА ПАРТІЯ УКРАЇНИ,КОЗЯТИНСЬКА РАЙОННА організація,Вінницька обл.,34841421,"Вінницька обл.,  Хмільницький р-н, вул. Довженка О., 36","Вінницька обл.,  Хмільницький р-н, вул. Довженка О., 36",
ЄВРОПЕЙСЬКА ПАРТІЯ УКРАЇНИ,КРАСНОГРАДСЬКА РАЙОННА ОРГАНІЗАЦІЯ ЄВРОПЕЙСЬКОЇ ПАРТІЇ УКРАЇНИ,Харківська обл.,34236871,"Харківська обл.,  Красноградський р-н, вул. Харківська, 125","Харківська обл.,  Красноградський р-н, вул. Харківська, 125",
ЄВРОПЕЙСЬКА ПАРТІЯ УКРАЇНИ,КІЦМАНСЬКА РАЙОННА організація,Чернівецька обл.,34678919,"Чернівецька обл.,  Чернівецький р-н, вул. Головна, 55","Чернівецька обл.,  Чернівецький р-н, вул. Головна, 55",
ЄВРОПЕЙСЬКА ПАРТІЯ УКРАЇНИ,КІРОВОГРАДСЬКА МІСЬКА організація,Кіровоградська обл.,38212084,"Кіровоградська обл., м. Кропивницький, вул. Маланюка Євгена, 2","Кіровоградська обл., м. Кропивницький, вул. Маланюка Євгена, 2",
ЄВРОПЕЙСЬКА ПАРТІЯ УКРАЇНИ,КИЇВСЬКА ОБЛАСНА організація,Київська обл.,34977051,"Київська обл.,  Білоцерківський р-н, пров. Незалежності, 7","Київська обл.,  Білоцерківський р-н, пров. Незалежності, 7",
ЄВРОПЕЙСЬКА ПАРТІЯ УКРАЇНИ,КИЇВСЬКА МІСЬКА організація,М.київ,34927456,"М.київ,  Подільський, вул. Оболонська, 13-15","М.київ,  Подільський, вул. Оболонська, 13-15",
ЄВРОПЕЙСЬКА ПАРТІЯ УКРАЇНИ,ЛЬВІВСЬКА МІСЬКА організація,Львівська обл.,34904711,"Львівська обл., м. Львів, вул. Володимира Великого, 16","Львівська обл., м. Львів, вул. Володимира Великого, 16",
ЄВРОПЕЙСЬКА ПАРТІЯ УКРАЇНИ,ЛУЦЬКА МІСЬКА організація,Волинська обл.,37003819,"Волинська обл.,  Луцький р-н, вул. Сверстюка Євгена, 1","Волинська обл.,  Луцький р-н, вул. Сверстюка Євгена, 1",
ЄВРОПЕЙСЬКА ПАРТІЯ УКРАЇНИ,ЛИЧАКІВСЬКА РАЙОННА організація,Львівська обл.,35047917,"Львівська обл., м. Винники, вул. Космонавтів, 27","Львівська обл., м. Винники, вул. Космонавтів, 27",
ЄВРОПЕЙСЬКА ПАРТІЯ УКРАЇНИ,КУЗНЕЦОВСЬКА МІСЬКА організація,Рівненська обл.,37198347,"Рівненська обл.,  Вараський р-н, вул. Комунальна, 15","Рівненська обл.,  Вараський р-н, вул. Комунальна, 15",
ЄВРОПЕЙСЬКА ПАРТІЯ УКРАЇНИ,КРИВОРІЗЬКА МІСЬКА організація,Дніпропетровська обл.,36418329,"Дніпропетровська обл., м. Кривий Ріг, вул. Героїв АТО, 17","Дніпропетровська обл., м. Кривий Ріг, вул. Героїв АТО, 17",
ЄВРОПЕЙСЬКА ПАРТІЯ УКРАЇНИ,НОВОБУЗЬКА РАЙОННА організація,Миколаївська обл.,34543067,"Миколаївська обл.,  Баштанський р-н, nan, Куйбишева","Миколаївська обл.,  Баштанський р-н, nan, Куйбишева",
ЄВРОПЕЙСЬКА ПАРТІЯ УКРАЇНИ,МОНАСТИРИЩЕНСЬКА РАЙОННА організація,Черкаська обл.,34324229,"Черкаська обл.,  Уманський р-н, пров. Кармелюка, 3","Черкаська обл.,  Уманський р-н, пров. Кармелюка, 3",
ЄВРОПЕЙСЬКА ПАРТІЯ УКРАЇНИ,МИРОНІВСЬКИЙ РАЙОННИЙ ОСЕРЕДОК ПОЛІТИЧНОЇ ПАРТІЇ ЄВРОПЕЙСЬКА ПАРТІЯ УКРАЇНИ,Київська обл.,34970192,"Київська обл.,  Обухівський р-н, пров. Привокзальний, 6","Київська обл.,  Обухівський р-н, пров. Привокзальний, 6",
ЄВРОПЕЙСЬКА ПАРТІЯ УКРАЇНИ,МОГИЛІВ-ПОДІЛЬСЬКА МІСЬКА організація,Вінницька обл.,40750463,"Вінницька обл.,  Могилів-Подільський р-н, вул. Стуса Василя, 63-А","Вінницька обл.,  Могилів-Подільський р-н, вул. Стуса Василя, 63-А",
ЄВРОПЕЙСЬКА ПАРТІЯ УКРАЇНИ,МИКОЛАЇВСЬКА РАЙОННА організація,Львівська обл.,35048114,"Львівська обл.,  Стрийський р-н, вул. Тарла М., 6","Львівська обл.,  Стрийський р-н, вул. Тарла М., 6",
ЄВРОПЕЙСЬКА ПАРТІЯ УКРАЇНИ,МИКОЛАЇВСЬКА РАЙОННА організація,Миколаївська обл.,34921805,"Миколаївська обл.,  Миколаївський р-н, вул. Зелена, 5","Миколаївська обл.,  Миколаївський р-н, вул. Зелена, 5",
ЄВРОПЕЙСЬКА ПАРТІЯ УКРАЇНИ,МИКОЛАЇВСЬКА ОБЛАСНА організація,Миколаївська обл.,34889641,"Миколаївська обл., м. Миколаїв, вул. Колодязна, 16","Миколаївська обл., м. Миколаїв, вул. Колодязна, 16",
ЄВРОПЕЙСЬКА ПАРТІЯ УКРАЇНИ,МИКОЛАЇВСЬКА МІСЬКА організація,Миколаївська обл.,34889826,"Миколаївська обл., м. Миколаїв, вул. Миколаївська, 22","Миколаївська обл., м. Миколаїв, вул. Миколаївська, 22",
ЄВРОПЕЙСЬКА ПАРТІЯ УКРАЇНИ,МАНЬКІВСЬКА РАЙОННА організація,Черкаська обл.,34089605,"Черкаська обл.,  Уманський р-н, вул. Затишна, 2","Черкаська обл.,  Уманський р-н, вул. Затишна, 2",
ЄВРОПЕЙСЬКА ПАРТІЯ УКРАЇНИ,ОЧАКІВСЬКА МІСЬКА організація,Миколаївська обл.,34650922,"Миколаївська обл.,  Миколаївський р-н, вул. Пілієва, 48","Миколаївська обл.,  Миколаївський р-н, вул. Пілієва, 48",
ЄВРОПЕЙСЬКА ПАРТІЯ УКРАЇНИ,ОЧАКІВСЬКА РАЙОННА організація,Миколаївська обл.,34650893,"Миколаївська обл.,  Миколаївський р-н, вул. Пілієва, 48","Миколаївська обл.,  Миколаївський р-н, вул. Пілієва, 48",
ЄВРОПЕЙСЬКА ПАРТІЯ УКРАЇНИ,ОДЕСЬКА ОБЛАСНА організація,Одеська обл.,34995002,"Одеська обл., м. Одеса, вул. Балківська, 120/1","Одеська обл., м. Одеса, вул. Балківська, 120/1",
ЄВРОПЕЙСЬКА ПАРТІЯ УКРАЇНИ,ОДЕСЬКА МІСЬКА організація,Одеська обл.,34995442,"Одеська обл., м. Одеса, вул. Середньофонтанська, 47/51","Одеська обл., м. Одеса, вул. Середньофонтанська, 47/51",
ЄВРОПЕЙСЬКА ПАРТІЯ УКРАЇНИ,ОБОЛОНСЬКА РАЙОННА організація,М.київ,36187444,"М.київ,  Оболонський, вул. Північна, 54-Б","М.київ,  Оболонський, вул. Північна, 54-Б",
ЄВРОПЕЙСЬКА ПАРТІЯ УКРАЇНИ,НОВОУШИЦЬКА РАЙОННА організація,Хмельницька обл.,34744290,"Хмельницька обл.,  Кам'янець-Подільський р-н, вул. Гагаріна, 105","Хмельницька обл.,  Кам'янець-Подільський р-н, вул. Гагаріна, 105",
ЄВРОПЕЙСЬКА ПАРТІЯ УКРАЇНИ,НОВОСЕЛИЦЬКА РАЙОННА організація,Чернівецька обл.,34907749,"Чернівецька обл.,  Дністровський р-н, nan,  ","Чернівецька обл.,  Дністровський р-н, nan,  ",
ЄВРОПЕЙСЬКА ПАРТІЯ УКРАЇНИ,НОВООДЕСЬКА РАЙОННА організація,Миколаївська обл.,34742245,"Миколаївська обл.,  Миколаївський р-н, вул. Підгорна, 80А","Миколаївська обл.,  Миколаївський р-н, вул. Підгорна, 80А",
ЄВРОПЕЙСЬКА ПАРТІЯ УКРАЇНИ,НОВОДНІСТРОВСЬКА МІСЬКА організація,Чернівецька обл.,34518994,"Чернівецька обл.,  Дністровський р-н,  Діброва мікрорайон, 20","Чернівецька обл.,  Дністровський р-н,  Діброва мікрорайон, 20",
ЄВРОПЕЙСЬКА ПАРТІЯ УКРАЇНИ,НОВОВОДОЛАЗЬКА РАЙОННА організація,Харківська обл.,34895304,"Харківська обл.,  Харківський р-н, вул. Гагаріна, 17","Харківська обл.,  Харківський р-н, вул. Гагаріна, 17",
