Вид нерухомого майна,Місцезнаходження обʼєкта,Загальна площа (кв.м),Реєстраційні дані,Дата набуття речового права,Сума витрат на отримання речового права (грн),Вид речового права,ПІБ (для фіз. осіб)/Назва (для юр. осіб),Ідентифікаційний код (для фіз. осіб)/Код ЄДРПОУ (для юр. осіб),Тип власника,Партія,Дата,Квартал,Рік
Нежитлова будівля,"м. Харків, вул. Суздальські Ряди, буд. 12, нежитлові приміщення №17; 17а; 26; 26а; 27; 12; 29; 29а; 29б; 29в, що розташовані на першому поверсі",257.8,,12.06.2020,0,Оренда,,,Юридична особа,СЛУГА НАРОДУ,2022-12-31,4,2022
Нежитлова будівля,"м. Харків, вул. Суздальські Ряди, буд. 12, нежитлове приміщення №1а, що розташоване на четвертому поверсі",37.7,,01.12.2020,0,Оренда,,,Юридична особа,СЛУГА НАРОДУ,2022-12-31,4,2022
Нежитлова будівля,"Харківська обл., м. Купʼянськ, вул. Сватівська, буд. 51, нежитлове приміщення (офісне) №2 (кабінет №1) на першому поверсі будівлі літера ""Ж 1""",34.3,,01.07.2021,0,Оренда,,,Юридична особа,СЛУГА НАРОДУ,2022-12-31,4,2022
Нежитлова будівля,"Харківська обл., Красноградський р-н, м. Красноград, вул. Преображенська, буд. 6, нежитлове приміщення під літ.""А"" в напівпідвальному поверсі пʼятиповерхового житлового цегляного будинку",92.7,,01.09.2021,0,Оренда,,,Фізична особа,СЛУГА НАРОДУ,2022-12-31,4,2022
Нежитлова будівля,"Харківська обл., Богодухівський р-н, м. Богодухів, вул. Шевченка, буд. 11, частина нежитлового приміщення під літ. ""А-1"" на І поверсі будівлі",13.5,,17.09.2021,0,Оренда,,,Фізична особа,СЛУГА НАРОДУ,2022-12-31,4,2022
Нежитлова будівля,"Харківська обл., м. Чугуїв, вул. Жадановськго, буд. 2, частина нежитлових приміщеннь 1-го поверху №73-1-:-73-5 в літ.""А-1""",20.0,,01.12.2021,0,Оренда,,,Фізична особа,СЛУГА НАРОДУ,2022-12-31,4,2022
Нежитлова будівля,"Харківська обл., м. Лозова, вул. Грушевського Михайла, буд. 4, приміщення 3, частина нежитлового вбудованого приміщення під літерою ""А-5"" на І поверсі будівлі, літ. ""а 1""-ганок",51.2,,01.12.2021,0,Оренда,,,Фізична особа,СЛУГА НАРОДУ,2022-12-31,4,2022
Нежитлова будівля,"Місто Київ, Печерський р-н, вул. Паркова дорога, буд. 16А, нежитлове приміщення на першому поверсі в будівлі №1 (літера А)",39.7,,26.04.2021,0,Оренда,,,Юридична особа,СЛУГА НАРОДУ,2022-12-31,4,2022
Нежитлова будівля,"Київська обл., Фастівський р-н, м. Фастів, вул. Інтернаціональна, будівля 14, нежитлове приміщення на першому поверсі",55.5,,07.07.2021,0,Оренда,,,Фізична особа,СЛУГА НАРОДУ,2022-12-31,4,2022
Нежитлова будівля,"Київська обл., Вишгородський р-н, м. Вишгород, вул. Шолуденка, буд. № 15-Д, нежитлове приміщення №76 на першому поверсі корпус 1",32.8,,15.07.2021,0,Оренда,,,Юридична особа,СЛУГА НАРОДУ,2022-12-31,4,2022
Нежитлова будівля,"Київська обл., Бориспільський р-н, м. Бориспіль, вул. Київський Шлях, буд. № 69-а, частина нежитлового приміщення",79.45,,13.07.2021,0,Оренда,,,Юридична особа,СЛУГА НАРОДУ,2022-12-31,4,2022
Нежитлова будівля,"Київська обл., Броварський р-н, м. Бровари, бульв. Незалежності, буд. № 15, нежитлове приміщення №72 на першому поверсі",67.4,,04.10.2021,0,Оренда,,,Фізична особа,СЛУГА НАРОДУ,2022-12-31,4,2022
Нежитлова будівля,"Київська обл., Білоцерківський р-н, м. Біла Церква, вул. Гагаріна, буд. № 15, нежитлове приміщення №2 на першому поверсі",68.0,,08.10.2021,0,Оренда,,,Фізична особа,СЛУГА НАРОДУ,2022-12-31,4,2022
Нежитлова будівля,"Київська обл., Бучанський р-н, м. Ірпінь, вул. Центральна, буд. 55, частина нежитлового приміщення №53 на першому поверсі",41.6,,08.12.2021,0,Оренда,,,Фізична особа,СЛУГА НАРОДУ,2022-12-31,4,2022
Нежитлова будівля,"Київська обл., Обухівський р-н, м. Обухів, вул. Малишка, буд. 3, частина нежитлового приміщення",38.6,,01.12.2021,0,Оренда,,,Фізична особа,СЛУГА НАРОДУ,2022-12-31,4,2022
Нежитлова будівля,"м. Тернопіль, вул. Чорновола, буд. № 1, приміщення №2-11, 2-12, 2-17, 2-18, 2-19, 2-20",90.1,,25.02.2022,1359379.25,Оренда,,,Юридична особа,СЛУГА НАРОДУ,2022-12-31,4,2022
Нежитлова будівля,"м. Івано-Франківськ, вул. Галицька 41 приміщення №5, другий поверх",40.7,,01.07.2021,0,Оренда,,,Фізична особа,СЛУГА НАРОДУ,2022-12-31,4,2022
Нежитлова будівля,"м. Івано-Франківськ, вул. Галицька 41 приміщення №6, другий поверх",21.4,,01.10.2021,0,Оренда,,,Фізична особа,СЛУГА НАРОДУ,2022-12-31,4,2022
Нежитлова будівля,"Івано-Франківська обл., Верховинський р-н, смт Верховина, вул. Гуцульського повстання, будівля 1Д/3, приміщення №II, другий поверх",31.4,,01.09.2022,0,Оренда,,,Фізична особа,СЛУГА НАРОДУ,2022-12-31,4,2022
Нежитлова будівля,"Івано-Франківська обл., Калуський р-н, м. Калуш, вул. Підвальна 8, приміщення №3,№4,№5,№6, перший поверх",51.8,,01.09.2022,0,Оренда,,,Фізична особа,СЛУГА НАРОДУ,2022-12-31,4,2022
Нежитлова будівля,"Івано-Франківська обл., Косівський р-н, м. Косів, вул. Небесної Сотні, буд. 50/1, приміщення №6,№8, другий поверх",57.6,,01.09.2022,0,Оренда,,,Фізична особа,СЛУГА НАРОДУ,2022-12-31,4,2022
Нежитлова будівля,"Івано-Франківська обл., Надвірнянський р-н, м. Надвірна, вул. Мазепи Гетьмана 25а, приміщення №15, другий поверх",37.5,,01.09.2022,0,Оренда,,,Фізична особа,СЛУГА НАРОДУ,2022-12-31,4,2022
Нежитлова будівля,"Івано-Франківська обл., Коломийський р-н, м. Коломия, вул. Мазепи І. гетьмана, буд. 8, приміщення №8,№9,№10,№, другий поверх",53.9,,01.09.2022,0,Оренда,,,Фізична особа,СЛУГА НАРОДУ,2022-12-31,4,2022
Нежитлова будівля,"м. Київ, вул. Шепелєва Миколи, будівля №13, нежитлові приміщення з №1 по №9 (групи приміщень №130) на першому поверсі",82.2,,09.09.2021,0,Оренда,,,Фізична особа,СЛУГА НАРОДУ,2022-12-31,4,2022
Нежитлова будівля,"м. Київ, вул. Празька, буд. №18, нежитлове приміщення з №1 по №5 (групи приміщень №58а) ( в літері А) на першому поверсі",60.0,,20.10.2021,0,Оренда,,,Фізична особа,СЛУГА НАРОДУ,2022-12-31,4,2022
Нежитлова будівля,"м. Київ, вул. Заньковецької, буд. №3/1, приміщення №1",90.9,,18.10.2021,0,Оренда,,,Фізична особа,СЛУГА НАРОДУ,2022-12-31,4,2022
Нежитлова будівля,"м. Київ, вул. Градинська, буд. 3, приміщення 235",62.0,,15.11.2021,0,Оренда,,,Фізична особа,СЛУГА НАРОДУ,2022-12-31,4,2022
Нежитлова будівля,"м. Київ, вул. Героїв Дніпра, буд. 31А, частина нежитлового приміщення з №8 по №27 (групи приміщень №1) 1 поверх літ. ""А""",37.3,,14.12.2021,0,Оренда,,,Фізична особа,СЛУГА НАРОДУ,2022-12-31,4,2022
Нежитлова будівля,"м. Київ, просп. Лобановського Валерія, буд. 144, приміщення 2-О",51.3,,01.06.2022,0,Оренда,,,Фізична особа,СЛУГА НАРОДУ,2022-12-31,4,2022
Нежитлова будівля,"м. Київ, просп. Бажана Миколи, буд. 26, частина нежитлового приміщення №1 на першому поверсі",50.4,,20.01.2022,0,Оренда,,,Фізична особа,СЛУГА НАРОДУ,2022-12-31,4,2022
Нежитлова будівля,"м. Київ, вул. Булгакова, буд. 15А, приміщення 2, група нежитлових приміщень в літ. ""Б""",44.8,,14.02.2022,0,Оренда,,,Фізична особа,СЛУГА НАРОДУ,2022-12-31,4,2022
Нежитлова будівля,"м. Київ, вул. Костянтинівська/Фролівська, буд. 1/2, частина нежитлового приміщення в літ ""А""",117.8,,16.11.2022,0,Оренда,,,Юридична особа,СЛУГА НАРОДУ,2022-12-31,4,2022
Нежитлова будівля,"м. Київ, вул. Гончара Олеся, буд. 47/49, нежитлові приміщення з №1 по №6 ( групи приміщень №31) в літері ""А""",79.3,,05.12.2022,0,Оренда,,,Фізична особа,СЛУГА НАРОДУ,2022-12-31,4,2022
Нежитлова будівля,"Луганська обл., м. Сєвєродонецьк, просп. Гвардійський, буд. 47/22",46.8,,17.02.2021,0,Оренда,,,Фізична особа,СЛУГА НАРОДУ,2022-12-31,4,2022
Нежитлова будівля,"Луганська обл., Новоайдарський р-н, смт Новоайдар, вул. Незалежності, буд. 1",53.5,,21.07.2021,0,Оренда,,,Юридична особа,СЛУГА НАРОДУ,2022-12-31,4,2022
Нежитлова будівля,"Луганська обл., Сватівський р-н, м. Сватове, вул. Леніна (вул. Державна; вул. Каштанова), буд. 60, частина приміщення на другому поверсі ""Торгівельно-офісного центру""",45.8,,06.08.2021,0,Оренда,,,Фізична особа,СЛУГА НАРОДУ,2022-12-31,4,2022
Нежитлова будівля,"Луганська обл., Старобільський р-н, м. Старобільськ, вул. Миру, буд. 6А",54.3,,14.01.2022,0,Оренда,,,Фізична особа,СЛУГА НАРОДУ,2022-12-31,4,2022
Нежитлова будівля,"м. Полтава, вул. Сковороди, буд. 2В, нежитлове приміщення №16",84.9,,18.07.2022,0,Оренда,,,Юридична особа,СЛУГА НАРОДУ,2022-12-31,4,2022
Нежитлова будівля,"Полтавська обл., м. Кременчук, вул. Соборна, буд. 40/2, нежитлове приміщення №10",45.51,,07.11.2022,0,Оренда,,,Юридична особа,СЛУГА НАРОДУ,2022-12-31,4,2022
Нежитлова будівля,"Полтавська обл., м. Пирятин, вул. Соборна, буд. 18А, нежитлове приміщення №18",23.0,,02.11.2022,0,Оренда,,,Фізична особа,СЛУГА НАРОДУ,2022-12-31,4,2022
Нежитлова будівля,"м. Вінниця, вул. Магістратська, буд. 156А, 1-й поверх, 2 підʼїзд, частина нежитлового приміщення № 143",65.0,,11.06.2021,0,Оренда,,,Фізична особа,СЛУГА НАРОДУ,2022-12-31,4,2022
Нежитлова будівля,"м. Чернівці, вул. БАНДЕРИ СТЕПАНА, буд. 9",102.6,,17.05.2021,0,Оренда,,,Фізична особа,СЛУГА НАРОДУ,2022-12-31,4,2022
Нежитлова будівля,"Волинська обл., м. Ковель, вул. Шевченка Тараса, буд. 2Б/1, нежитлове приміщення №2 на першому поверсі",26.04,,01.10.2022,0,Оренда,,,Фізична особа,СЛУГА НАРОДУ,2022-12-31,4,2022
Нежитлова будівля,"м. Луцьк, вул. Набережна, буд. 4А, нежитлове приміщення 144 на першому поверсі",43.4,,01.07.2021,0,Оренда,,,Фізична особа,СЛУГА НАРОДУ,2022-12-31,4,2022
Нежитлова будівля,"м. Луцьк, вул. Набережна, буд. 4А, нежитлове приміщення 144 на першому поверсі",71.2,,13.09.2022,0,Оренда,,,Фізична особа,СЛУГА НАРОДУ,2022-12-31,4,2022
Нежитлова будівля,"Волинська обл., м. Володимир-Волинський, вул. Князя Василька, буд. 1, офісне приміщення на першому поверсі",46.3,,01.09.2022,0,Оренда,,,Фізична особа,СЛУГА НАРОДУ,2022-12-31,4,2022
Нежитлова будівля,"Волинська обл., м. Камінь-Каширський, вул. Шевченка, буд. 5, нежитлове приміщення №1-4 на другому поверсі",17.8,,01.11.2021,0,Оренда,,,Юридична особа,СЛУГА НАРОДУ,2022-12-31,4,2022
Нежитлова будівля,"м. Запоріжжя, бульв. Центральний, буд. 3, частина нежитлового приміщення № 328 на першому поверсі будівлі",167.0,,01.08.2022,0,Оренда,,,Юридична особа,СЛУГА НАРОДУ,2022-12-31,4,2022
Нежитлова будівля,"м. Кропивницький, вул. Карпи Тараса, буд. 65, приміщення (кімнати) №2 та №3",96.9,,01.08.2022,0,Оренда,,,Юридична особа,СЛУГА НАРОДУ,2022-12-31,4,2022
Нежитлова будівля,"Сумська обл., м. Охтирка, вул. Армійська, буд. 1",126.6,,15.02.2021,0,Оренда,,,Юридична особа,СЛУГА НАРОДУ,2022-12-31,4,2022
Нежитлова будівля,"Сумська обл., м. Ромни, вул. Коржівська, буд. 121, приміщення 33",41.81,,01.07.2021,0,Оренда,,,Фізична особа,СЛУГА НАРОДУ,2022-12-31,4,2022
Нежитлова будівля,"Сумська обл., м. Шостка, вул. Депутатська, буд. 15, частина нежитлового приміщення",8.0,,01.07.2021,0,Оренда,,,Юридична особа,СЛУГА НАРОДУ,2022-12-31,4,2022
Нежитлова будівля,"Сумська обл., м. Шостка, вул. Депутатська, буд. 15, частина нежитлового приміщення",56.4,,01.10.2022,0,Оренда,,,Юридична особа,СЛУГА НАРОДУ,2022-12-31,4,2022
Нежитлова будівля,"Сумська обл., м. Конотоп, просп. Миру, буд. 40/1",43.5,,01.10.2021,0,Оренда,,,Фізична особа,СЛУГА НАРОДУ,2022-12-31,4,2022
Нежитлова будівля,"м. Суми, пров. 9 Травня, буд. 4",171.5,,05.01.2022,0,Оренда,,,Юридична особа,СЛУГА НАРОДУ,2022-12-31,4,2022
Нежитлова будівля,"м. Львів, вул. Чайковського П., буд. 20",57.8,,01.12.2020,0,Оренда,,,Юридична особа,СЛУГА НАРОДУ,2022-12-31,4,2022
Нежитлова будівля,"Львівська обл., Золочівський р-н, м. Буськ, майдан Незалежності, буд. 9",24.5,,01.07.2021,0,Оренда,,,Юридична особа,СЛУГА НАРОДУ,2022-12-31,4,2022
Нежитлова будівля,"Львівська обл., м. Дрогобич, вул. Трускавецька, буд. 38",36.6,,01.07.2021,0,Оренда,,,Фізична особа,СЛУГА НАРОДУ,2022-12-31,4,2022
Нежитлова будівля,"Львівська обл., Яворівський р-н, м. Яворів, вул. А. Шептицького, буд. 1/3",40.2,,01.07.2021,0,Оренда,,,Фізична особа,СЛУГА НАРОДУ,2022-12-31,4,2022
Нежитлова будівля,"Львівська обл., Стрийський р-н, м. Стрий, вул. Бандери С., буд. 16, нежитлове приміщення 3",36.7,,01.11.2021,0,Оренда,,,Фізична особа,СЛУГА НАРОДУ,2022-12-31,4,2022
Нежитлова будівля,"Львівська обл., Самбірський р-н, м. Самбір, вул. Лемківська, буд. 1 а, нежитлові приміщення 4",49.4,,01.11.2021,0,Оренда,,,Фізична особа,СЛУГА НАРОДУ,2022-12-31,4,2022
Нежитлова будівля,"Хмельницька обл., м. Шепетівка, вул. Героїв Небесної Сотні, буд. 55, нежитлове приміщення на першому поверсі",37.2,,16.06.2021,0,Оренда,,,Фізична особа,СЛУГА НАРОДУ,2022-12-31,4,2022
Нежитлова будівля,"м. Хмельницький, вул. Проскурівського підпілля, буд. 63, частина другого поверху",125.0,,01.11.2021,0,Оренда,,,Юридична особа,СЛУГА НАРОДУ,2022-12-31,4,2022
Нежитлова будівля,"м. Хмельницький, вул. Подільська, буд. 109, частина другого поверху",15.0,,01.11.2022,0,Оренда,,,Юридична особа,СЛУГА НАРОДУ,2022-12-31,4,2022
Нежитлова будівля,"м. Черкаси, бульв. Шевченка, буд. 150, частина приміщень першого поверху та приміщення антресольного поверху з 111-5 до №111-7, А-6-7",26.83,,01.01.2021,0,Оренда,,,Фізична особа,СЛУГА НАРОДУ,2022-12-31,4,2022
Нежитлова будівля,"м. Черкаси, бульв. Шевченка, буд. 150, частина приміщень першого поверху",50.05,,01.12.2022,0,Оренда,,,Фізична особа,СЛУГА НАРОДУ,2022-12-31,4,2022
Нежитлова будівля,"Черкаська обл., Звенигородський р-н, м. Звенигородка, вул. Шевченка, буд. 6",44.1,,01.09.2021,0,Оренда,,,Фізична особа,СЛУГА НАРОДУ,2022-12-31,4,2022
Нежитлова будівля,"м. Чернігів, просп. Перемоги, буд. 95Б, приміщення 1-208",7.6,,06.07.2022,0,Оренда,,,Юридична особа,СЛУГА НАРОДУ,2022-12-31,4,2022
Нежитлова будівля,"м. Чернігів, вул. Хлібопекарська, буд. 16",74.8,,26.12.2022,0,Оренда,,,Фізична особа,СЛУГА НАРОДУ,2022-12-31,4,2022
Нежитлова будівля,"м. Чернігів, вул. Хлібопекарська, буд. 16",74.8,,26.12.2022,0,Оренда,,,Фізична особа,СЛУГА НАРОДУ,2022-12-31,4,2022
Нежитлова будівля,"Дніпропетровська обл., м. Кривий Ріг, вул. Матусевича Віталія, буд. 8, частина нежитлового приміщення №124 на першому поверсі",243.3,,18.05.2021,,Оренда,,,Фізична особа,СЛУГА НАРОДУ,2022-12-31,4,2022
Нежитлова будівля,"Дніпропетровська обл., м. Кривий Ріг, вул. Зінчевського Миколи, буд. 2, нежитлове приміщення №22 на першому поверсі",120.5,,01.10.2021,,Оренда,,,Фізична особа,СЛУГА НАРОДУ,2022-12-31,4,2022
Нежитлова будівля,"Закарпатська обл., м. Хуст, вул. Духновича, буд. №17А/7",26.6,,16.09.2022,0,Оренда,,,Юридична особа,СЛУГА НАРОДУ,2022-12-31,4,2022
Нежитлова будівля,"Закарпатська обл., м. Мукачево, вул. Гоголя Миколи, буд. 2, приміщення 1",47.5,,01.12.2022,0,Оренда,,,Фізична особа,СЛУГА НАРОДУ,2022-12-31,4,2022
Нежитлова будівля,"Закарпатська обл., м. Рахів, вул. Миру, буд. №52, нежитлове приміщення №3",31.24,,01.12.2022,0,Оренда,,,Фізична особа,СЛУГА НАРОДУ,2022-12-31,4,2022
Нежитлова будівля,"Закарпатська обл., м. Рахів, вул. Миру, буд. №52, нежитлове приміщення №3",31.24,,01.12.2022,0,Оренда,,,Фізична особа,СЛУГА НАРОДУ,2022-12-31,4,2022
Нежитлова будівля,"м. Ужгород, площа Петефі Шандора, буд.№1",73.6,,01.12.2022,0,Оренда,,,Фізична особа,СЛУГА НАРОДУ,2022-12-31,4,2022
Нежитлова будівля,"Житомирська обл., м. Бердичів, вул. Шевченка, буд. 18/2",78.5,,01.06.2021,0,Оренда,,,Фізична особа,СЛУГА НАРОДУ,2022-12-31,4,2022
Нежитлова будівля,"Житомирська обл., м. Новоград-Волинський, вул. Соборності, буд. 4",39.2,,01.07.2021,0,Оренда,,,Фізична особа,СЛУГА НАРОДУ,2022-12-31,4,2022
Нежитлова будівля,"Житомирська обл., м. Коростень, вул. Грушевського, буд. 17",30.45,,01.11.2021,0,Оренда,,,Юридична особа,СЛУГА НАРОДУ,2022-12-31,4,2022
Нежитлова будівля,"м. Житомир, вул. Михайлівська, буд. 8/1",192.0,,21.09.2022,0,Оренда,,,Фізична особа,СЛУГА НАРОДУ,2022-12-31,4,2022
Нежитлова будівля,"м. Рівне, вул. 16 Липня, буд. 42, поверх 1",131.1,,01.06.2021,0,Оренда,,,Юридична особа,СЛУГА НАРОДУ,2022-12-31,4,2022
Нежитлова будівля,"Рівненська обл., Володимирецький р-н, смт Володимирець, вул. Поштова, буд. 11А",56.5,,01.09.2022,0,Оренда,,,Фізична особа,СЛУГА НАРОДУ,2022-12-31,4,2022
Нежитлова будівля,"Рівненська обл., м. Сарни, вул. Белгородська, буд. 19, поверх 2",46.9,,01.10.2021,0,Оренда,,,Фізична особа,СЛУГА НАРОДУ,2022-12-31,4,2022
Нежитлова будівля,"Рівненська обл., м. Дубно, вул. Данила Галицького, буд. 26, поверх 1",45.5,,01.11.2021,0,Оренда,,,Фізична особа,СЛУГА НАРОДУ,2022-12-31,4,2022
Нежитлова будівля,"Миколаївська обл., Баштанський р-н, м. Баштанка, вул. Полтавська, буд. 17, приміщення 1-11, на 1-му поверсі",49.1,,15.08.2021,0,Оренда,,,Фізична особа,СЛУГА НАРОДУ,2022-12-31,4,2022
