Вид фінансових зобовʼязань,Дата виникнення,Сума (вартість) зобовʼязання на момент виникнення,ПІБ (для фіз. осіб)/Назва (для юр. осіб),Ідентифікаційний код (для фіз. осіб)/Код ЄДРПОУ (для юр. осіб),Місце проживання (для фіз. осіб)/Юридична адреса (для юр. осіб),Сума (вартість) на кінець звітного періоду грн,Тип особи,Партія,Місцева організація,Код ЄДРПОУ осередку,Географічний обʼєкт,Квартал,Рік
оренда приміщення,31.09.2021,11535.48,"ПП ""Аграрна компанія 2004""",33007579,"Хмельницька обл., Хмельницький р-н, с. Попівці, вул. Шкільна, буд. 34А",11535.48,Юридична особа,ЗА МАЙБУТНЄ,ХМЕЛЬНИЦЬКА ОБЛАСНА організація,43556485,Хмельницька область,4,2022
Безвітсоткова фінансова допомога,01.01.2021,1700000.0,"Приватнеагропромислове підприємство ""Агропродсервіс""",30356854,"Тернопільська обл., Тернопільський р-н, с. Настасів",1700000.0,Юридична особа,ЗА МАЙБУТНЄ,ТЕРНОПІЛЬСЬКА ОБЛАСНА організація,36721143,Тернопільська область,4,2022
Оренда приміщення,01.10.2022,1911.0,"ПАТ ""ЕНКО""",13367676,"м. Луцьк, вул. Електроапаратна, буд. 3",1911.0,Юридична особа,ЗА МАЙБУТНЄ,ВОЛИНСЬКА ОБЛАСНА організація,37029088,Волинська область,4,2022
послуги з реклами,01.10.2020,354300.0,Келар Галина Володимирівна,,Львівська обл.,233200.0,Фізична особа,ЗА МАЙБУТНЄ,МИКОЛАЇВСЬКА ОБЛАСНА організація,37518211,Миколаївська область,4,2022
оренда нежитдлового приміщення,01.12.2022,9687.35,"ТОВАРИСТВО З ОБМЕЖЕНОЮ ВІДПОВІДАЛЬНІСТЮ ""МАЖОРДОМ УКРАЇНА""",44787324,"Київська обл., Бучанський р-н, м. Вишневе, вул. Київська, буд. 4",9687.35,Юридична особа,ЗА МАЙБУТНЄ,Центральний офіс,36088708,Київ,4,2022
