Партія,Місцева організація,Географічний обʼєкт,Ідентифікаційний код юридичної особи за ЄДРПОУ,Місцезнаходження,Фактичне місцезнаходження,"Реквізити банків, у яких відкрито рахунки"
ГРОМАДА,Ківерцівська районна організація,Волинська область,20126447,"Волинська обл., Луцький р-н, вул. Незалежності, буд. 55","Волинська обл., Луцький р-н, вул. Незалежності, буд. 55",
ГРОМАДА,Добропільська районна організація,Донецька область,25341110,"Донецька обл., Покровський р-н, вул. Привокзальна, буд. 1","Донецька обл., Покровський р-н, вул. Привокзальна, буд. 1",
ГРОМАДА,Марʼїнська районна організація,Донецька область,25708775,"Донецька обл., Покровський р-н, вул. Перемоги, буд. 22","Донецька обл., Покровський р-н, вул. Перемоги, буд. 22",
ГРОМАДА,Кальміуська районна організація у м.Маріуполі,Донецька область,25731561,"Донецька обл., м. Маріуполь, вул. Мазая Макара, буд. 42","Донецька обл., м. Маріуполь, вул. Мазая Макара, буд. 42",
ГРОМАДА,Петриківська районна організація,Дніпропетровська область,25541820,"Дніпропетровська обл., Дніпровський р-н, вул. Шевченка, буд. 4","Дніпропетровська обл., Дніпровський р-н, вул. Шевченка, буд. 4",
ГРОМАДА,Перещепинська міська організація,Дніпропетровська область,35323493,"Дніпропетровська обл., Новомосковський р-н, вул. Козача, буд. 1","Дніпропетровська обл., Новомосковський р-н, вул. Козача, буд. 1",
ГРОМАДА,Новомосковська міська організація,Дніпропетровська область,35595095,"Дніпропетровська обл., Новомосковський р-н, вул. Гетьманська, буд. 19","Дніпропетровська обл., Новомосковський р-н, вул. Гетьманська, буд. 19",
ГРОМАДА,Солонянська районна організація,Дніпропетровська область,25001383,"Дніпропетровська обл., Дніпровський р-н, вул. Задернюка, буд. 3","Дніпропетровська обл., Дніпровський р-н, вул. Задернюка, буд. 3",
ГРОМАДА,Словянська міська організація,Донецька область,34008987,"Донецька обл., Краматорський р-н, вул. Центральна, буд. 47Б","Донецька обл., Краматорський р-н, вул. Центральна, буд. 47Б",
ГРОМАДА,Юріївська районна організація,Дніпропетровська область,25524690,"Дніпропетровська обл., Павлоградський р-н, вул. Центральна, буд. 67","Дніпропетровська обл., Павлоградський р-н, вул. Центральна, буд. 67",
ГРОМАДА,Старовижівська районна організація,Волинська область,20126080,"Волинська обл., Ковельський р-н, вул. Пушкіна, буд. 2","Волинська обл., Ковельський р-н, вул. Пушкіна, буд. 2",
ГРОМАДА,Ковельська районна організація,Волинська область,20128630,"Волинська обл., Ковельський р-н, вул. Дружби, буд. 5","Волинська обл., Ковельський р-н, вул. Дружби, буд. 5",
ГРОМАДА,Ковельська міська організація,Волинська область,23254430,"Волинська обл., Ковельський р-н, вул. Незалежності, буд. 94","Волинська обл., Ковельський р-н, вул. Незалежності, буд. 94",
ГРОМАДА,Горохівська районна організація,Волинська область,20125034,"Волинська обл., Луцький р-н, вул. Хмельницького Б, буд. 26","Волинська обл., Луцький р-н, вул. Хмельницького Б, буд. 26",
ГРОМАДА,Маневицька районна організація,Волинська область,23255493,"Волинська обл., Камінь-Каширський р-н, вул. Снітка Андрія, буд. 32А","Волинська обл., Камінь-Каширський р-н, вул. Снітка Андрія, буд. 32А",
ГРОМАДА,Дніпропетровська обласна організація,Дніпропетровська область,25005866,"Дніпропетровська обл., м. Дніпро, просп. Поля Олександра, буд. 2","Дніпропетровська обл., м. Дніпро, просп. Поля Олександра, буд. 2",
ГРОМАДА,Володимир-Волинська міська організація,Волинська область,21735869,"Волинська обл., Володимир-Волинський р-н, вул. Ковельська, буд. 134","Волинська обл., Володимир-Волинський р-н, вул. Ковельська, буд. 134",
ГРОМАДА,Волинська обласна організація,Волинська область,25087858,"Волинська обл., Ковельський р-н, вул. Незалежності, буд. 94","Волинська обл., Ковельський р-н, вул. Незалежності, буд. 94",
ГРОМАДА,Покровська міська організація,Донецька область,25709277,"Донецька обл., Покровський р-н, вул. Шахтарська, буд. 20","Донецька обл., Покровський р-н, вул. Шахтарська, буд. 20",
ГРОМАДА,Маріупольська міська організація,Донецька область,30210891,"Донецька обл., м. Маріуполь, вул. 9 Авіадивізії, буд. 2","Донецька обл., м. Маріуполь, вул. 9 Авіадивізії, буд. 2",
ГРОМАДА,Центральна районна організація у м.Маріуполі,Донецька область,25731555,"Донецька обл., м. Маріуполь, вул. Нільсена Архітектора, буд. 1","Донецька обл., м. Маріуполь, вул. Нільсена Архітектора, буд. 1",
ГРОМАДА,Новогродівська міська організація,Донецька область,25782771,"Донецька обл., Покровський р-н, вул. Донецька, буд. 12","Донецька обл., Покровський р-н, вул. Донецька, буд. 12",
ГРОМАДА,Добропільська міська організація,Донецька область,25116643,"Донецька обл., Покровський р-н, просп. Перемоги, буд. 39","Донецька обл., Покровський р-н, просп. Перемоги, буд. 39",
ГРОМАДА,Борзнянська районна організація,Чернігівська область,25620732,"Чернігівська обл., Ніжинський р-н, вул. Українська, буд. 33","Чернігівська обл., Ніжинський р-н, вул. Українська, буд. 33",
ГРОМАДА,Коропська районна організація,Чернігівська область,25621200,"Чернігівська обл., Новгород-Сіверський р-н, вул. Прорізна, буд. 1","Чернігівська обл., Новгород-Сіверський р-н, вул. Прорізна, буд. 1",
ГРОМАДА,Бобровицька районна організація,Чернігівська область,25620637,"Чернігівська обл., Ніжинський р-н, вул. Гагаріна, буд. 21","Чернігівська обл., Ніжинський р-н, вул. Гагаріна, буд. 21",
ГРОМАДА,Менська районна організація,Чернігівська область,30332503,"Чернігівська обл., Корюківський р-н, пров. Шкільний, буд. 13","Чернігівська обл., Корюківський р-н, пров. Шкільний, буд. 13",
ГРОМАДА,Бахмацька міськрайонна організація,Чернігівська область,25622613,"Чернігівська обл., Ніжинський р-н, вул. Першотравнева, буд. 16","Чернігівська обл., Ніжинський р-н, вул. Першотравнева, буд. 16",
ГРОМАДА,Прилуцька районна організація,Чернігівська область,25623133,"Чернігівська обл., Прилуцький р-н, вул. Індустріальна, буд. 41","Чернігівська обл., Прилуцький р-н, вул. Індустріальна, буд. 41",
ГРОМАДА,Ічнянська районна організація,Чернігівська область,25621009,"Чернігівська обл., Прилуцький р-н, вул. Пушкіна, буд. 8","Чернігівська обл., Прилуцький р-н, вул. Пушкіна, буд. 8",
ГРОМАДА,Ніжинська районна організація,Чернігівська область,22820560,"Чернігівська обл., Ніжинський р-н, вул. Незалежності, буд. 27","Чернігівська обл., Ніжинський р-н, вул. Незалежності, буд. 27",
ГРОМАДА,Ніжинська міська організація,Чернігівська область,25622790,"Чернігівська обл., Ніжинський р-н, вул. Незалежності, буд. 27","Чернігівська обл., Ніжинський р-н, вул. Незалежності, буд. 27",
ГРОМАДА,Козелецька районна організація,Чернігівська область,25621105,"Чернігівська обл., Чернігівський р-н, вул. Свято-Преображенська, буд. 10А","Чернігівська обл., Чернігівський р-н, вул. Свято-Преображенська, буд. 10А",
ГРОМАДА,Сосницька районна організація,Чернігівська область,25622205,"Чернігівська обл., Корюківський р-н, вул. Рокосовського, буд. 10А","Чернігівська обл., Корюківський р-н, вул. Рокосовського, буд. 10А",
ГРОМАДА,Корюківська районна організація,Чернігівська область,25621364,"Чернігівська обл., Корюківський р-н, вул. Корнієвського, буд. 7","Чернігівська обл., Корюківський р-н, вул. Корнієвського, буд. 7",
ГРОМАДА,Чернігівська обласна організація,Чернігівська область,21391795,"Чернігівська обл., м. Чернігів, вул. Малиновського, буд. 36","Чернігівська обл., м. Чернігів, вул. Малиновського, буд. 36",
ГРОМАДА,Чернівецька обласна організація,Чернівецька область,25082370,"Чернівецька обл., Чернівецький р-н, вул. Канівська, буд. 1А","Чернівецька обл., Чернівецький р-н, вул. Канівська, буд. 1А",
ГРОМАДА,Жашківська районна організація,Черкаська область,33548071,"Черкаська обл., Уманський р-н, пров. Ринковий, буд. 10","Черкаська обл., Уманський р-н, пров. Ринковий, буд. 10",
ГРОМАДА,Шполянська районна організація,Черкаська область,25727068,"Черкаська обл., Звенигородський р-н, вул. Некрасова, буд. 6","Черкаська обл., Звенигородський р-н, вул. Некрасова, буд. 6",
ГРОМАДА,Ватутінська міська організація,Черкаська область,25727080,"Черкаська обл., Звенигородський р-н, вул. Сонячна, буд. 15","Черкаська обл., Звенигородський р-н, вул. Сонячна, буд. 15",
ГРОМАДА,Черкаська обласна організація,Черкаська область,25207877,"Черкаська обл., м. Черкаси, вул. Сагайдачного гетьмана, буд. 235","Черкаська обл., м. Черкаси, вул. Сагайдачного гетьмана, буд. 235",
ГРОМАДА,Полонська районна організація,Хмельницька область,22787466,"Хмельницька обл., Шепетівський р-н, вул. Київська, буд. 8","Хмельницька обл., Шепетівський р-н, вул. Київська, буд. 8",
ГРОМАДА,Новоушицька районна організація,Хмельницька область,22787414,"Хмельницька обл., Камʼянець-Подільський р-н, вул. Подільська, буд. 51","Хмельницька обл., Камʼянець-Подільський р-н, вул. Подільська, буд. 51",
ГРОМАДА,Хмельницька міська організація,Хмельницька область,22770879,"Хмельницька обл., Хмельницький р-н, вул. Чорновола В. м. ., буд. 62","Хмельницька обл., Хмельницький р-н, вул. Чорновола В. м. ., буд. 62",
ГРОМАДА,Нетішинська міська організація,Хмельницька область,22770201,"Хмельницька обл., Шепетівський р-н, вул. Шевченка, буд. 10","Хмельницька обл., Шепетівський р-н, вул. Шевченка, буд. 10",
ГРОМАДА,Летичівська районна організація,Хмельницька область,22765654,"Хмельницька обл., Хмельницький р-н, вул. Матвєєвої Олени, буд. 6","Хмельницька обл., Хмельницький р-н, вул. Матвєєвої Олени, буд. 6",
ГРОМАДА,Красилівська районна організація,Хмельницька область,22769824,"Хмельницька обл., Хмельницький р-н, вул. Грушевського м. ., буд. 23","Хмельницька обл., Хмельницький р-н, вул. Грушевського м. ., буд. 23",
ГРОМАДА,Ярмолинецька районна організація,Хмельницька область,21338499,"Хмельницька обл., Хмельницький р-н, пров. Лесі Українки, буд. 11А","Хмельницька обл., Хмельницький р-н, пров. Лесі Українки, буд. 11А",
ГРОМАДА,Славутська міська організація,Хмельницька область,22787453,"Хмельницька обл., Шепетівський р-н, вул. Грушевського Михайла, буд. 23","Хмельницька обл., Шепетівський р-н, вул. Грушевського Михайла, буд. 23",
ГРОМАДА,Старокостянтинівська районна організація,Хмельницька область,22787420,"Хмельницька обл., Хмельницький р-н, вул. Острозького, буд. 26","Хмельницька обл., Хмельницький р-н, вул. Острозького, буд. 26",
ГРОМАДА,Волочиська районна організація,Хмельницька область,22776215,"Хмельницька обл., Хмельницький р-н, вул. Незалежності, буд. 94","Хмельницька обл., Хмельницький р-н, вул. Незалежності, буд. 94",
ГРОМАДА,Славутська районна організація,Хмельницька область,22770626,"Хмельницька обл., Шепетівський р-н, вул. Грушевського Михайла, буд. 3","Хмельницька обл., Шепетівський р-н, вул. Грушевського Михайла, буд. 3",
ГРОМАДА,Білогірська районна організація,Хмельницька область,21338507,"Хмельницька обл., Шепетівський р-н, вул. Чернавіна, буд. 6","Хмельницька обл., Шепетівський р-н, вул. Чернавіна, буд. 6",
ГРОМАДА,Хмельницька обласна організація,Хмельницька область,22765157,"Хмельницька обл., Хмельницький р-н, вул. Гагаріна, буд. 5","Хмельницька обл., Хмельницький р-н, вул. Гагаріна, буд. 5",
ГРОМАДА,Каховська міська організація,Херсонська область,25653022,"Херсонська обл., Каховський р-н, вул. Фаїни Гаєнко, буд. 22","Херсонська обл., Каховський р-н, вул. Фаїни Гаєнко, буд. 22",
ГРОМАДА,Дніпровська районна організація,Херсонська область,25650459,"Херсонська обл., м. Херсон, Бериславське шосе, 27","Херсонська обл., м. Херсон, Бериславське шосе, 27",
ГРОМАДА,Генічеська районна організація,Херсонська область,30380447,"Херсонська обл., Генічеський р-н, Фрунзе слободка, 16","Херсонська обл., Генічеський р-н, Фрунзе слободка, 16",
ГРОМАДА,Білозерська районна організація,Херсонська область,30039938,"Херсонська обл., м. Херсон, Бериславське шосе, 27","Херсонська обл., м. Херсон, Бериславське шосе, 27",
ГРОМАДА,Чугуївська міська організація,Харківська область,06715792,"Харківська обл., Чугуївський р-н, вул. Гагаріна, буд. 30","Харківська обл., Чугуївський р-н, вул. Гагаріна, буд. 30",
ГРОМАДА,Суворовська районна організація,Херсонська область,25651460,"Херсонська обл., м. Херсон, Бериславське шосе, 27","Херсонська обл., м. Херсон, Бериславське шосе, 27",
ГРОМАДА,Корабельна районна організація,Херсонська область,25651477,"Херсонська обл., м. Херсон, Бериславське шосе, 27","Херсонська обл., м. Херсон, Бериславське шосе, 27",
ГРОМАДА,Херсонська міська організація,Херсонська область,25650466,"Херсонська обл., м. Херсон, Бериславське шосе, 27","Херсонська обл., м. Херсон, Бериславське шосе, 27",
ГРОМАДА,Херсонська обласна організація,Херсонська область,24950114,"Херсонська обл., м. Херсон, Бериславське шосе, 27","Херсонська обл., м. Херсон, Бериславське шосе, 27",
ГРОМАДА,Харківська районна організація,Харківська область,06715964,"Харківська обл., Харківський р-н, Учбове містечко ХНАУ, 2т","Харківська обл., Харківський р-н, Учбове містечко ХНАУ, 2т",
ГРОМАДА,Нововодолазька районна організація,Харківська область,06715935,"Харківська обл., Харківський р-н, вул. Донця Григорія, буд. 14","Харківська обл., Харківський р-н, вул. Донця Григорія, буд. 14",
ГРОМАДА,Купянська районна організація,Харківська область,06716018,"Харківська обл., Купʼянський р-н, просп. Конституції, буд. 15","Харківська обл., Купʼянський р-н, просп. Конституції, буд. 15",
ГРОМАДА,Купянська міська організація,Харківська область,06715757,"Харківська обл., Купʼянський р-н, пров. Гоголя, буд. 8","Харківська обл., Купʼянський р-н, пров. Гоголя, буд. 8",
ГРОМАДА,Дергачівська районна організація,Харківська область,06715993,"Харківська обл., Харківський р-н, вул. Садова, буд. 10Б","Харківська обл., Харківський р-н, вул. Садова, буд. 10Б",
ГРОМАДА,Великобурлуцька районна організація,Харківська область,06715846,"Харківська обл., Купʼянський р-н, вул. Соборна, буд. 50","Харківська обл., Купʼянський р-н, вул. Соборна, буд. 50",
ГРОМАДА,Валківська районна організація,Харківська область,06715834,"Харківська обл., Богодухівський р-н, вул. Вусівська, буд. 4","Харківська обл., Богодухівський р-н, вул. Вусівська, буд. 4",
ГРОМАДА,Вовчанська районна організація,Харківська область,25457829,"Харківська обл., Чугуївський р-н, вул. Короленка, буд. 52","Харківська обл., Чугуївський р-н, вул. Короленка, буд. 52",
ГРОМАДА,Чугуївська районна організація,Харківська область,06715786,"Харківська обл., Чугуївський р-н, пл. Уланська, 19","Харківська обл., Чугуївський р-н, пл. Уланська, 19",
ГРОМАДА,Борівська районна організація,Харківська область,06715823,"Харківська обл., Ізюмський р-н, вул. Миру, буд. 16","Харківська обл., Ізюмський р-н, вул. Миру, буд. 16",
ГРОМАДА,Балаклійська районна організація,Харківська область,06715734,"Харківська обл., Ізюмський р-н, вул. Соборна, буд. 77","Харківська обл., Ізюмський р-н, вул. Соборна, буд. 77",
ГРОМАДА,Первомайська районна організація,Харківська область,06715941,"Харківська обл., Лозівський р-н, вул. Соборна, буд. 2","Харківська обл., Лозівський р-н, вул. Соборна, буд. 2",
ГРОМАДА,Краснокутська районна організація,Харківська область,06715912,"Харківська обл., Богодухівський р-н, вул. Миру, буд. 79","Харківська обл., Богодухівський р-н, вул. Миру, буд. 79",
ГРОМАДА,Зачепилівська районна організація,Харківська область,06715869,"Харківська обл., Красноградський р-н, вул. Соборна, буд. 21","Харківська обл., Красноградський р-н, вул. Соборна, буд. 21",
