Партія,Місцева організація,Географічний обʼєкт,Ідентифікаційний код юридичної особи за ЄДРПОУ,Місцезнаходження,Фактичне місцезнаходження,"Реквізити банків, у яких відкрито рахунки"
КОМАНДА АНДРІЯ БАЛОГИ,Закарпатська обласна організація,Закарпатська область,26465191,"Закарпатська обл., Мукачівський р-н, вул. Пряшівська, буд. 4","Закарпатська обл., Мукачівський р-н, вул. Пряшівська, буд. 4","АТ ""ТАСКОМБАНК"" м.Київ, ЄДРПОУ: 09806443, р/р № UA293395000000026008918829001"
КОМАНДА АНДРІЯ БАЛОГИ,Шаргородська районна організація Єдиний Центр,Вінницька область,35903620,"Вінницька обл., Шаргородський р-н, вул. Героїв Майдану, буд. 219","Вінницька обл., Шаргородський р-н, вул. Героїв Майдану, буд. 219",
КОМАНДА АНДРІЯ БАЛОГИ,Чупирянська сільська організація Білоцерківської районної організації Єдиного Центру,Київська область,36261695,"Київська обл., Білоцерківський р-н, вул. Єдності, буд. 40","Київська обл., Білоцерківський р-н, вул. Єдності, буд. 40",
КОМАНДА АНДРІЯ БАЛОГИ,Чутівська районна організація Єдиного Центру,Полтавська область,35376869,"Полтавська обл., Чутівський р-н, вул. Полтавський Шлях, буд. 114","Полтавська обл., Чутівський р-н, вул. Полтавський Шлях, буд. 114",
КОМАНДА АНДРІЯ БАЛОГИ,Чернігівська районна організація Єдиного Центру,Чернігівська область,36045968,"Чернігівська обл., м. Чернігів, вул. Кирпоноса, буд. 26","Чернігівська обл., м. Чернігів, вул. Кирпоноса, буд. 26",
КОМАНДА АНДРІЯ БАЛОГИ,Чернігівська обласна організація Єдиного Центру,Чернігівська область,26494376,"Чернігівська обл., м. Чернігів, вул. Полуботка гетьмана, буд. 18","Чернігівська обл., м. Чернігів, вул. Полуботка гетьмана, буд. 18",
КОМАНДА АНДРІЯ БАЛОГИ,Чернівецька обласна організація Єдиний Центр,Чернівецька область,26466948,"Чернівецька обл., м. Чернівці, вул. Котляревського Івана, буд. 5","Чернівецька обл., м. Чернівці, вул. Котляревського Івана, буд. 5",
КОМАНДА АНДРІЯ БАЛОГИ,Черкаська регіональна організація Єдиний Центр,Черкаська область,26489694,"Черкаська обл., м. Черкаси, вул. Кривалівська, буд. 7","Черкаська обл., м. Черкаси, вул. Кривалівська, буд. 7",
КОМАНДА АНДРІЯ БАЛОГИ,Черкаська обласна організація Єдиного Центру,Черкаська область,41395623,"Черкаська обл., м. Черкаси, вул. Хрещатик, буд. 200","Черкаська обл., м. Черкаси, вул. Хрещатик, буд. 200",
КОМАНДА АНДРІЯ БАЛОГИ,Чепелівська сільська організація Білоцерківської районної організації Єдиного Центру,Київська область,36261784,"Київська обл., Білоцерківський р-н, вул. Молодіжна, буд. 17","Київська обл., Білоцерківський р-н, вул. Молодіжна, буд. 17",
КОМАНДА АНДРІЯ БАЛОГИ,Чемеровецька районна організація партії Єдиний Центр,Хмельницька область,35800297,"Хмельницька обл., Чемеровецький р-н, вул. Садова, буд. 2","Хмельницька обл., Чемеровецький р-н, вул. Садова, буд. 2",
КОМАНДА АНДРІЯ БАЛОГИ,Хмельницька обласна організація Єдиного Центру,Хмельницька область,26495080,"Хмельницька обл., м. Хмельницький, вул. Сковороди, буд. 7","Хмельницька обл., м. Хмельницький, вул. Сковороди, буд. 7",
КОМАНДА АНДРІЯ БАЛОГИ,Херсонська обласна організація партії - Єдиний Центр,Херсонська область,26473121,"Херсонська обл., м. Херсон, вул. Мозолевського Б., буд. 24","Херсонська обл., м. Херсон, вул. Мозолевського Б., буд. 24",
КОМАНДА АНДРІЯ БАЛОГИ,Харківська обласна організація Єдиного Центру,Харківська область,26488074,"Харківська обл., м. Харків, вул. Зернова, буд. 6","Харківська обл., м. Харків, вул. Зернова, буд. 6",
КОМАНДА АНДРІЯ БАЛОГИ,Трушківська сільська організація Білоцерківської районної організації Єдиного Центру,Київська область,36261652,"Київська обл., Білоцерківський р-н, вул. Набережна, буд. 103","Київська обл., Білоцерківський р-н, вул. Набережна, буд. 103",
КОМАНДА АНДРІЯ БАЛОГИ,Терезинська селищна організація Білоцерківської районної організації Єдиного Центру,Київська область,35964504,"Київська обл., Білоцерківський р-н, вул. Гагаріна, буд. 2","Київська обл., Білоцерківський р-н, вул. Гагаріна, буд. 2",
КОМАНДА АНДРІЯ БАЛОГИ,Тернопільська обласна організація Єдиного Центру,Тернопільська область,26428959,"Тернопільська обл., м. Тернопіль, просп. Бандери Степана, буд. 10","Тернопільська обл., м. Тернопіль, просп. Бандери Степана, буд. 10",
КОМАНДА АНДРІЯ БАЛОГИ,Тарасівська сільська організація Білоцерківської районної організації Єдиного Центру,Київська область,35964457,"Київська обл., Білоцерківський р-н, вул. Поповича, буд. 13","Київська обл., Білоцерківський р-н, вул. Поповича, буд. 13",
КОМАНДА АНДРІЯ БАЛОГИ,Сумська обласна організація Єдиного Центру,Сумська область,26440245,"Сумська обл., м. Суми, Незалежності майдан, 3","Сумська обл., м. Суми, Незалежності майдан, 3",
КОМАНДА АНДРІЯ БАЛОГИ,Розаліївська сільська організація Білоцерківської районної організації Єдиного Центру,Київська область,36261758,"Київська обл., Білоцерківський р-н, вул. Перемоги, буд. 59","Київська обл., Білоцерківський р-н, вул. Перемоги, буд. 59",
КОМАНДА АНДРІЯ БАЛОГИ,Рівненська обласна організація Єдиного Центру,Рівненська область,35953712,"Рівненська обл., м. Рівне, вул. Короленка, буд. 2","Рівненська обл., м. Рівне, вул. Короленка, буд. 2",
КОМАНДА АНДРІЯ БАЛОГИ,Погребищенська районна організація Єдиний Центр,Вінницька область,35322766,"Вінницька обл., Погребищенський р-н, вул. Рокитна, буд. 16","Вінницька обл., Погребищенський р-н, вул. Рокитна, буд. 16",
КОМАНДА АНДРІЯ БАЛОГИ,Полтавська обласна організація Єдиного Центру,Полтавська область,36120683,"Полтавська обл., м. Полтава, вул. Небесної Сотні, буд. 124","Полтавська обл., м. Полтава, вул. Небесної Сотні, буд. 124",
КОМАНДА АНДРІЯ БАЛОГИ,Піщанська сільська організація Білоцерківської районної організації Єдиного Центру,Київська область,36261669,"Київська обл., Білоцерківський р-н, вул. Вишнева, буд. 15","Київська обл., Білоцерківський р-н, вул. Вишнева, буд. 15",
КОМАНДА АНДРІЯ БАЛОГИ,Печенізька районна організація Єдиного Центру,Харківська область,36202467,"Харківська обл., Печенізький р-н, вул. Незалежності, буд. 40","Харківська обл., Печенізький р-н, вул. Незалежності, буд. 40",
КОМАНДА АНДРІЯ БАЛОГИ,Одеська обласна організація Єдиного Центру,Одеська область,26507110,"Одеська обл., м. Одеса, вул. Мала Арнаутська, буд. 43","Одеська обл., м. Одеса, вул. Мала Арнаутська, буд. 43",
КОМАНДА АНДРІЯ БАЛОГИ,Обухівська районна організація Єдиний Центр,Київська область,36890236,"Київська обл., Обухівський р-н, вул. Будівельників, буд. 3","Київська обл., Обухівський р-н, вул. Будівельників, буд. 3",
КОМАНДА АНДРІЯ БАЛОГИ,Малоантонівська сільська організація Білоцерківської районної організації Єдиного Центру,Київська область,36261627,"Київська обл., Білоцерківський р-н, вул. Козака Володимира, буд. 9","Київська обл., Білоцерківський р-н, вул. Козака Володимира, буд. 9",
КОМАНДА АНДРІЯ БАЛОГИ,Михайлівська сільська організація Білоцерківської районної організації Єдиного Центру,Київська область,35964483,"Київська обл., Білоцерківський р-н, вул. Московська, буд. 32","Київська обл., Білоцерківський р-н, вул. Московська, буд. 32",
КОМАНДА АНДРІЯ БАЛОГИ,Миколаївська обласна організація Єдиний Центр,Миколаївська область,26445202,"Миколаївська обл., м. Миколаїв, вул. Защука, буд. 34","Миколаївська обл., м. Миколаїв, вул. Защука, буд. 34",
КОМАНДА АНДРІЯ БАЛОГИ,Межовська сільська організація Білоцерківської районної організації Єдиного Центру,Київська область,36261721,"Київська обл., Білоцерківський р-н, вул. Гетьманська, буд. 3","Київська обл., Білоцерківський р-н, вул. Гетьманська, буд. 3",
КОМАНДА АНДРІЯ БАЛОГИ,Людвинівська сільська організація Білоцерківської районної організації Єдиного Центру,Київська область,36261590,"Київська обл., Білоцерківський р-н, вул. Незалежна, буд. 21А","Київська обл., Білоцерківський р-н, вул. Незалежна, буд. 21А",
КОМАНДА АНДРІЯ БАЛОГИ,Львівська обласна організація партії Єдиний Центр,Львівська область,26483800,"Львівська обл., м. Львів, просп. Чорновола В., буд. 63","Львівська обл., м. Львів, просп. Чорновола В., буд. 63",
КОМАНДА АНДРІЯ БАЛОГИ,Луганська обласна організація Єдиного Центру,Луганська область,26478325,"Луганська обл., м. Сєвєродонецьк, вул. Ломоносова, буд. 21","Луганська обл., м. Сєвєродонецьк, вул. Ломоносова, буд. 21",
КОМАНДА АНДРІЯ БАЛОГИ,Лозівська районна організація Єдиний Центр,Харківська область,36111506,"Харківська обл., м. Лозова, бульв. Шевченка, буд. 2","Харківська обл., м. Лозова, бульв. Шевченка, буд. 2",
КОМАНДА АНДРІЯ БАЛОГИ,Лозівська міська організація Єдиний Центр,Харківська область,36111471,"Харківська обл., м. Лозова, бульв. Шевченка, буд. 2","Харківська обл., м. Лозова, бульв. Шевченка, буд. 2",
КОМАНДА АНДРІЯ БАЛОГИ,Крижопільська районна організація Єдиного Центру,Вінницька область,35793332,"Вінницька обл., Крижопільський р-н, вул. Чабанюка, буд. 1","Вінницька обл., Крижопільський р-н, вул. Чабанюка, буд. 1",
КОМАНДА АНДРІЯ БАЛОГИ,Коржівська сільська організація Білоцерківської районної організації Єдиного Центру,Київська область,36261737,"Київська обл., Білоцерківський р-н, вул. Вишнева, буд. 20","Київська обл., Білоцерківський р-н, вул. Вишнева, буд. 20",
КОМАНДА АНДРІЯ БАЛОГИ,Козелецька районна організація партії Єдиного Центру,Чернігівська область,36080578,"Чернігівська обл., Козелецький р-н, вул. Соборності, буд. 40","Чернігівська обл., Козелецький р-н, вул. Соборності, буд. 40",
КОМАНДА АНДРІЯ БАЛОГИ,Коженицька сільська організація Білоцерківської районної організації Єдиного Центру,Київська область,36261632,"Київська обл., Білоцерківський р-н, пров. 8 Березня, буд. 17","Київська обл., Білоцерківський р-н, пров. 8 Березня, буд. 17",
КОМАНДА АНДРІЯ БАЛОГИ,Кіровоградська обласна організація Єдиного Центру,Кіровоградська область,26493365,"Кіровоградська обл., м. Кропивницький, вул. Кропивницького, буд. 23","Кіровоградська обл., м. Кропивницький, вул. Кропивницького, буд. 23",
КОМАНДА АНДРІЯ БАЛОГИ,Київська обласна організація Єдиний Центр,київ,26387670,"м.. київ, Подільський, вул. Ярославська, буд. 56А","м.. київ, Подільський, вул. Ярославська, буд. 56А",
КОМАНДА АНДРІЯ БАЛОГИ,Київська міська регіональна організація партії Єдиний Центр,київ,26519633,"м.. київ, Подільський, вул. Ярославська, буд. 56А","м.. київ, Подільський, вул. Ярославська, буд. 56А",
КОМАНДА АНДРІЯ БАЛОГИ,Іллінецька районна організація Єдиний Центр,Вінницька область,37220107,"Вінницька обл., Іллінецький р-н, вул. Волошкова, буд. 29","Вінницька обл., Іллінецький р-н, вул. Волошкова, буд. 29",
КОМАНДА АНДРІЯ БАЛОГИ,Івано-Франківська обласна організація Єдиного Центру,Івано-франківська область,26483177,"Івано-франківська обл., м. Івано-Франківськ, вул. Василіянок, буд. 30","Івано-франківська обл., м. Івано-Франківськ, вул. Василіянок, буд. 30",
КОМАНДА АНДРІЯ БАЛОГИ,Житомирська обласна організація Єдиного Центру,Житомирська область,26478992,"Житомирська обл., м. Житомир, вул. Чуднівська, буд. 108А","Житомирська обл., м. Житомир, вул. Чуднівська, буд. 108А",
КОМАНДА АНДРІЯ БАЛОГИ,Донецька обласна організація Єдиного Центру,Донецька область,26480977,"Донецька обл., м. Маріуполь, просп. Миру, буд. 123А","Донецька обл., м. Маріуполь, просп. Миру, буд. 123А",
КОМАНДА АНДРІЯ БАЛОГИ,Дніпропетровська обласна організація Єдиного Центру,Дніпропетровська область,26461224,"Дніпропетровська обл., м. Дніпро, вул. Виконкомівська (Новокодацький р-н, ), 16","Дніпропетровська обл., м. Дніпро, вул. Виконкомівська (Новокодацький р-н, ), 16",
КОМАНДА АНДРІЯ БАЛОГИ,Глушківська сільська організація Білоцерківської районної організації Єдиного Центру,Київська область,36261941,"Київська обл., Білоцерківський р-н, вул. Весняна, буд. 3","Київська обл., Білоцерківський р-н, вул. Весняна, буд. 3",
КОМАНДА АНДРІЯ БАЛОГИ,Воловецька районна організація Єдиного Центру,Закарпатська область,36718543,"Закарпатська обл., Воловецький р-н, вул. Шевченка, буд. 2","Закарпатська обл., Воловецький р-н, вул. Шевченка, буд. 2",
КОМАНДА АНДРІЯ БАЛОГИ,Волинська обласна організація Єдиного Центру,Волинська область,26516310,"Волинська обл., м. Луцьк, вул. Привокзальна, буд. 12","Волинська обл., м. Луцьк, вул. Привокзальна, буд. 12",
КОМАНДА АНДРІЯ БАЛОГИ,Вінницька районна організація Єдиного Центру,Вінницька область,36150744,"Вінницька обл., м. Вінниця, Хмельницьке шосе, 145","Вінницька обл., м. Вінниця, Хмельницьке шосе, 145",
КОМАНДА АНДРІЯ БАЛОГИ,Вінницька обласна організація Єдиного Центру,Вінницька область,26421733,"Вінницька обл., м. Вінниця, пров. Цегельний, буд. 2","Вінницька обл., м. Вінниця, пров. Цегельний, буд. 2",
КОМАНДА АНДРІЯ БАЛОГИ,Вільнотарасівська сільська організація Білоцерківської районної організації Єдиного Центру,Київська область,35964441,"Київська обл., Білоцерківський р-н, вул. Шевченка, буд. 8","Київська обл., Білоцерківський р-н, вул. Шевченка, буд. 8",
КОМАНДА АНДРІЯ БАЛОГИ,Білоцерківська міська організація Партії Єдиний Центр,Київська область,36055494,"Київська обл., м. Біла Церква, вул. Нєкрасова, буд. 84","Київська обл., м. Біла Церква, вул. Нєкрасова, буд. 84",
КОМАНДА АНДРІЯ БАЛОГИ,Бершадська районна організація Єдиного Центру,Вінницька область,36101938,"Вінницька обл., Бершадський р-н, вул. Героїв України, буд. 20","Вінницька обл., Бершадський р-н, вул. Героїв України, буд. 20",
КОМАНДА АНДРІЯ БАЛОГИ,Центральний офіс,Закарпатська область,21708140,"Закарпатська обл., Мукачівський р-н, вул. Пряшівська, буд. 18","Закарпатська обл., Мукачівський р-н, вул. Пряшівська, буд. 18","АТ ""ТАСКОМБАНК"" м.Київ, ЄДРПОУ: 09806443, р/р № UA183395000000026008492055001"
КОМАНДА АНДРІЯ БАЛОГИ,Запорізька обласна організація Єдиного Центру,Запорізька область,26469697,"Запорізька обл., м. Запоріжжя, вул. Сталеварів, буд. 13","Запорізька обл., м. Запоріжжя, вул. Сталеварів, буд. 13",
