Вид фінансових зобовʼязань,Дата виникнення,Сума (вартість) зобовʼязання на момент виникнення,ПІБ (для фіз. осіб)/Назва (для юр. осіб),Ідентифікаційний код (для фіз. осіб)/Код ЄДРПОУ (для юр. осіб),Місце проживання (для фіз. осіб)/Юридична адреса (для юр. осіб),Сума (вартість) на кінець звітного періоду грн,Тип особи,Партія,Місцева організація,Код ЄДРПОУ осередку,Географічний обʼєкт,Квартал,Рік
неустойка на користь Управління комунальної власності ЛМР ,24.04.2020,125542.69,Управління комунальної власності ДЕР ЛМР,25558625,"м. Львів, Галицький р-н, пл. Галицька, буд. 15",125542.69,Юридична особа,РЕСПУБЛІКАНСЬКА ПЛАТФОРМА,Галицька районна організація Української республіканської партії Собор,20772874,Львівська область,3,2024
судовий збір на користь Управління комунальної власності ЛМР ,24.04.2020,1921.0,Управління комунальної власності ДЕР ЛМР,25558625,"м. Львів, Галицький р-н, пл. Галицька, буд. 15",1921.0,Юридична особа,РЕСПУБЛІКАНСЬКА ПЛАТФОРМА,Галицька районна організація Української республіканської партії Собор,20772874,Львівська область,3,2024
"виконавчий збір, основна винагорода приватного виконавця",24.04.2020,12554.27,Галицький відділ державної виконавчої служби у місті Львові. Приватний виконавець Білецький І.М.,35009232,"м. Львів, пр. Чорновола, буд. 39",12554.27,Юридична особа,РЕСПУБЛІКАНСЬКА ПЛАТФОРМА,Галицька районна організація Української республіканської партії Собор,20772874,Львівська область,3,2024
витрати на виконавче провадження,24.04.2020,487.64,Галицький відділ державної виконавчої служби у місті Львові. Приватний виконавець Білецький І.М.,35009232,"м. Львів, пр. Чорновола, буд. 39",487.64,Юридична особа,РЕСПУБЛІКАНСЬКА ПЛАТФОРМА,Галицька районна організація Української республіканської партії Собор,20772874,Львівська область,3,2024
Заборгованість перед УКВ ДЕП ЛМР,20.05.2020,270740.7,УКВ ДЕП ЛМР,25558625,"м. Львів, пл. Галицька, буд. 15",270740.7,Юридична особа,РЕСПУБЛІКАНСЬКА ПЛАТФОРМА,Львівська обласна організація,33981837,Львівська область,3,2024
Виконавчий збір,20.05.2020,27074.07,Галицький відділ державної виконавчої служби у місті Львові,35009232,"м. Львів, пр. Чорновола, буд. 39",27074.07,Юридична особа,РЕСПУБЛІКАНСЬКА ПЛАТФОРМА,Львівська обласна організація,33981837,Львівська область,3,2024
Стягнення заборгованості по орендній платі на користь УКВ ДЕП ЛМР,20.05.2021,67813.02,УКВ ДЕП ЛМР,25558625,"м. Львів, пл. Галицька, буд. 15",67813.02,Юридична особа,РЕСПУБЛІКАНСЬКА ПЛАТФОРМА,Львівська обласна організація,33981837,Львівська область,3,2024
Виконавчий збір,20.05.2021,6781.3,Галицький відділ державної виконавчої служби у місті Львові,35009232,"м. Львів, пр. Чорновола, буд. 39",6781.3,Юридична особа,РЕСПУБЛІКАНСЬКА ПЛАТФОРМА,Львівська обласна організація,33981837,Львівська область,3,2024
