НАРОДНО-ДЕМОКРАТИЧНА ПАРТІЯ (НДП),СІМФЕРОПОЛЬСЬКА РАЙОННА ТЕРИТОРІАЛЬНА ОРГАНІЗАЦІЯ НАРОДНО- ДЕМОКРАТИЧНОЇ ПАРТІЇ УКРАЇНИ,Автономна республіка крим,25739309,"Автономна республіка крим, Сімферопольський р-н, вул. Жовтнева, буд. 3","Автономна республіка крим, Сімферопольський р-н, вул. Жовтнева, буд. 3",
НАРОДНО-ДЕМОКРАТИЧНА ПАРТІЯ (НДП),ТОМАШПІЛЬСЬКА РАЙОННА ОРГАНІЗАЦІЯ НАРОДНО-ДЕМОКРАТИЧНОЇ ПАРТІЇ (ТОМАШПІЛЬСЬКА РАЙОННА ОРГАНІЗАЦІЯ НДП),Вінницька область,25508389,"Вінницька обл., Тульчинський р-н, вул. Квіткова, буд. 7","Вінницька обл., Тульчинський р-н, вул. Квіткова, буд. 7",
НАРОДНО-ДЕМОКРАТИЧНА ПАРТІЯ (НДП),МИКОЛАЇВСЬКА ОБЛАСНА ОРГАНІЗАЦІЯ НАРОДНО-ДЕМОКРАТИЧНОЇ ПАРТІЇ (НОО НДП),Миколаївська область,23087877,"Миколаївська обл., м. Миколаїв, вул. Пушкінська, буд. 17","Миколаївська обл., м. Миколаїв, вул. Пушкінська, буд. 17",
НАРОДНО-ДЕМОКРАТИЧНА ПАРТІЯ (НДП),РАЙОННА ОРГАНІЗАЦІЯ НАРОДНО-ДЕМОКРАТИЧНОЇ ПАРТІЇ,Житомирська область,25310687,"Житомирська обл., Новоград-Волинський р-н, вул. Соборна, буд. 18","Житомирська обл., Новоград-Волинський р-н, вул. Соборна, буд. 18",
НАРОДНО-ДЕМОКРАТИЧНА ПАРТІЯ (НДП),ЧЕРНІВЕЦЬКА ОБЛАСНА ОРГАНІЗАЦІЯ НАРОДНО-ДЕМОКРАТИЧНОЇ ПАРТІЇ,Чернівецька область,25079103,"Чернівецька обл., м. Чернівці, вул. Бандери Степана, буд. 11","Чернівецька обл., м. Чернівці, вул. Бандери Степана, буд. 11",
НАРОДНО-ДЕМОКРАТИЧНА ПАРТІЯ (НДП),ХМЕЛЬНИЦЬКА ОБЛАСНА ОРГАНІЗАЦІЯ НАРОДНО-ДЕМОКРАТИЧНОЇ ПАРТІЇ (ХМЕЛЬНИЦЬКА ОБЛАСНА ОРГАНІЗАЦІЯ НДП),Хмельницька область,23846001,"Хмельницька обл., м. Хмельницький, вул. Чорновола В. м. ., буд. 88","Хмельницька обл., м. Хмельницький, вул. Чорновола В. м. ., буд. 88",
НАРОДНО-ДЕМОКРАТИЧНА ПАРТІЯ (НДП),КРИМСЬКА РЕСПУБЛІКАНСЬКА ОРГАНІЗАЦІЯ НАРОДНО-ДЕМОКРАТИЧНОЇ ПАРТІЇ (НДП) (КРО НДП),Автономна республіка крим,22307704,"Автономна республіка крим, м. Сімферополь, вул. Єфремова, буд. 18","Автономна республіка крим, м. Сімферополь, вул. Єфремова, буд. 18",
НАРОДНО-ДЕМОКРАТИЧНА ПАРТІЯ (НДП),ЧЕРНІГІВСЬКА ОБЛАСНА ОРГАНІЗАЦІЯ НАРОДНО-ДЕМОКРАТИЧНОЇ ПАРТІЇ (ЧОО НДП),Чернігівська область,24554878,"Чернігівська обл., м. Чернігів, просп. Миру, буд. 17","Чернігівська обл., м. Чернігів, просп. Миру, буд. 17",
НАРОДНО-ДЕМОКРАТИЧНА ПАРТІЯ (НДП),МУРОВАНОКУРИЛОВЕЦЬКА РАЙОННА ОРГАНІЗАЦІЯ НАРОДНО-ДЕМОКРАТИЧНОЇ ПАРТІЇ (МРОНДП),Вінницька область,24897609,"Вінницька обл., Могилів-Подільський р-н, вул. Ветеранів Війни, буд. 17","Вінницька обл., Могилів-Подільський р-н, вул. Ветеранів Війни, буд. 17",
НАРОДНО-ДЕМОКРАТИЧНА ПАРТІЯ (НДП),ПОГРЕБИЩЕНСЬКА РАЙОННА ОРГАНІЗАЦІЯ НАРОДНО-ДЕМОКРАТИЧНОЇ ПАРТІЇ,Вінницька область,20103707,"Вінницька обл., Вінницький р-н, вул. Вінницька, буд. 6","Вінницька обл., Вінницький р-н, вул. Вінницька, буд. 6",
НАРОДНО-ДЕМОКРАТИЧНА ПАРТІЯ (НДП),СЕВАСТОПОЛЬСЬКА МІСЬКА ОРГАНІЗАЦІЯ НАРОДНО-ДЕМОКРАТИЧНОЇ ПАРТІЇ УКРАЇНИ (СМО НДПУ),севастополь,24868447,"м.. севастополь, Балаклавський, вул. Леніна, буд. 13","м.. севастополь, Балаклавський, вул. Леніна, буд. 13",
НАРОДНО-ДЕМОКРАТИЧНА ПАРТІЯ (НДП),ПОЛТАВСЬКА ОБЛАСНА ОРГАНІЗАЦІЯ НАРОДНО-ДЕМОКРАТИЧНОЇ ПАРТІЇ,Полтавська область,24828755,"Полтавська обл., м. Полтава, вул. Котляревського, буд. 24","Полтавська обл., м. Полтава, вул. Котляревського, буд. 24",
НАРОДНО-ДЕМОКРАТИЧНА ПАРТІЯ (НДП),ТЕРНОПІЛЬСЬКА РАЙОННА ОРГАНІЗАЦІЯ НАРОДНО-ДЕМОКРАТИЧНОЇ ПАРТІЇ /НДП/ (ТЕРНОПІЛЬСЬКА РОНДП),Тернопільська область,33916160,"Тернопільська обл., м. Тернопіль, бульв. Шевченка Тараса, буд. 1","Тернопільська обл., м. Тернопіль, бульв. Шевченка Тараса, буд. 1",
НАРОДНО-ДЕМОКРАТИЧНА ПАРТІЯ (НДП),КИЇВСЬКА МІСЬКА ОРГАНІЗАЦІЯ НАРОДНО-ДЕМОКРАТИЧНОЇ ПАРТІЇ (КМО НДП),київ,24568900,"м.. київ, Голосіївський, вул. Лютеранська, буд. 19Б","м.. київ, Голосіївський, вул. Лютеранська, буд. 19Б",
НАРОДНО-ДЕМОКРАТИЧНА ПАРТІЯ (НДП),КИЇВСЬКА ОБЛАСНА ОРГАНІЗАЦІЯ НАРОДНО-ДЕМОКРАТИЧНОЇ ПАРТІЇ (КОО НДП),київ,23582619,"м.. київ, Голосіївський, вул. Антоновича, буд. 107А","м.. київ, Голосіївський, вул. Антоновича, буд. 107А",
НАРОДНО-ДЕМОКРАТИЧНА ПАРТІЯ (НДП),КРИНИЧАНСЬКА РАЙОННА ОРГАНІЗАЦІЯ НАРОДНО-ДЕМОКРАТИЧНОЇ ПАРТІЇ (КРИНИЧАНСЬКА РАЙОННА ОРГАНІЗАЦІЯ НДП),Дніпропетровська область,25972336,"Дніпропетровська обл., Камʼянський р-н, вул. Грушевського Михайла, буд. 2","Дніпропетровська обл., Камʼянський р-н, вул. Грушевського Михайла, буд. 2",
НАРОДНО-ДЕМОКРАТИЧНА ПАРТІЯ (НДП),НІКОПОЛЬСЬКА РАЙОННА ОРГАНІЗАЦІЯ НАРОДНО-ДЕМОКРАТИЧНОЇ ПАРТІЇ (НІКОПОЛЬСЬКА РАЙОННА ОРГАНІЗАЦІЯ НДП),Дніпропетровська область,34052727,"Дніпропетровська обл., Нікопольський р-н, вул. Чалого, буд. 121А","Дніпропетровська обл., Нікопольський р-н, вул. Чалого, буд. 121А",
НАРОДНО-ДЕМОКРАТИЧНА ПАРТІЯ (НДП),ДНІПРОПЕТРОВСЬКА МІСЬКА ОРГАНІЗАЦІЯ НАРОДНО-ДЕМОКРАТИЧНОЇ ПАРТІЇ (НДП),Дніпропетровська область,25022178,"Дніпропетровська обл., м. Дніпро, вул. Глинки, буд. 16","Дніпропетровська обл., м. Дніпро, вул. Глинки, буд. 16",
НАРОДНО-ДЕМОКРАТИЧНА ПАРТІЯ (НДП),ДНІПРОПЕТРОВСЬКА ОБЛАСНА ОРГАНІЗАЦІЯ НАРОДНО-ДЕМОКРАТИЧНОЇ ПАРТІЇ,Дніпропетровська область,24439261,"Дніпропетровська обл., м. Дніпро, вул. Старокозацька, буд. 58","Дніпропетровська обл., м. Дніпро, вул. Старокозацька, буд. 58",
НАРОДНО-ДЕМОКРАТИЧНА ПАРТІЯ (НДП),ТРОСТЯНЕЦЬКА РАЙОННА ОРГАНІЗАЦІЯ НАРОДНО - ДЕМОКРАТИЧНОЇ ПАРТІЇ,Вінницька область,24895533,"Вінницька обл., Гайсинський р-н, вул. Соборна, буд. 37","Вінницька обл., Гайсинський р-н, вул. Соборна, буд. 37",
НАРОДНО-ДЕМОКРАТИЧНА ПАРТІЯ (НДП),ХМІЛЬНИЦЬКА РАЙОННА ОРГАНІЗАЦІЯ НАРОДНО-ДЕМОКРАТИЧНОЇ ПАРТІЇ УКРАЇНИ (ХМІЛЬНИЦЬКА РАЙОННА ОНДПУ),Вінницька область,24895214,"Вінницька обл., Хмільницький р-н, вул. Пушкіна, буд. 39","Вінницька обл., Хмільницький р-н, вул. Пушкіна, буд. 39",
НАРОДНО-ДЕМОКРАТИЧНА ПАРТІЯ (НДП),КІРОВОГРАДСЬКА ОБЛАСНА ОРГАНІЗАЦІЯ НАРОДНО-ДЕМОКРАТИЧНОЇ ПАРТІЇ (КОО НДП),Кіровоградська область,23688080,"Кіровоградська обл., м. Кропивницький, вул. Гагаріна, буд. 9","Кіровоградська обл., м. Кропивницький, вул. Гагаріна, буд. 9",
НАРОДНО-ДЕМОКРАТИЧНА ПАРТІЯ (НДП),МАНЕВИЦЬКА РАЙОННА ОРГАНІЗАЦІЯ НАРОДНО-ДЕМОКРАТИЧНОЇ ПАРТІЇ (НДП),Волинська область,37236544,"Волинська обл., Камінь-Каширський р-н, вул. Партизанська, буд. 18","Волинська обл., Камінь-Каширський р-н, вул. Партизанська, буд. 18",
НАРОДНО-ДЕМОКРАТИЧНА ПАРТІЯ (НДП),КАЛИНІВСЬКА РАЙОННА ОРГАНІЗАЦІЯ НАРОДНО-ДЕМОКРАТИЧНОЇ ПАРТІЇ (РОНДП),Вінницька область,24898069,"Вінницька обл., Хмільницький р-н, вул. Незалежності, буд. 1","Вінницька обл., Хмільницький р-н, вул. Незалежності, буд. 1",
НАРОДНО-ДЕМОКРАТИЧНА ПАРТІЯ (НДП),РІВНЕНСЬКА МІСЬКА ОРГАНІЗАЦІЯ НАРОДНО-ДЕМОКРАТИЧНОЇ ПАРТІЇ (НДП) (РМО НДП),Рівненська область,22563100,"Рівненська обл., м. Рівне, вул. Данила Галицького, буд. 16","Рівненська обл., м. Рівне, вул. Данила Галицького, буд. 16",
НАРОДНО-ДЕМОКРАТИЧНА ПАРТІЯ (НДП),ПОПІЛЬНЯНСЬКА РАЙОННА ОРГАНІЗАЦІЯ НАРОДНО-ДЕМОКРАТИЧНОЇ ПАРТІЇ (ПРО НДП),Житомирська область,35449288,"Житомирська обл., Житомирський р-н, вул. Каштанова, буд. 102","Житомирська обл., Житомирський р-н, вул. Каштанова, буд. 102",
НАРОДНО-ДЕМОКРАТИЧНА ПАРТІЯ (НДП),НЕМИРІВСЬКА РАЙОННА ОРГАНІЗАЦІЯ НАРОДНО - ДЕМОКРАТИЧНОЇ ПАРТІЇ,Вінницька область,24896656,"Вінницька обл., Вінницький р-н, пров. Будівельників, буд. 10","Вінницька обл., Вінницький р-н, пров. Будівельників, буд. 10",
НАРОДНО-ДЕМОКРАТИЧНА ПАРТІЯ (НДП),ПІЩАНСЬКА РАЙОННА ОРГАНІЗАЦІЯ НАРОДНО-ДЕМОКРАТИЧНОЇ ПАРТІЇ (ПІЩАНСЬКА РОНДП),Вінницька область,34364408,"Вінницька обл., Тульчинський р-н, вул. Центральна, буд. 55","Вінницька обл., Тульчинський р-н, вул. Центральна, буд. 55",
НАРОДНО-ДЕМОКРАТИЧНА ПАРТІЯ (НДП),КРИВОРІЗЬКИЙ РАЙОННИЙ ОСЕРЕДОК НАРОДНО- ДЕМОКРАТИЧНОЇ ПАРТІЇ УКРАЇНИ,Дніпропетровська область,25721545,"Дніпропетровська обл., Криворізький р-н, вул. Меліоративна, буд. 1","Дніпропетровська обл., Криворізький р-н, вул. Меліоративна, буд. 1",
НАРОДНО-ДЕМОКРАТИЧНА ПАРТІЯ (НДП),ГЛИБОЦЬКА РАЙОННА ОРГАНІЗАЦІЯ НАРОДНО- ДЕМОКРАТИЧНОЇ ПАРТІЇ УКРАЇНИ,Чернівецька область,21418904,"Чернівецька обл., Чернівецький р-н, вул. Заводська, буд. 2","Чернівецька обл., Чернівецький р-н, вул. Заводська, буд. 2",
НАРОДНО-ДЕМОКРАТИЧНА ПАРТІЯ (НДП),КРАСНОАРМІЙСЬКА МІСЬКА ОРГАНІЗАЦІЯ НАРОДНО-ДЕМОКРАТИЧНОЇ ПАРТІЇ,Донецька область,25703277,"Донецька обл., Покровський р-н, Шахтарський м-р-н, 1","Донецька обл., Покровський р-н, Шахтарський м-р-н, 1",
НАРОДНО-ДЕМОКРАТИЧНА ПАРТІЯ (НДП),ГАЙВОРОНСЬКА РАЙОННА ОРГАНІЗАЦІЯ НАРОДНО- ДЕМОКРАТИЧНОЇ ПАРТІЇ,Кіровоградська область,33142311,"Кіровоградська обл., Голованівський р-н, вул. Гайворонська, буд. 7","Кіровоградська обл., Голованівський р-н, вул. Гайворонська, буд. 7",
НАРОДНО-ДЕМОКРАТИЧНА ПАРТІЯ (НДП),ЯГОТИНСЬКА РАЙОННА ОРГАНІЗАЦІЯ НАРОДНО- ДЕМОКРАТИЧНОЇ ПАРТІЇ,Київська область,25667490,"Київська обл., Бориспільський р-н, вул. Шевченка, буд. 235","Київська обл., Бориспільський р-н, вул. Шевченка, буд. 235",
НАРОДНО-ДЕМОКРАТИЧНА ПАРТІЯ (НДП),ЖИДАЧІВСЬКА РАЙОННА ОРГАНІЗАЦІЯ НАРОДНО- ДЕМОКРАТИЧНОЇ ПАРТІЇ,Львівська область,25234383,"Львівська обл., Стрийський р-н, вул. Надбережна, буд. 54","Львівська обл., Стрийський р-н, вул. Надбережна, буд. 54",
НАРОДНО-ДЕМОКРАТИЧНА ПАРТІЯ (НДП),ОРГАНІЗАЦІЯ НАРОДНО- ДЕМОКРАТИЧНОЇ ПАРТІЇ ЖОВТНЕВОГО РАЙОНУ М ЛУГАНСЬКА,Луганська область,25372300,"Луганська обл., м. Луганськ, вул. Дачная, буд. 5","Луганська обл., м. Луганськ, вул. Дачная, буд. 5",
НАРОДНО-ДЕМОКРАТИЧНА ПАРТІЯ (НДП),ЛЬВІВСЬКА МІСЬКА ОРГАНІЗАЦІЯ НАРОДНО- ДЕМОКРАТИЧНОЇ ПАРТІЇ,Львівська область,25235678,"Львівська обл., м. Львів, проїзд Крива Липа, 6","Львівська обл., м. Львів, проїзд Крива Липа, 6",
НАРОДНО-ДЕМОКРАТИЧНА ПАРТІЯ (НДП),БЕРЕЗНІВСЬКА РАЙОННА ОРГАНІЗАЦІЯ НАРОДНО- ДЕМОКРАТИЧНОЇ ПАРТІЇ,Рівненська область,25323555,"Рівненська обл., Рівненський р-н, вул. Андріївська, буд. 63","Рівненська обл., Рівненський р-н, вул. Андріївська, буд. 63",
НАРОДНО-ДЕМОКРАТИЧНА ПАРТІЯ (НДП),ОРГАНІЗАЦІЯ НАРОДНО- ДЕМОКРАТИЧНОЇ ПАРТІЇ ЧУГУЇВСЬКОГО РАЙОНУ,Харківська область,25612655,"Харківська обл., Чугуївський р-н, вул. Горішного, буд. 128","Харківська обл., Чугуївський р-н, вул. Горішного, буд. 128",
НАРОДНО-ДЕМОКРАТИЧНА ПАРТІЯ (НДП),ЗВЕНИГОРОДСЬКИЙ РАЙОННИЙ ОСЕРЕДОК НАРОДНО- ДЕМОКРАТИЧНОЇ ПАРТІЇ,Черкаська область,25210891,"Черкаська обл., Звенигородський р-н, вул. Шевченка, буд. 28","Черкаська обл., Звенигородський р-н, вул. Шевченка, буд. 28",
НАРОДНО-ДЕМОКРАТИЧНА ПАРТІЯ (НДП),ТЕРЕБОВЛЯНСЬКА РАЙОННА ОРГАНІЗАЦІЯ НАРОДНО- ДЕМОКРАТИЧНОЇ ПАРТІЇ УКРАЇНИ,Тернопільська область,25347549,"Тернопільська обл., Тернопільський р-н, вул. Застіноцька, буд. 20","Тернопільська обл., Тернопільський р-н, вул. Застіноцька, буд. 20",
НАРОДНО-ДЕМОКРАТИЧНА ПАРТІЯ (НДП),НОВОВОДОЛАЗЬКА РАЙОННА ОРГАНІЗАЦІЯ НАРОДНО- ДЕМОКРАТИЧНОЇ ПАРТІЇ ХАРКІВСЬКОЇ ОБЛАСТІ,Харківська область,30039629,"Харківська обл., Харківський р-н, вул. Зелена, буд. 12","Харківська обл., Харківський р-н, вул. Зелена, буд. 12",
НАРОДНО-ДЕМОКРАТИЧНА ПАРТІЯ (НДП),ОРГАНІЗАЦІЯ НАРОДНО- ДЕМОКРАТИЧНОЇ ПАРТІЇ КИЇВСЬКОГО РАЙОНУ МІСТА ХАРКОВА,Харківська область,23752926,"Харківська обл., м. Харків, вул. Петрозаводська, буд. 32","Харківська обл., м. Харків, вул. Петрозаводська, буд. 32",
НАРОДНО-ДЕМОКРАТИЧНА ПАРТІЯ (НДП),ГОРЛІВСЬКА МІСЬКА ОРГАНІЗАЦІЯ НАРОДНО- ДЕМОКРАТИЧНОЇ ПАРТІЇ,Донецька область,25342262,"Донецька обл., м. Горлівка, вул. ""Іскри"", буд. 33","Донецька обл., м. Горлівка, вул. ""Іскри"", буд. 33",
НАРОДНО-ДЕМОКРАТИЧНА ПАРТІЯ (НДП),НОВОГРАД-ВОЛИНСЬКА МІСЬКРАЙОННА ОРГАНІЗАЦІЯ НАРОДНО- ДЕМОКРАТИЧНОЇ ПАРТІЇ УКРАЇНИ,Житомирська область,25303894,"Житомирська обл., Новоград-Волинський р-н, вул. Єрьоменка, буд. 10","Житомирська обл., Новоград-Волинський р-н, вул. Єрьоменка, буд. 10",
НАРОДНО-ДЕМОКРАТИЧНА ПАРТІЯ (НДП),КОЗЕЛЕЦЬКА РАЙОННА ОРГАНІЗАЦІЯ НАРОДНО- ДЕМОКРАТИЧНОЇ ПАРТІЇ,Чернігівська область,25623334,"Чернігівська обл., Чернігівський р-н, вул. Амосова, буд. 4","Чернігівська обл., Чернігівський р-н, вул. Амосова, буд. 4",
НАРОДНО-ДЕМОКРАТИЧНА ПАРТІЯ (НДП),ЛИСИЧАНСЬКА МІСЬКА ОРГАНІЗАЦІЯ НАРОДНО- ДЕМОКРАТИЧНОЇ ПАРТІЇ,Луганська область,25354325,"Луганська обл., Сєвєродонецький р-н, вул. Зелена, буд. 100","Луганська обл., Сєвєродонецький р-н, вул. Зелена, буд. 100",
НАРОДНО-ДЕМОКРАТИЧНА ПАРТІЯ (НДП),ВАСИЛЬКІВСЬКА РАЙОННА ОРГАНІЗАЦІЯ НАРОДНО- ДЕМОКРАТИЧНОЇ ПАРТІЇ УКРАЇНИ,Дніпропетровська область,25542541,"Дніпропетровська обл., Синельниківський р-н, вул. Будівельників, буд. 149","Дніпропетровська обл., Синельниківський р-н, вул. Будівельників, буд. 149",
НАРОДНО-ДЕМОКРАТИЧНА ПАРТІЯ (НДП),ЧЕРКАСЬКА МІСЬКРАЙОННА ОРГАНІЗАЦІЯ НАРОДНО- ДЕМОКРАТИЧНОЇ ПАРТІЇ,Черкаська область,25204991,"Черкаська обл., м. Черкаси, вул. Лазарева, буд. 6","Черкаська обл., м. Черкаси, вул. Лазарева, буд. 6",
НАРОДНО-ДЕМОКРАТИЧНА ПАРТІЯ (НДП),КОРОПСЬКА РАЙОННА ОРГАНІЗАЦІЯ НАРОДНО- ДЕМОКРАТИЧНОЇ ПАРТІЇ,Чернігівська область,25621269,"Чернігівська обл., Новгород-Сіверський р-н, вул. Піщана, буд. 1","Чернігівська обл., Новгород-Сіверський р-н, вул. Піщана, буд. 1",
НАРОДНО-ДЕМОКРАТИЧНА ПАРТІЯ (НДП),МЕНСЬКА РАЙОННА ОРГАНІЗАЦІЯ НАРОДНО- ДЕМОКРАТИЧНОЇ ПАРТІЇ,Чернігівська область,25621571,"Чернігівська обл., Корюківський р-н, вул. Троїцька, буд. 4А","Чернігівська обл., Корюківський р-н, вул. Троїцька, буд. 4А",
НАРОДНО-ДЕМОКРАТИЧНА ПАРТІЯ (НДП),РОЖНЯТІВСЬКА РАЙОННА ОРГАНІЗАЦІЯ НАРОДНО- ДЕМОКРАТИЧНОЇ ПАРТІЇ,Івано-франківська область,25069799,"Івано-франківська обл., Калуський р-н, пл. Єдності, 13","Івано-франківська обл., Калуський р-н, пл. Єдності, 13",
НАРОДНО-ДЕМОКРАТИЧНА ПАРТІЯ (НДП),ОЛЕВСЬКА РАЙОННА ОРГАНІЗАЦІЯ НАРОДНО- ДЕМОКРАТИЧНОЇ ПАРТІЇ,Житомирська область,24707276,"Житомирська обл., Житомирський р-н, вул. Садова, буд. 66","Житомирська обл., Житомирський р-н, вул. Садова, буд. 66",
НАРОДНО-ДЕМОКРАТИЧНА ПАРТІЯ (НДП),ВАРВИНСЬКА РАЙОННА ОРГАНІЗАЦІЯ НАРОДНО- ДЕМОКРАТИЧНОЇ ПАРТІЇ,Чернігівська область,33954489,"Чернігівська обл., Прилуцький р-н, майдан Центральний, 14","Чернігівська обл., Прилуцький р-н, майдан Центральний, 14",
НАРОДНО-ДЕМОКРАТИЧНА ПАРТІЯ (НДП),ТЛУМАЦЬКА МІСЬКА ОРГАНІЗАЦІЯ НАРОДНО- ДЕМОКРАТИЧНОЇ ПАРТІЇ,Івано-франківська область,25073537,"Івано-франківська обл., Івано-Франківський р-н, вул. Шевченка, буд. 2А","Івано-франківська обл., Івано-Франківський р-н, вул. Шевченка, буд. 2А",
НАРОДНО-ДЕМОКРАТИЧНА ПАРТІЯ (НДП),БОГРОДЧАНСЬКА РАЙОННА ОРГАНІЗАЦІЯ НАРОДНО- ДЕМОКРАТИЧНОЇ ПАРТІЇ,Івано-франківська область,25072986,"Івано-франківська обл., Івано-Франківський р-н, вул. Бічна, буд. 2","Івано-франківська обл., Івано-Франківський р-н, вул. Бічна, буд. 2",
НАРОДНО-ДЕМОКРАТИЧНА ПАРТІЯ (НДП),НЕТІШИНСЬКА МІСЬКА ОРГАНІЗАЦІЯ НАРОДНО- ДЕМОКРАТИЧНОЇ ПАРТІЇ,Хмельницька область,33965244,"Хмельницька обл., Шепетівський р-н, вул. Будівельників, буд. 15","Хмельницька обл., Шепетівський р-н, вул. Будівельників, буд. 15",
НАРОДНО-ДЕМОКРАТИЧНА ПАРТІЯ (НДП),ПОГРЕБИЩЕНСЬКА МІСЬКА ОРГАНІЗАЦІЯ НАРОДНО- ДЕМОКРАТИЧНОЇ ПАРТІЇ,Вінницька область,37179570,"Вінницька обл., Вінницький р-н, вул. Богуна, буд. 4","Вінницька обл., Вінницький р-н, вул. Богуна, буд. 4",
