НАРОДНО-ДЕМОКРАТИЧНА ПАРТІЯ (НДП),ОРГАНІЗАЦІЯ НАРОДНО- ДЕМОКРАТИЧНОЇ ПАРТІЇ ХАРКІВСЬКОГО РАЙОНУ ХАРКІВСЬКОЇ ОБЛАСТІ,Харківська область,24662852,"Харківська обл., Харківський р-н, вул. Вавилова, буд. 37","Харківська обл., Харківський р-н, вул. Вавилова, буд. 37",
НАРОДНО-ДЕМОКРАТИЧНА ПАРТІЯ (НДП),КРАСНОКУТСЬКА РАЙОННА ОРГАНІЗАЦІЯ НАРОДНО- ДЕМОКРАТИЧНОЇ ПАРТІЇ,Харківська область,25616995,"Харківська обл., Богодухівський р-н, вул. Перемоги, буд. 5","Харківська обл., Богодухівський р-н, вул. Перемоги, буд. 5",
НАРОДНО-ДЕМОКРАТИЧНА ПАРТІЯ (НДП),МІСЬКА ОРГАНІЗАЦІЯ НАРОДНО- ДЕМОКРАТИЧНОЇ ПАРТІЇ УКРАЇНИ,Донецька область,25608553,"Донецька обл., Краматорський р-н, вул. Зелена, буд. 13","Донецька обл., Краматорський р-н, вул. Зелена, буд. 13",
НАРОДНО-ДЕМОКРАТИЧНА ПАРТІЯ (НДП),ГАДЯЦЬКА РАЙОННА ОРГАНІЗАЦІЯ НАРОДНО- ДЕМОКРАТИЧНОЇ ПАРТІЇ,Полтавська область,25783693,"Полтавська обл., Миргородський р-н, вул. Перевальна, буд. 9","Полтавська обл., Миргородський р-н, вул. Перевальна, буд. 9",
НАРОДНО-ДЕМОКРАТИЧНА ПАРТІЯ (НДП),КОСТОПІЛЬСЬКА РАЙОННА ОРГАНІЗАЦІЯ НАРОДНО- ДЕМОКРАТИЧНОЇ ПАРТІЇ,Рівненська область,24177772,"Рівненська обл., Рівненський р-н, вул. Грушевського м. ., буд. 27","Рівненська обл., Рівненський р-н, вул. Грушевського м. ., буд. 27",
НАРОДНО-ДЕМОКРАТИЧНА ПАРТІЯ (НДП),ФЕОДОСІЙСЬКА МІСЬКА ОРГАНІЗАЦІЯ НАРОДНО- ДЕМОКРАТИЧНОЇ ПАРТІЇ,Автономна республіка крим,25871061,"Автономна республіка крим, м. Феодосія, набережна Чорноморська, 3","Автономна республіка крим, м. Феодосія, набережна Чорноморська, 3",
НАРОДНО-ДЕМОКРАТИЧНА ПАРТІЯ (НДП),ЗАЧЕПИЛІВСЬКАРАЙОННА ОРГАНІЗАЦІЯ НАРОДНО- ДЕМОКРАТИЧНОЇ ПАРТІЇ,Харківська область,26148763,"Харківська обл., Красноградський р-н, вул. Озерна, буд. 46","Харківська обл., Красноградський р-н, вул. Озерна, буд. 46",
НАРОДНО-ДЕМОКРАТИЧНА ПАРТІЯ (НДП),ТУРКІВСЬКА РАЙОННА ОРГАНІЗАЦІЯ НАРОДНО- ДЕМОКРАТИЧНОЇ ПАРТІЇ,Львівська область,36737263,"Львівська обл., Самбірський р-н, вул. Хирів, буд. 104","Львівська обл., Самбірський р-н, вул. Хирів, буд. 104",
НАРОДНО-ДЕМОКРАТИЧНА ПАРТІЯ (НДП),ГОРОДЕНКІВСЬКА РАЙОННА ОРГАНІЗАЦІЯ НАРОДНО- ДЕМОКРАТИЧНОЇ ПАРТІЇ,Івано-франківська область,25066247,"Івано-франківська обл., Коломийський р-н, вул. Винниченка Володимира, буд. 141","Івано-франківська обл., Коломийський р-н, вул. Винниченка Володимира, буд. 141",
НАРОДНО-ДЕМОКРАТИЧНА ПАРТІЯ (НДП),ГАЛИЦЬКА РАЙОННА ОРГАНІЗАЦІЯ НАРОДНО- ДЕМОКРАТИЧНОЇ ПАРТІЇ,Івано-франківська область,24683280,"Івано-франківська обл., Івано-Франківський р-н, вул. Стрільців Січових, буд. 6","Івано-франківська обл., Івано-Франківський р-н, вул. Стрільців Січових, буд. 6",
НАРОДНО-ДЕМОКРАТИЧНА ПАРТІЯ (НДП),КРАСНОПЕРЕКОПСЬКА РАЙОННА ОРГАНІЗАЦІЯ НАРОДНО - ДЕМОКРАТИЧНОЇ ПАРТІЇ,Автономна республіка крим,34051393,"Автономна республіка крим, м. Красноперекопськ, вул. Менделєєва, буд. 30","Автономна республіка крим, м. Красноперекопськ, вул. Менделєєва, буд. 30",
НАРОДНО-ДЕМОКРАТИЧНА ПАРТІЯ (НДП),КОРОСТИШІВСЬКА РАЙОННА ОРГАНІЗАЦІЯ НАРОДНО- ДЕМОКРАТИЧНОЇ ПАРТІЇ,Житомирська область,24708146,"Житомирська обл., Житомирський р-н, вул. Індустріальна, буд. 4","Житомирська обл., Житомирський р-н, вул. Індустріальна, буд. 4",
НАРОДНО-ДЕМОКРАТИЧНА ПАРТІЯ (НДП),БРУСИЛІВСЬКА РАЙОННА ОРГАНІЗАЦІЯ НАРОДНО- ДЕМОКРАТИЧНОЇ ПАРТІЇ,Житомирська область,25312048,"Житомирська обл., Житомирський р-н, вул. 8 Березня, буд. 26","Житомирська обл., Житомирський р-н, вул. 8 Березня, буд. 26",
НАРОДНО-ДЕМОКРАТИЧНА ПАРТІЯ (НДП),ЧЕРВОНОАРМІЙСЬКА РАЙОННА ОРГАНІЗАЦІЯ НАРОДНО- ДЕМОКРАТИЧНОЇ ПАРТІЇ,Житомирська область,35432473,"Житомирська обл., Житомирський р-н, вул. Гагаріна, буд. 113","Житомирська обл., Житомирський р-н, вул. Гагаріна, буд. 113",
НАРОДНО-ДЕМОКРАТИЧНА ПАРТІЯ (НДП),ОРГАНІЗАЦІЯ НАРОДНО- ДЕМОКРАТИЧНОЇ ПАРТІЇ ВОВЧАНСЬКОГО РАЙОНУ ХАРКІВСЬКОЇ ОБЛАСТІ,Харківська область,25779792,"Харківська обл., Чугуївський р-н, вул. Короленка, буд. 100","Харківська обл., Чугуївський р-н, вул. Короленка, буд. 100",
НАРОДНО-ДЕМОКРАТИЧНА ПАРТІЯ (НДП),ТЕОФІПОЛЬСЬКА РАЙОННА ОРГАНІЗАЦІЯ НАРОДНО- ДЕМОКРАТИЧНОЇ ПАРТІЇ,Хмельницька область,33872658,"Хмельницька обл., Хмельницький р-н, вул. Баюка, буд. 5","Хмельницька обл., Хмельницький р-н, вул. Баюка, буд. 5",
НАРОДНО-ДЕМОКРАТИЧНА ПАРТІЯ (НДП),СОЛОНИЦІВСЬКА СЕЛИЩНА ОРГАНІЗАЦІЯ НАРОДНО- ДЕМОКРАТИЧНОЇ ПАРТІЇ,Харківська область,25981246,"Харківська обл., Харківський р-н, вул. Пушкіна, буд. 12","Харківська обл., Харківський р-н, вул. Пушкіна, буд. 12",
НАРОДНО-ДЕМОКРАТИЧНА ПАРТІЯ (НДП),ВИЖНИЦЬКА РАЙОННА ОРГАНІЗАЦІЯ НАРОДНО- ДЕМОКРАТИЧНОЇ ПАРТІЇ,Чернівецька область,25078061,"Чернівецька обл., Вижницький р-н, вул. Кобилянської, буд. 26","Чернівецька обл., Вижницький р-н, вул. Кобилянської, буд. 26",
НАРОДНО-ДЕМОКРАТИЧНА ПАРТІЯ (НДП),ЄВПАТОРІЙСЬКА МІСЬКА ОРГАНІЗАЦІЯ КРИМСЬКОЇ РЕСПУБЛІКАНСЬКОЇ ОРГАНІЗАЦІЇ НАРОДНО- ДЕМОКРАТИЧНОЇ ПАРТІЇ,Автономна республіка крим,26171740,"Автономна республіка крим, м. Євпаторія, вул. Дьомишева, буд. 134","Автономна республіка крим, м. Євпаторія, вул. Дьомишева, буд. 134",
НАРОДНО-ДЕМОКРАТИЧНА ПАРТІЯ (НДП),МАКІЇВСЬКА МІСЬКА ОРГАНІЗАЦІЯ НАРОДНО- ДЕМОКРАТИЧНОЇ ПАРТІЇ УКРАЇНИ,Донецька область,25706971,"Донецька обл., м. Макіївка, вул. Театральна, буд. 9","Донецька обл., м. Макіївка, вул. Театральна, буд. 9",
НАРОДНО-ДЕМОКРАТИЧНА ПАРТІЯ (НДП),СЛАВУТСЬКА РАЙОННА ОРГАНІЗАЦІЯ НАРОДНО - ДЕМОКРАТИЧНОЇ ПАРТІЇ,Хмельницька область,26157437,"Хмельницька обл., Шепетівський р-н, вул. Алейхема Шолом, буд. 25","Хмельницька обл., Шепетівський р-н, вул. Алейхема Шолом, буд. 25",
НАРОДНО-ДЕМОКРАТИЧНА ПАРТІЯ (НДП),ОДЕСЬКА МІСЬКА ОРГАНІЗАЦІЯ НАРОДНО- ДЕМОКРАТИЧНОЇ ПАРТІЇ,Одеська область,25034543,"Одеська обл., м. Одеса, вул. Рішельєвська, буд. 28","Одеська обл., м. Одеса, вул. Рішельєвська, буд. 28",
НАРОДНО-ДЕМОКРАТИЧНА ПАРТІЯ (НДП),ГОЛОСІЇВСЬКА РАЙОННА ОРГАНІЗАЦІЯ НАРОДНО- ДЕМОКРАТИЧНОЇ ПАРТІЇ В МІСТІ КИЄВІ,київ,21655604,"м.. київ, Голосіївський, вул. Васильківська, буд. 22","м.. київ, Голосіївський, вул. Васильківська, буд. 22",
НАРОДНО-ДЕМОКРАТИЧНА ПАРТІЯ (НДП),НОВОКАХОВСЬКА МІСЬКА ОРГАНІЗАЦІЯ НАРОДНО - ДЕМОКРАТИЧНОЇ ПАРТІЇ,Херсонська область,25774464,"Херсонська обл., Каховський р-н, вул. Довженко, буд. 15","Херсонська обл., Каховський р-н, вул. Довженко, буд. 15",
НАРОДНО-ДЕМОКРАТИЧНА ПАРТІЯ (НДП),КРИЖОПІЛЬСЬКА РАЙОННА ПАРТІЙНА ОРГАНІЗАЦІЯ НАРОДНО- ДЕМОКРАТИЧНОЇ ПАРТІЇ УКРАЇНИ,Вінницька область,34625626,"Вінницька обл., Тульчинський р-н, вул. Зеленського полковника, буд. 39","Вінницька обл., Тульчинський р-н, вул. Зеленського полковника, буд. 39",
НАРОДНО-ДЕМОКРАТИЧНА ПАРТІЯ (НДП),ДАРНИЦЬКА РАЙОННА ОРГАНІЗАЦІЯ КИЇВСЬКОЇ МІСЬКОЇ ОРГАНІЗАЦІЇ НАРОДНО- ДЕМОКРАТИЧНОЇ ПАРТІЇ,київ,26063624,"м.. київ, Дарницький, вул. Заслонова Костянтина, буд. 13","м.. київ, Дарницький, вул. Заслонова Костянтина, буд. 13",
НАРОДНО-ДЕМОКРАТИЧНА ПАРТІЯ (НДП),СЛАВУТСЬКА МІСЬКА ОРГАНІЗАЦІЯ НАРОДНО- ДЕМОКРАТИЧНОЇ ПАРТІЇ,Хмельницька область,26094085,"Хмельницька обл., Шепетівський р-н, вул. Мудрого Ярослава, буд. 55","Хмельницька обл., Шепетівський р-н, вул. Мудрого Ярослава, буд. 55",
НАРОДНО-ДЕМОКРАТИЧНА ПАРТІЯ (НДП),ХАРКІВСЬКА МІСЬКА ОРГАНІЗАЦІЯ НАРОДНО- ДЕМОКРАТИЧНОЇ ПАРТІЇ,Харківська область,24282078,"Харківська обл., м. Харків, вул. Єсеніна, буд. 149","Харківська обл., м. Харків, вул. Єсеніна, буд. 149",
НАРОДНО-ДЕМОКРАТИЧНА ПАРТІЯ (НДП),ДНІПРОВСЬКА РАЙОННА ОРГАНІЗАЦІЯ НАРОДНО- ДЕМОКРАТИЧНОЇ ПАРТІЇ М.КИЄВА,київ,25880999,"м.. київ, Дніпровський, вул. Краківська, буд. 20","м.. київ, Дніпровський, вул. Краківська, буд. 20",
НАРОДНО-ДЕМОКРАТИЧНА ПАРТІЯ (НДП),СОЛОМʼЯНСЬКА РАЙОННА ОРГАНІЗАЦІЯ КИЇВСЬКОЇ МІСЬКОЇ ОРГАНІЗАЦІЇ НАРОДНО- ДЕМОКРАТИЧНОЇ ПАРТІЇ,київ,25772666,"м.. київ, Соломʼянський, пров. Ковальський, буд. 20","м.. київ, Соломʼянський, пров. Ковальський, буд. 20",
НАРОДНО-ДЕМОКРАТИЧНА ПАРТІЯ (НДП),ЧЕРКАСЬКА МІСЬКА ОРГАНІЗАЦІЯ НАРОДНО- ДЕМОКРАТИЧНОЇ ПАРТІЇ,Черкаська область,25975004,"Черкаська обл., м. Черкаси, вул. Смілянська, буд. 44","Черкаська обл., м. Черкаси, вул. Смілянська, буд. 44",
НАРОДНО-ДЕМОКРАТИЧНА ПАРТІЯ (НДП),ПЕТРОПАВЛІВСЬКА РАЙОННА ОРГАНІЗАЦІЯ НАРОДНО- ДЕМОКРАТИЧНОЇ ПАРТІЇ УКРАЇНИ,Дніпропетровська область,25972709,"Дніпропетровська обл., Синельниківський р-н, вул. Центральна, буд. 62","Дніпропетровська обл., Синельниківський р-н, вул. Центральна, буд. 62",
НАРОДНО-ДЕМОКРАТИЧНА ПАРТІЯ (НДП),БОРЗНЯНСЬКА РАЙОННА ОРГАНІЗАЦІЯ НАРОДНО- ДЕМОКРАТИЧНОЇ ПАРТІЇ,Чернігівська область,25932093,"Чернігівська обл., Ніжинський р-н, вул. Куліша Пантелеймона, буд. 104","Чернігівська обл., Ніжинський р-н, вул. Куліша Пантелеймона, буд. 104",
НАРОДНО-ДЕМОКРАТИЧНА ПАРТІЯ (НДП),ЧЕРНІГІВСЬКА МІСЬКА ОРГАНІЗАЦІЯ НАРОДНО- ДЕМОКРАТИЧНОЇ ПАРТІЇ,Чернігівська область,25932213,"Чернігівська обл., м. Чернігів, просп. Миру, буд. 17","Чернігівська обл., м. Чернігів, просп. Миру, буд. 17",
НАРОДНО-ДЕМОКРАТИЧНА ПАРТІЯ (НДП),ХОТИНСЬКА РАЙОННА ОРГАНІЗАЦІЯ НАРОДНО- ДЕМОКРАТИЧНОЇ ПАРТІЇ,Чернівецька область,25957928,"Чернівецька обл., Дністровський р-н, вул. Боженка, буд. 17","Чернівецька обл., Дністровський р-н, вул. Боженка, буд. 17",
НАРОДНО-ДЕМОКРАТИЧНА ПАРТІЯ (НДП),ДУНАЄВЕЦЬКА РАЙОННА ОРГАНІЗАЦІЯ НАРОДНО- ДЕМОКРАТИЧНОЇ ПАРТІЇ УКРАЇНИ,Хмельницька область,25961290,"Хмельницька обл., Камʼянець-Подільський р-н, вул. Молодіжна, буд. 2","Хмельницька обл., Камʼянець-Подільський р-н, вул. Молодіжна, буд. 2",
НАРОДНО-ДЕМОКРАТИЧНА ПАРТІЯ (НДП),НОВОАЙДАРСЬКА РАЙОННА ОРГАНІЗАЦІЯ НАРОДНО- ДЕМОКРАТИЧНОЇ ПАРТІЇ УКРАЇНИ,Луганська область,25963053,"Луганська обл., Щастинський р-н, вул. Прогонна, буд. 68","Луганська обл., Щастинський р-н, вул. Прогонна, буд. 68",
НАРОДНО-ДЕМОКРАТИЧНА ПАРТІЯ (НДП),ПОЛТАВСЬКА МІСЬКА ОРГАНІЗАЦІЯ НАРОДНО- ДЕМОКРАТИЧНОЇ ПАРТІЇ,Полтавська область,25173641,"Полтавська обл., м. Полтава, вул. Котляревського, буд. 24","Полтавська обл., м. Полтава, вул. Котляревського, буд. 24",
НАРОДНО-ДЕМОКРАТИЧНА ПАРТІЯ (НДП),РОМАНІВСЬКА РАЙОННА ОРГАНІЗАЦІЯ НАРОДНО- ДЕМОКРАТИЧНОЇ ПАРТІЇ,Житомирська область,33868380,"Житомирська обл., Житомирський р-н, вул. Робітнича, буд. 5В","Житомирська обл., Житомирський р-н, вул. Робітнича, буд. 5В",
НАРОДНО-ДЕМОКРАТИЧНА ПАРТІЯ (НДП),БАХМАЦЬКА РАЙОННА ОРГАНІЗАЦІЯ НАРОДНО-ДЕМОКРАТИЧНОЇ ПАРТІЇ,Чернігівська область,25901494,"Чернігівська обл., Ніжинський р-н, вул. Дружби, буд. 4","Чернігівська обл., Ніжинський р-н, вул. Дружби, буд. 4",
НАРОДНО-ДЕМОКРАТИЧНА ПАРТІЯ (НДП),БАЛАКЛІЙСЬКА РАЙОННА ОРГАНІЗАЦІЯ НАРОДНО- ДЕМОКРАТИЧНОЇ ПАРТІЇ УКРАЇНИ,Харківська область,25454593,"Харківська обл., Ізюмський р-н, пл. Ростовцева, 4","Харківська обл., Ізюмський р-н, пл. Ростовцева, 4",
НАРОДНО-ДЕМОКРАТИЧНА ПАРТІЯ (НДП),СМІЛЯНСЬКА МІСЬКА ОРГАНІЗАЦІЯ НАРОДНО - ДЕМОКРАТИЧНОЇ ПАРТІЇ,Черкаська область,25922485,"Черкаська обл., Черкаський р-н, вул. Зелена, буд. 60","Черкаська обл., Черкаський р-н, вул. Зелена, буд. 60",
НАРОДНО-ДЕМОКРАТИЧНА ПАРТІЯ (НДП),ДЕРГАЧІВСЬКИЙ МІСЬКИЙ ОСЕРЕДОК НАРОДНО- ДЕМОКРАТИЧНОЇ ПАРТІЇ,Харківська область,25458208,"Харківська обл., Харківський р-н, вул. 1 Травня, буд. 8","Харківська обл., Харківський р-н, вул. 1 Травня, буд. 8",
НАРОДНО-ДЕМОКРАТИЧНА ПАРТІЯ (НДП),КАЛУСЬКА РАЙОННА ОРГАНІЗАЦІЯ НАРОДНО- ДЕМОКРАТИЧНОЇ ПАРТІЇ,Донецька область,25790397,"Донецька обл., м. Макіївка, Зелений мікрорайон, 28","Донецька обл., м. Макіївка, Зелений мікрорайон, 28",
НАРОДНО-ДЕМОКРАТИЧНА ПАРТІЯ (НДП),ГІРНИЦЬКА РАЙОННА ОРГАНІЗАЦІЯ НАРОДНО- ДЕМОКРАТИЧНОЇ ПАРТІЇ УКРАІНИ М МАКІЇВКИ,Донецька область,25758784,"Донецька обл., м. Макіївка, Зелений мікрорайон, 28","Донецька обл., м. Макіївка, Зелений мікрорайон, 28",
НАРОДНО-ДЕМОКРАТИЧНА ПАРТІЯ (НДП),СТРИЙСЬКА МІСЬКА ОРГАНІЗАЦІЯ НАРОДНО- ДЕМОКРАТИЧНОЇ ПАРТІЇ,Львівська область,25240293,"Львівська обл., Стрийський р-н, вул. Івасюка В., буд. 31","Львівська обл., Стрийський р-н, вул. Івасюка В., буд. 31",
НАРОДНО-ДЕМОКРАТИЧНА ПАРТІЯ (НДП),КІРОВСЬКА РАЙОННА ОРГАНІЗАЦІЯ НАРОДНО- ДЕМОКРАТИЧНОЇ ПАРТІЇ УКРАЇНИ М.МАКІЇВКИ,Донецька область,25762461,"Донецька обл., м. Макіївка, вул. Стара Хімколонія, буд. 31","Донецька обл., м. Макіївка, вул. Стара Хімколонія, буд. 31",
НАРОДНО-ДЕМОКРАТИЧНА ПАРТІЯ (НДП),ЦЕНТРАЛЬНО-МІСЬКА РАЙОННА ОРГАНІЗАЦІЯ НАРОДНО- ДЕМОКРАТИЧНОЇ ПАРТІЇ УКРАЇНИ М.МАКІЇВКИ,Донецька область,25762627,"Донецька обл., м. Макіївка, ""Кіровець"" квартал, 5","Донецька обл., м. Макіївка, ""Кіровець"" квартал, 5",
НАРОДНО-ДЕМОКРАТИЧНА ПАРТІЯ (НДП),ЗГУРІВСЬКА РАЙОННА ОРГАНІЗАЦІЯ НАРОДНО- ДЕМОКРАТИЧНОЇ ПАРТІЇ,Київська область,25779378,"Київська обл., Броварський р-н, вул. Петровського, буд. 43","Київська обл., Броварський р-н, вул. Петровського, буд. 43",
НАРОДНО-ДЕМОКРАТИЧНА ПАРТІЯ (НДП),ЕНЕРГОДАРСЬКА МІСЬКА ОРГАНІЗАЦІЯ НАРОДНО- ДЕМОКРАТИЧНОЇ ПАРТІЇ,Запорізька область,25767139,"Запорізька обл., Василівський р-н, вул. Центральна, буд. 2","Запорізька обл., Василівський р-н, вул. Центральна, буд. 2",
НАРОДНО-ДЕМОКРАТИЧНА ПАРТІЯ (НДП),ХОРОЛЬСЬКА МІСЬКА ОРГАНІЗАЦІЯ НАРОДНО- ДЕМОКРАТИЧНОЇ ПАРТІЇ,Полтавська область,25783871,"Полтавська обл., Лубенський р-н, пров. Веселий, буд. 17","Полтавська обл., Лубенський р-н, пров. Веселий, буд. 17",
НАРОДНО-ДЕМОКРАТИЧНА ПАРТІЯ (НДП),СЕМЕНІВСЬКА РАЙОННА ОРГАНІЗАЦІЯ НАРОДНО- ДЕМОКРАТИЧНОЇ ПАРТІЇ,Чернігівська область,25786467,"Чернігівська обл., Новгород-Сіверський р-н, вул. Червона площа, буд. 7А","Чернігівська обл., Новгород-Сіверський р-н, вул. Червона площа, буд. 7А",
НАРОДНО-ДЕМОКРАТИЧНА ПАРТІЯ (НДП),КАХОВСЬКА МІСЬКА ОРГАНІЗАЦІЯ НАРОДНО- ДЕМОКРАТИЧНОЇ ПАРТІЇ,Херсонська область,25756360,"Херсонська обл., Каховський р-н, вул. Велика Куликовська, буд. 110","Херсонська обл., Каховський р-н, вул. Велика Куликовська, буд. 110",
НАРОДНО-ДЕМОКРАТИЧНА ПАРТІЯ (НДП),ДЕРГАЧІВСЬКА РАЙОННА ОРГАНІЗАЦІЯ НАРОДНО- ДЕМОКРАТИЧНОЇ ПАРТІЇ УКРАЇНИ,Харківська область,25192147,"Харківська обл., Харківський р-н, вул. Садова, буд. 10Д","Харківська обл., Харківський р-н, вул. Садова, буд. 10Д",
НАРОДНО-ДЕМОКРАТИЧНА ПАРТІЯ (НДП),ОЧАКІВСЬКА МІСЬКА ОРГАНІЗАЦІЯ НАРОДНО- ДЕМОКРАТИЧНОЇ ПАРТІЇ,Миколаївська область,23404504,"Миколаївська обл., Миколаївський р-н, вул. 8 Березня, буд. 10","Миколаївська обл., Миколаївський р-н, вул. 8 Березня, буд. 10",
НАРОДНО-ДЕМОКРАТИЧНА ПАРТІЯ (НДП),СОВЄТСЬКА РАЙОННА ОРГАНІЗАЦІЯ НАРОДНО- ДЕМОКРАТИЧНОЇ ПАРТІЇ УКРАЇНИ М МАКІЇВКИ,Донецька область,25730975,"Донецька обл., м. Макіївка, ""Комсомольський"" мікрорайон, 2-Д","Донецька обл., м. Макіївка, ""Комсомольський"" мікрорайон, 2-Д",
НАРОДНО-ДЕМОКРАТИЧНА ПАРТІЯ (НДП),ПОДІЛЬСЬКА РАЙОННА ОРГАНІЗАЦІЯ КИЇВСЬКОЇ МІСЬКОЇ ОРГАНІЗАЦІЇ НАРОДНО- ДЕМОКРАТИЧНОЇ ПАРТІЇ,київ,21477806,"м.. київ, Подільський, вул. Сковороди Григорія, буд. 5А","м.. київ, Подільський, вул. Сковороди Григорія, буд. 5А",
НАРОДНО-ДЕМОКРАТИЧНА ПАРТІЯ (НДП),ХЕРСОНСЬКА ОБЛАСНА ОРГАНІЗАЦІЯ НАРОДНО-ДЕМОКРАТИЧНОЇ ПАРТІЇ (ХОО НДП),Херсонська область,24120542,"Херсонська обл., м. Херсон, вул. Перекопська, буд. 175","Херсонська обл., м. Херсон, вул. Перекопська, буд. 175",
