Дата надходження внеску,ПІБ (для фіз. осіб)/Назва (для юр. осіб),Ідентифікаційний код (для фіз. осіб)/Код ЄДРПОУ (для юр. осіб),Місце проживання (для фіз. осіб)/Юридична адреса (для юр. осіб),Сума (грн),Сума повернення (грн),Призначення (для спонсорських внесків),Тип внескодавця,Партія,Найменування банку,Номер рахунку,Код ЄДРПОУ осередку,Квартал,Рік,Внутрішньопартійні транзакції
12.09.2023,Разгоняєв Михайло Васильович,,Дніпропетровська обл.,3300,,,Фізична особа,БЛОК ВІЛКУЛА УКРАЇНСЬКА ПЕРСПЕКТИВА,"АТ""АБ""РАДАБАНК""",UA553065000000026006300008614,39585410,4,2023,
31.12.2023,Товариство з обмеженою відповідальністю «МАРКЕТГРУП»,37103370,"м. Київ, вул. Квіквідзе, буд. 37Б",12746,,"Спонсорські внески, а саме надання  приміщення в безоплатне користування",Юридична особа,БЛОК ВІЛКУЛА УКРАЇНСЬКА ПЕРСПЕКТИВА,,,39585410,4,2023,
31.12.2023,Товариство з обмеженою відповідальністю «МАРКЕТГРУП»,37103370,"м. Київ, вул. Квіквідзе, буд. 37Б",12745,,"Спонсорські внески, а саме надання  приміщення в безоплатне користування",Юридична особа,БЛОК ВІЛКУЛА УКРАЇНСЬКА ПЕРСПЕКТИВА,,,40009213,4,2023,
31.12.2023,ТОВ «Маркетгрупп»,37103370,"м. Київ, вул. Кіквідзе, буд. 37Б",12746,,"Спонсорські внески, а саме надання  приміщення в безоплатне користування",Юридична особа,БЛОК ВІЛКУЛА УКРАЇНСЬКА ПЕРСПЕКТИВА,,,39895309,4,2023,
31.12.2023,"Товариство з обмеженою відповідальністю ""Маркетгруп""",37103370,"м. Київ, вул. Кіквідзе, буд. 37Б",12745,,"Спонсорські внески, а саме надання  приміщення в безоплатне користування",Юридична особа,БЛОК ВІЛКУЛА УКРАЇНСЬКА ПЕРСПЕКТИВА,,,39358268,4,2023,
