НАРОДНИЙ РУХ УКРАЇНИ,Васильківська міська організація Народного Руху України,Київська область,36092578,"Київська обл., Обухівський р-н, вул. Шевченко, буд. 10","Київська обл., Обухівський р-н, вул. Шевченко, буд. 10",
НАРОДНИЙ РУХ УКРАЇНИ,ОБОЛОНСЬКА РАЙОННА ОРГАНІЗАЦІЯ НАРОДНОГО РУХУ УКРАЇНИ М. КИЄВА,київ,25666645,"м.. київ, Оболонський, вул. Озерна (Оболонський р-н, ), 14","м.. київ, Оболонський, вул. Озерна (Оболонський р-н, ), 14",
НАРОДНИЙ РУХ УКРАЇНИ,Соломʼянська районна в м.Києві організація Народного Руху України,київ,34000443,"м.. київ, Соломʼянський, просп. Повітрофлотський, буд. 5","м.. київ, Соломʼянський, просп. Повітрофлотський, буд. 5",
НАРОДНИЙ РУХ УКРАЇНИ,Дніпровська районна в м.Києві організація Народного Руху України,київ,33885033,"м.. київ, Дніпровський, вул. Челябінська, буд. 17","м.. київ, Дніпровський, вул. Челябінська, буд. 17",
НАРОДНИЙ РУХ УКРАЇНИ,Голосіївська районна в м.Києві організація Народного Руху України,київ,33630952,"м.. київ, Голосіївський, вул. Луценка Дмитра, буд. 1","м.. київ, Голосіївський, вул. Луценка Дмитра, буд. 1",
НАРОДНИЙ РУХ УКРАЇНИ,Печерська районна в м.Києві організація Народного Руху України,київ,33629957,"м.. київ, Печерський, просп. Науки, буд. 47","м.. київ, Печерський, просп. Науки, буд. 47",
НАРОДНИЙ РУХ УКРАЇНИ,Святошинська районна в м.Києві організація Народного Руху України,київ,33944140,"м.. київ, Святошинський, вул. Депутатська, буд. 5","м.. київ, Святошинський, вул. Депутатська, буд. 5",
НАРОДНИЙ РУХ УКРАЇНИ,Деснянська районна в м.Києві організація Народного Руху України,київ,33780934,"м.. київ, Деснянський, вул. Маяковського, буд. 28","м.. київ, Деснянський, вул. Маяковського, буд. 28",
НАРОДНИЙ РУХ УКРАЇНИ,Подільська районна організація м.Києва Народного Руху України,київ,24919156,"м.. київ, Подільський, вул. Брестська, буд. 26","м.. київ, Подільський, вул. Брестська, буд. 26",
НАРОДНИЙ РУХ УКРАЇНИ,Дарницька районна в м.Києві організація Народного Руху України,київ,25405347,"м.. київ, Дарницький, вул. Ревуцького, буд. 30/1","м.. київ, Дарницький, вул. Ревуцького, буд. 30/1",
НАРОДНИЙ РУХ УКРАЇНИ,Шевченківська районна в м.Києві організація Народного Руху України,київ,25772525,"м.. київ, Шевченківський, вул. Гончара Олеся, буд. 33","м.. київ, Шевченківський, вул. Гончара Олеся, буд. 33",
НАРОДНИЙ РУХ УКРАЇНИ,Черкаська крайова організація НРУ,Черкаська область,22799937,"Черкаська обл., м. Черкаси, бульв. Шевченка, буд. 266/1","Черкаська обл., м. Черкаси, бульв. Шевченка, буд. 266/1",
НАРОДНИЙ РУХ УКРАЇНИ,Звенигородська районна організація Народного Руху України,Черкаська область,36773626,"Черкаська обл., Звенигородський р-н, вул. Стуса Василя, буд. 32","Черкаська обл., Звенигородський р-н, вул. Стуса Василя, буд. 32",
НАРОДНИЙ РУХ УКРАЇНИ,Канівська міськрайонна організація Народного Руху України,Черкаська область,22792881,"Черкаська обл., Черкаський р-н, вул. Шевченка, буд. 35/15","Черкаська обл., Черкаський р-н, вул. Шевченка, буд. 35/15",
НАРОДНИЙ РУХ УКРАЇНИ,Катеринопільська районна організація Народного Руху України,Черкаська область,36776559,"Черкаська обл., Звенигородський р-н, вул. Чорновола В., буд. 1","Черкаська обл., Звенигородський р-н, вул. Чорновола В., буд. 1",
НАРОДНИЙ РУХ УКРАЇНИ,Лисянська районна організація Народного Руху України,Черкаська область,36643626,"Черкаська обл., Звенигородський р-н, вул. Поштова, буд. 9/18","Черкаська обл., Звенигородський р-н, вул. Поштова, буд. 9/18",
НАРОДНИЙ РУХ УКРАЇНИ,Смілянська міська організація Народного Руху України,Черкаська область,22793356,"Черкаська обл., Черкаський р-н, вул. 40-річчя Перемоги, буд. 4","Черкаська обл., Черкаський р-н, вул. 40-річчя Перемоги, буд. 4",
НАРОДНИЙ РУХ УКРАЇНИ,Тальнівська районна організація Народного Руху України,Черкаська область,24351649,"Черкаська обл., Звенигородський р-н, вул. Небесної Сотні, буд. 125","Черкаська обл., Звенигородський р-н, вул. Небесної Сотні, буд. 125",
НАРОДНИЙ РУХ УКРАЇНИ,Черкаська районна організація Народного Руху України,Черкаська область,25203773,"Черкаська обл., м. Черкаси, вул. Вишневецького Байди, буд. 32А","Черкаська обл., м. Черкаси, вул. Вишневецького Байди, буд. 32А",
НАРОДНИЙ РУХ УКРАЇНИ,Шполянська районна організація Народного Руху України,Черкаська область,22808961,"Черкаська обл., Звенигородський р-н, вул. Кожедуба Івана, буд. 64","Черкаська обл., Звенигородський р-н, вул. Кожедуба Івана, буд. 64",
НАРОДНИЙ РУХ УКРАЇНИ,Сумська крайова організація Народного Руху України,Сумська область,22983345,"Сумська обл., м. Суми, вул. Соборна, буд. 19","Сумська обл., м. Суми, вул. Соборна, буд. 19",
НАРОДНИЙ РУХ УКРАЇНИ,Тростянецька районна організація Народного Руху України,Сумська область,36636142,"Сумська обл., Охтирський р-н, вул. Набережна, буд. 21","Сумська обл., Охтирський р-н, вул. Набережна, буд. 21",
НАРОДНИЙ РУХ УКРАЇНИ,Лебединська районна організація Народного Руху України,Сумська область,23635043,"Сумська обл., Сумський р-н, вул. Шевченка Тараса, буд. 5","Сумська обл., Сумський р-н, вул. Шевченка Тараса, буд. 5",
НАРОДНИЙ РУХ УКРАЇНИ,Путивльська районна організація Народного Руху України,Сумська область,34997008,"Сумська обл., Конотопський р-н, вул. Ковпака, буд. 45","Сумська обл., Конотопський р-н, вул. Ковпака, буд. 45",
НАРОДНИЙ РУХ УКРАЇНИ,Недригайлівська районна організація Народного Руху України,Сумська область,23997065,"Сумська обл., Роменський р-н, вул. Незалежності, буд. 1","Сумська обл., Роменський р-н, вул. Незалежності, буд. 1",
НАРОДНИЙ РУХ УКРАЇНИ,Конотопська міська організація Народного Руху України,Сумська область,23631950,"Сумська обл., Конотопський р-н, вул. Успенсько-Троїцька, буд. 87","Сумська обл., Конотопський р-н, вул. Успенсько-Троїцька, буд. 87",
НАРОДНИЙ РУХ УКРАЇНИ,Тернопільська крайова організація Народного Руху України,Тернопільська область,14033227,"Тернопільська обл., Тернопільський р-н, вул. Сагайдачного гетьмана, буд. 10","Тернопільська обл., Тернопільський р-н, вул. Сагайдачного гетьмана, буд. 10",
НАРОДНИЙ РУХ УКРАЇНИ,Чортківська районна організація Народного Руху України,Тернопільська область,25935298,"Тернопільська обл., Чортківський р-н, вул. Шевченка Тараса, буд. 21","Тернопільська обл., Чортківський р-н, вул. Шевченка Тараса, буд. 21",
НАРОДНИЙ РУХ УКРАЇНИ,Бережанська районна організація Народного Руху України,Тернопільська область,22607754,"Тернопільська обл., Тернопільський р-н, вул. Шевченка, буд. 20","Тернопільська обл., Тернопільський р-н, вул. Шевченка, буд. 20",
НАРОДНИЙ РУХ УКРАЇНИ,Монастириська районна організація Народного Руху України,Тернопільська область,25935909,"Тернопільська обл., Чортківський р-н, вул. Шевченка, буд. 16","Тернопільська обл., Чортківський р-н, вул. Шевченка, буд. 16",
НАРОДНИЙ РУХ УКРАЇНИ,Лановецька районна організація Народного Руху України,Тернопільська область,36318086,"Тернопільська обл., Кременецький р-н, вул. Грушевського, буд. 9","Тернопільська обл., Кременецький р-н, вул. Грушевського, буд. 9",
НАРОДНИЙ РУХ УКРАЇНИ,Тернопільська районна організація Народного Руху України,Тернопільська область,26309835,"Тернопільська обл., Тернопільський р-н, вул. Сагайдачного гетьмана, буд. 10","Тернопільська обл., Тернопільський р-н, вул. Сагайдачного гетьмана, буд. 10",
НАРОДНИЙ РУХ УКРАЇНИ,Тернопільська міська організація Народного Руху України,Тернопільська область,25694452,"Тернопільська обл., Тернопільський р-н, вул. Сагайдачного гетьмана, буд. 10","Тернопільська обл., Тернопільський р-н, вул. Сагайдачного гетьмана, буд. 10",
НАРОДНИЙ РУХ УКРАЇНИ,Теребовлянська районна організація Народного Руху України,Тернопільська область,21151341,"Тернопільська обл., Тернопільський р-н, вул. Шевченка, буд. 13","Тернопільська обл., Тернопільський р-н, вул. Шевченка, буд. 13",
НАРОДНИЙ РУХ УКРАЇНИ,Козівська районна організація Народного Руху України,Тернопільська область,23587864,"Тернопільська обл., Тернопільський р-н, вул. Бережанська, буд. 9","Тернопільська обл., Тернопільський р-н, вул. Бережанська, буд. 9",
НАРОДНИЙ РУХ УКРАЇНИ,Підгаєцька районна організація Народного Руху України,Тернопільська область,22605643,"Тернопільська обл., Тернопільський р-н, майдан Незалежності, 5","Тернопільська обл., Тернопільський р-н, майдан Незалежності, 5",
НАРОДНИЙ РУХ УКРАЇНИ,Підволочиська районна організація Народного Руху України,Тернопільська область,25887837,"Тернопільська обл., Тернопільський р-н, вул. Грушевського, буд. 7","Тернопільська обл., Тернопільський р-н, вул. Грушевського, буд. 7",
НАРОДНИЙ РУХ УКРАЇНИ,Збаразька районна організація Народного Руху України,Тернопільська область,21156491,"Тернопільська обл., Тернопільський р-н, Майдан Франка І., 5","Тернопільська обл., Тернопільський р-н, Майдан Франка І., 5",
НАРОДНИЙ РУХ УКРАЇНИ,Заліщицька районна організація Народного Руху України,Тернопільська область,35260250,"Тернопільська обл., Чортківський р-н, вул. Ольжича О., буд. 22","Тернопільська обл., Чортківський р-н, вул. Ольжича О., буд. 22",
НАРОДНИЙ РУХ УКРАЇНИ,Бучацька районна організація Народного Руху України,Тернопільська область,37289135,"Тернопільська обл., Чортківський р-н, вул. Галицька, буд. 15","Тернопільська обл., Чортківський р-н, вул. Галицька, буд. 15",
НАРОДНИЙ РУХ УКРАЇНИ,Малинська районна організація Народного Руху України,Житомирська область,24703634,"Житомирська обл., Коростенський р-н, вул. Ватутіна, буд. 29","Житомирська обл., Коростенський р-н, вул. Ватутіна, буд. 29",
НАРОДНИЙ РУХ УКРАЇНИ,Черняхівська районна організація Народного Руху України,Житомирська область,25777114,"Житомирська обл., Житомирський р-н, вул. Володимирська, буд. 119","Житомирська обл., Житомирський р-н, вул. Володимирська, буд. 119",
НАРОДНИЙ РУХ УКРАЇНИ,Овруцька районна організація Народного Руху України,Житомирська область,25311669,"Житомирська обл., Коростенський р-н, вул. Франка, буд. 18","Житомирська обл., Коростенський р-н, вул. Франка, буд. 18",
НАРОДНИЙ РУХ УКРАЇНИ,Новоград-Волинська районна організація Народного Руху України,Житомирська область,20404248,"Житомирська обл., Новоград-Волинський р-н, вул. Мамайчука Івана, буд. 17","Житомирська обл., Новоград-Волинський р-н, вул. Мамайчука Івана, буд. 17",
НАРОДНИЙ РУХ УКРАЇНИ,Коростишівська районна організація Народного Руху України,Житомирська область,25312539,"Житомирська обл., Житомирський р-н, вул. Київська, буд. 34","Житомирська обл., Житомирський р-н, вул. Київська, буд. 34",
НАРОДНИЙ РУХ УКРАЇНИ,Житомирська обласна (крайова) організація Народного Руху України,Житомирська область,13579852,"Житомирська обл., м. Житомир, вул. Мала Бердичівська, буд. 9","Житомирська обл., м. Житомир, вул. Мала Бердичівська, буд. 9",
НАРОДНИЙ РУХ УКРАЇНИ,Житомирська міська організація Народного Руху України,Житомирська область,20404604,"Житомирська обл., м. Житомир, вул. Радивілівська, буд. 42","Житомирська обл., м. Житомир, вул. Радивілівська, буд. 42",
НАРОДНИЙ РУХ УКРАЇНИ,Бердичівська міська організація,Житомирська область,25755641,"Житомирська обл., Бердичівський р-н, вул. Франка Івана, буд. 9","Житомирська обл., Бердичівський р-н, вул. Франка Івана, буд. 9",
НАРОДНИЙ РУХ УКРАЇНИ,Калуська міська організація Народного Руху України,Івано-франківська область,26290113,"Івано-франківська обл., Калуський р-н, пл. Героїв, 28","Івано-франківська обл., Калуський р-н, пл. Героїв, 28","АТ КБ ""ПРИВАТБАНК"", ЄДРПОУ: 14360570, р/р № UA683052990000026005025512720"
НАРОДНИЙ РУХ УКРАЇНИ,Калуська районна організація Народного Руху України,Івано-франківська область,26430293,"Івано-франківська обл., Калуський р-н, пл. Героїв, 28","Івано-франківська обл., Калуський р-н, пл. Героїв, 28","АТ КБ Приватбанк, ЄДРПОУ: 14360570, р/р № UA213366770000026429052502860 ; АТ КБ Приватбанк, ЄДРПОУ: 14360570, р/р № UA433366770000026426052500917"
НАРОДНИЙ РУХ УКРАЇНИ,Львівська крайова організація політичної партії Народний Рух України,Львівська область,20806283,"Львівська обл., м. Львів, вул. Коперника м. ., буд. 11","Львівська обл., м. Львів, вул. Коперника м. ., буд. 11","ТВБВ №10013/03 філії ЛОУ АТ ""Ощадбанк"", ЄДРПОУ: 09325703, р/р № UA363257960000026009300368164"
НАРОДНИЙ РУХ УКРАЇНИ,Франківська районна організація Народного Руху України м.Львова,Львівська область,20807392,"Львівська обл., м. Львів, вул. Здоровʼя, буд. 9А","Львівська обл., м. Львів, вул. Здоровʼя, буд. 9А","ТВБВ №10013/03 філії ЛОУ АТ ""Ощадбанк"", ЄДРПОУ: 09325703, р/р № UA653257960000026007300556569"
НАРОДНИЙ РУХ УКРАЇНИ,Лубенська районна організація Народного Руху України,Полтавська область,22549844,"Полтавська обл., Лубенський р-н, вул. Гавсевича, буд. 33","Полтавська обл., Лубенський р-н, вул. Гавсевича, буд. 33",
НАРОДНИЙ РУХ УКРАЇНИ,Миргородська районна організація Народного Руху України,Полтавська область,34264542,"Полтавська обл., Миргородський р-н, вул. Самійленка, буд. 29","Полтавська обл., Миргородський р-н, вул. Самійленка, буд. 29",
НАРОДНИЙ РУХ УКРАЇНИ,Диканська районна організація Народного Руху України,Полтавська область,25154036,"Полтавська обл., Полтавський р-н, вул. Миколаївська, буд. 7","Полтавська обл., Полтавський р-н, вул. Миколаївська, буд. 7",
НАРОДНИЙ РУХ УКРАЇНИ,Районний осередок партії Народний Рух України,Полтавська область,33977270,"Полтавська обл., Миргородський р-н, вул. Молодіжна, буд. 29","Полтавська обл., Миргородський р-н, вул. Молодіжна, буд. 29",
НАРОДНИЙ РУХ УКРАЇНИ,Полтавська районна організація Народного Руху України,Полтавська область,21061514,"Полтавська обл., Полтавський р-н, вул. Полтавська, буд. 80","Полтавська обл., Полтавський р-н, вул. Полтавська, буд. 80",
НАРОДНИЙ РУХ УКРАЇНИ,Полтавська міська організація Народного Руху України,Полтавська область,23814107,"Полтавська обл., м. Полтава, пров. Шухевича Романа, буд. 4","Полтавська обл., м. Полтава, пров. Шухевича Романа, буд. 4",
НАРОДНИЙ РУХ УКРАЇНИ,Новосанжарська районна організація Народного Руху України,Полтавська область,25158179,"Полтавська обл., Полтавський р-н, вул. Чкалова, буд. 76","Полтавська обл., Полтавський р-н, вул. Чкалова, буд. 76",
НАРОДНИЙ РУХ УКРАЇНИ,Оржицька районна організація Народного Руху України,Полтавська область,24564233,"Полтавська обл., Лубенський р-н, вул. Робітнича, буд. 17","Полтавська обл., Лубенський р-н, вул. Робітнича, буд. 17",
НАРОДНИЙ РУХ УКРАЇНИ,Пирятинська районна організація Народного Руху України,Полтавська область,24829743,"Полтавська обл., Лубенський р-н, вул. Мікромістечко, буд. 11/5","Полтавська обл., Лубенський р-н, вул. Мікромістечко, буд. 11/5",
НАРОДНИЙ РУХ УКРАЇНИ,Решетилівська районна організація Народного Руху України,Полтавська область,26457725,"Полтавська обл., Полтавський р-н, вул. Базарна, буд. 11","Полтавська обл., Полтавський р-н, вул. Базарна, буд. 11",
НАРОДНИЙ РУХ УКРАЇНИ,Луцька районна організація Народного Руху України,Волинська область,39979137,"Волинська обл., Луцький р-н, вул. Шевченка, буд. 2","Волинська обл., Луцький р-н, вул. Шевченка, буд. 2",
НАРОДНИЙ РУХ УКРАЇНИ,Володимир-Волинська міськрайонна організація Народного Руху України,Волинська область,25908657,"Волинська обл., Володимир-Волинський р-н, вул. Шевченка Тараса, буд. 3","Волинська обл., Володимир-Волинський р-н, вул. Шевченка Тараса, буд. 3",
