Партія,Місцева організація,Географічний обʼєкт,Ідентифікаційний код юридичної особи за ЄДРПОУ,Місцезнаходження,Фактичне місцезнаходження,"Реквізити банків, у яких відкрито рахунки"
Українська Галицька Партія,Львівська обласна організація,Львівська область,40014820,"м. Львів, вул. Грюнвальдська, буд. 10/3","м. Львів, вул. Костюшки, буд. 18","АТ АКБ ""Львів"", МФО 325268, Р/р 2600477437"
Українська Галицька Партія,Тернопільська обласна організація,Тернопільська область,40011526,"м. Тернопіль, вул. Шашкевича, буд. 8В, оф. 71","м. Тернопіль, вул. Шашкевича, буд. 8В, оф. 71","Терноп.філія КБ ПРИВАТБАНК, МФО 338783, Р/р 26006055117228"
Українська Галицька Партія,Івано-Франківська обласна організація,Івано-Франківська область,40026836,"м. Івано-Франківськ, вул. Єпископа Івана Латишевського, буд. 9","м. Івано-Франківськ, вул. Короля Данила, буд. 16Б","Ів-Фр. АТ КБ ""ПРИВАТБАНК"", МФО 336677, Р/р 26005052517967"
Українська Галицька Партія,Львівська міська організація,Львівська область,43350118,"м. Львів, вул. Чукаріна, буд. 7, кв. 57","м. Львів, вул. Чукаріна, буд. 7, кв. 57","АТ АКБ ""Львів"", МФО 325268, Р/р 26005107244001"
Українська Галицька Партія,Центральний офіс,Україна,39481037,"м. Львів, вул. Нечуя Левицького, буд. 17/4","м. Львів, пров. Крива липа, буд. 6","ПАТ АКБ ""Львів"", МФО 325268, Р/р 2600671275"
