Партія,Місцева організація,Географічний обʼєкт,Ідентифікаційний код юридичної особи за ЄДРПОУ,Місцезнаходження,Фактичне місцезнаходження,"Реквізити банків, у яких відкрито рахунки"
СОЦІАЛІСТИЧНА УКРАЇНА,БЕРДЯНСЬКА МІСЬКА організація,Запорізька область,36899782,"Запорізька обл., Бердянський р-н, просп. Азовський, буд. 53","Запорізька обл., Бердянський р-н, просп. Азовський, буд. 53",
СОЦІАЛІСТИЧНА УКРАЇНА,ХАРКІВСЬКА МІСЬКА організація,Харківська область,33898241,"Харківська обл., м. Харків, вул. Авіаційна, буд. 3А","Харківська обл., м. Харків, вул. Авіаційна, буд. 3А",
СОЦІАЛІСТИЧНА УКРАЇНА,ХАРКІВСЬКА ОБЛАСНА організація,Харківська область,33898257,"Харківська обл., м. Харків, вул. Авіаційна, буд. 3А","Харківська обл., м. Харків, вул. Авіаційна, буд. 3А",
СОЦІАЛІСТИЧНА УКРАЇНА,ЗАПОРІЗЬКА ОБЛАСНА організація,Запорізька область,36963386,"Запорізька обл., Бердянський р-н, вул. Петровський шлях, буд. 163","Запорізька обл., Бердянський р-н, вул. Петровський шлях, буд. 163",
СОЦІАЛІСТИЧНА УКРАЇНА,РЕСПУБЛІКАНСЬКА організація,Автономна республіка крим,36821187,"Автономна республіка крим, м. Сімферополь, вул. Генуезська, буд. 14","Автономна республіка крим, м. Сімферополь, вул. Генуезська, буд. 14",
СОЦІАЛІСТИЧНА УКРАЇНА,Центральний офіс,київ,33291360,"м.. київ, Дарницький, вул. Бажова, буд. 9","м.. київ, Дарницький, вул. Бажова, буд. 9",
