Нежитлова будівля,"Черкаська обл., м. Умань, вул. Європейська, буд. 52",30.5,,25.10.2021,0,Оренда,,,Фізична особа,СЛУГА НАРОДУ,2021-12-31,4,2021
Нежитлова будівля,"Донецька обл., м. Костянтинівка, просп. Ломоносова, буд. 127, нежитлове приміщення №5",52.9,,19.10.2020,0,Оренда,,,Фізична особа,СЛУГА НАРОДУ,2021-12-31,4,2021
Нежитлова будівля,"Донецька обл., м. Покровськ, вул. Тургенєва, буд. 1, нежитлове приміщення (кімната під оф.) №10, на другому поверсі",27.0,,24.10.2020,0,Оренда,,,Юридична особа,СЛУГА НАРОДУ,2021-12-31,4,2021
Нежитлова будівля,"Донецька обл., м. Краматорськ, вул. Катеринича, буд. 17, частина нежилого приміщення на першому поверсі будівлі",155.0,,01.03.2021,0,Оренда,,,Фізична особа,СЛУГА НАРОДУ,2021-12-31,4,2021
Нежитлова будівля,"Донецька обл., м. Краматорськ, вул. Катеринича, буд. 17, частина нежилого приміщення на першому поверсі будівлі",155.0,,01.03.2021,0,Оренда,,,Фізична особа,СЛУГА НАРОДУ,2021-12-31,4,2021
Нежитлова будівля,"Донецька обл., м. Краматорськ, вул. Катеринича, буд. 17, частина нежилого приміщення на першому поверсі будівлі",11.8,,01.03.2021,0,Оренда,,,Фізична особа,СЛУГА НАРОДУ,2021-12-31,4,2021
Нежитлова будівля,"Донецька обл., м. Краматорськ, вул. Катеринича, буд. 17, частина нежилого приміщення на першому поверсі будівлі",11.8,,01.03.2021,0,Оренда,,,Фізична особа,СЛУГА НАРОДУ,2021-12-31,4,2021
Нежитлова будівля,"Донецька обл., м. Маріуполь, просп. Миру, нежитлове приміщення № 3 на першому поверсі будівлі № 93Б",135.7,,01.03.2021,0,Оренда,,,Фізична особа,СЛУГА НАРОДУ,2021-12-31,4,2021
Нежитлова будівля,"Донецька обл., м. Волноваха, вул. Леніна (Центральна), буд. 51/1, нежитлове приміщення на другому поверсі",60.6,,25.08.2021,0,Оренда,,,Фізична особа,СЛУГА НАРОДУ,2021-12-31,4,2021
Нежитлова будівля,"Донецька обл., м. Бахмут, вул. Горбатова Б, буд. 47, нежитлове приміщення на першому поверсі",58.55,,13.12.2021,0,Оренда,,,Юридична особа,СЛУГА НАРОДУ,2021-12-31,4,2021
Нежитлова будівля,"Житомирська обл., м. Бердичів, вул. Шевченка, буд. 18/2",78.5,,01.06.2021,0,Оренда,,,Фізична особа,СЛУГА НАРОДУ,2021-12-31,4,2021
Нежитлова будівля,"м. Житомир, вул. Михайлівська, буд. 8/1",192.0,,01.08.2021,0,Оренда,,,Юридична особа,СЛУГА НАРОДУ,2021-12-31,4,2021
Нежитлова будівля,"Житомирська обл., м. Новоград-Волинський, вул. Соборності, буд. 4",39.2,,01.07.2021,0,Оренда,,,Фізична особа,СЛУГА НАРОДУ,2021-12-31,4,2021
Нежитлова будівля,"Житомирська обл., м. Коростень, вул. Грушевського, буд. 17",30.45,,01.11.2021,0,Оренда,,,Юридична особа,СЛУГА НАРОДУ,2021-12-31,4,2021
Нежитлова будівля,"Закарпатська обл., м. Ужгород, вул. Православна Набережна, буд. 7",65.0,,27.12.2020,0,Оренда,,,Фізична особа,СЛУГА НАРОДУ,2021-12-31,4,2021
Нежитлова будівля,"Закарпатська обл., м. Хуст, вул. Карпатської Січі, буд. 18А",33.6,,16.08.2021,0,Оренда,,,Фізична особа,СЛУГА НАРОДУ,2021-12-31,4,2021
Нежитлова будівля,"Закарпатська обл., м. Тячів, вул. Незалежності, буд. 59",41.55,,01.09.2021,0,Оренда,,,Фізична особа,СЛУГА НАРОДУ,2021-12-31,4,2021
Нежитлова будівля,"Закарпатська обл., м. Тячів, вул. Незалежності, буд. 59",41.55,,01.09.2021,0,Оренда,,,Фізична особа,СЛУГА НАРОДУ,2021-12-31,4,2021
Нежитлова будівля,"Закарпатська обл., м. Тячів, вул. Незалежності, буд. 59",41.55,,01.09.2021,0,Оренда,,,Фізична особа,СЛУГА НАРОДУ,2021-12-31,4,2021
Нежитлова будівля,"Закарпатська обл., м. Рахів, вул. Миру, буд. №52, нежитлове приміщення №3",31.24,,15.11.2021,0,Оренда,,,Фізична особа,СЛУГА НАРОДУ,2021-12-31,4,2021
Нежитлова будівля,"Закарпатська обл., м. Рахів, вул. Миру, буд. №52, нежитлове приміщення №3",31.24,,15.11.2021,0,Оренда,,,Фізична особа,СЛУГА НАРОДУ,2021-12-31,4,2021
Нежитлова будівля,"Закарпатська обл., м. Ужгород, площа Петефі Шандора, буд. 1",73.6,,29.12.2021,0,Оренда,,,Фізична особа,СЛУГА НАРОДУ,2021-12-31,4,2021
Нежитлова будівля,"Чернігівська обл., м. Корюківка, вул. Шевченка, буд. 40А. приміщення 1-3 та 1-6 частково",54.0,,01.09.2021,0,Оренда,,,Фізична особа,СЛУГА НАРОДУ,2021-12-31,4,2021
Нежитлова будівля,"м. Чернігів, вул. Чернишевського, буд. №15, приміщення офісу літ. 18-1 по літ. 18-8",77.4,,07.10.2021,0,Оренда,,,Фізична особа,СЛУГА НАРОДУ,2021-12-31,4,2021
Нежитлова будівля,"м. Чернігів, вул. Чернишевського, буд. №15, приміщення офісу літ. 18-1 по літ. 18-8",77.4,,07.10.2021,0,Оренда,,,Фізична особа,СЛУГА НАРОДУ,2021-12-31,4,2021
Нежитлова будівля,"м. Чернігів, вул. Чернишевського, буд. №15, приміщення офісу літ. 18-1 по літ. 18-8",77.4,,07.10.2021,0,Оренда,,,Фізична особа,СЛУГА НАРОДУ,2021-12-31,4,2021
Нежитлова будівля,"Чернігівська обл., м. Прилуки, вул. Київська, буд. 156, нежитлове приміщення 15",56.5,,01.10.2021,0,Оренда,,,Юридична особа,СЛУГА НАРОДУ,2021-12-31,4,2021
Нежитлова будівля,"Чернігівська обл., м. Ніжин, вул. Шевченка, буд. №2, нежитлове приміщення №2, оф. 73 частково",37.0,,18.10.2021,0,Оренда,,,Юридична особа,СЛУГА НАРОДУ,2021-12-31,4,2021
Нежитлова будівля,"Чернігівська обл., м. Новгород-Сіверський, вул. Губернська, буд. №41, приміщення 3",52.7,,15.10.2021,0,Оренда,,,Фізична особа,СЛУГА НАРОДУ,2021-12-31,4,2021
Нежитлова будівля,"м. Кропивницький, просп. Університетський, буд. 25 Г",39.8,,22.07.2020,0,Оренда,,,Фізична особа,СЛУГА НАРОДУ,2021-12-31,4,2021
Нежитлова будівля,"Хмельницька обл., м. Шепетівка, вул. Героїв Небесної Сотні, буд. 55, нежитлове приміщення на першому поверсі",37.2,,16.06.2021,0,Оренда,,,Фізична особа,СЛУГА НАРОДУ,2021-12-31,4,2021
Нежитлова будівля,"Хмельницька обл., м. Камʼянець-Подільський, вул. Гагаріна, буд. 73А, нежитлове приміщення на першому поверсі",56.6,,12.07.2021,0,Оренда,,,Фізична особа,СЛУГА НАРОДУ,2021-12-31,4,2021
Нежитлова будівля,"м. Хмельницький, вул. Проскурівського підпілля, буд. 63, частина другого поверху",125.0,,01.11.2021,0,Оренда,,,Юридична особа,СЛУГА НАРОДУ,2021-12-31,4,2021
Нежитлова будівля,"м. Хмельницький, вул. Проскурівська, буд. 17, перший поверх",87.9,,01.10.2021,0,Оренда,,,Фізична особа,СЛУГА НАРОДУ,2021-12-31,4,2021
Нежитлова будівля,"м. Рівне, вул. 16 Липня, буд. 42, поверх 1",131.1,,01.06.2021,0,Оренда,,,Юридична особа,СЛУГА НАРОДУ,2021-12-31,4,2021
Нежитлова будівля,"Рівненська обл., Володимирецький р-н, смт Володимирець, вул. Поштова, буд. 11А",56.5,,01.07.2021,0,Оренда,,,Фізична особа,СЛУГА НАРОДУ,2021-12-31,4,2021
Нежитлова будівля,"Рівненська обл., м. Сарни, вул. Белгородська, буд. 19, поверх 2",46.9,,01.10.2021,0,Оренда,,,Фізична особа,СЛУГА НАРОДУ,2021-12-31,4,2021
Нежитлова будівля,"Рівненська обл., м. Дубно, вул. Данила Галицького, буд. 26, поверх 1",45.5,,01.11.2021,0,Оренда,,,Фізична особа,СЛУГА НАРОДУ,2021-12-31,4,2021
Нежитлова будівля,"м. Львів, вул. Чайковського П., буд. 20",57.8,,01.12.2020,0,Оренда,,,Юридична особа,СЛУГА НАРОДУ,2021-12-31,4,2021
Нежитлова будівля,"Львівська обл., Золочівський р-н, м. Буськ, майдан Незалежності, буд. 9",24.5,,01.07.2021,0,Оренда,,,Юридична особа,СЛУГА НАРОДУ,2021-12-31,4,2021
Нежитлова будівля,"Львівська обл., м. Дрогобич, вул. Трускавецька, буд. 38",36.6,,01.07.2021,0,Оренда,,,Фізична особа,СЛУГА НАРОДУ,2021-12-31,4,2021
Нежитлова будівля,"Львівська обл., Яворівський р-н, м. Яворів, вул. А. Шептицького, буд. 1/3",40.2,,01.07.2021,0,Оренда,,,Фізична особа,СЛУГА НАРОДУ,2021-12-31,4,2021
Нежитлова будівля,"Львівська обл., Стрийський р-н, м. Стрий, вул. Бандери С., буд. 16, нежитлове приміщення 3",36.7,,01.11.2021,0,Оренда,,,Фізична особа,СЛУГА НАРОДУ,2021-12-31,4,2021
Нежитлова будівля,"Львівська обл., Самбірський р-н, м. Самбір, вул. Лемківська, буд. 1 а, нежитлові приміщення 4",49.4,,01.11.2021,0,Оренда,,,Фізична особа,СЛУГА НАРОДУ,2021-12-31,4,2021
Нежитлова будівля,"Дніпропетровська обл., м. Дніпро, вул. Європейська, буд. 20А",14.5,,22.07.2020,0,Оренда,,,Юридична особа,СЛУГА НАРОДУ,2021-12-31,4,2021
Нежитлова будівля,"Дніпропетровська обл., Камʼянський р-н, м. Камʼянське, просп. Свободи, буд. 15, нежитлове приміщення Кімната А на першому поверсі",38.2,,23.06.2021,0,Оренда,,,Юридична особа,СЛУГА НАРОДУ,2021-12-31,4,2021
Нежитлова будівля,"Дніпропетровська обл., Синельниковський р-н, м. Синельникове, вул. Затишна, буд. 18, нежитлове приміщення на першому поверсі",29.52,,01.07.2021,0,Оренда,,,Фізична особа,СЛУГА НАРОДУ,2021-12-31,4,2021
Нежитлова будівля,"Дніпропетровська обл., Павлоградський р-н, м. Павлоград, вул. Горького, буд. 130, нежитлові приміщення № 3 , № 4 на першому поверсі",54.1,,01.07.2021,0,Оренда,,,Юридична особа,СЛУГА НАРОДУ,2021-12-31,4,2021
Нежитлова будівля,"Дніпропетровська обл., Новомосковський р., м. Новомосковськ, вул. 195-ї Стрілецької дивізії (нова назва вул. 195-ї стрілкової дивізії), будівля № 2, нежитлове приміщення на 1(першому) поверсі",70.0,,01.07.2021,0,Оренда,,,Фізична особа,СЛУГА НАРОДУ,2021-12-31,4,2021
Нежитлова будівля,"Дніпропетровська обл., Нікопольський р-н, м. Нікополь, просп. Трубників, буд. 9, нежитлове приміщення 006 на 2-му поверсі",34.8,,01.07.2021,0,Оренда,,,Фізична особа,СЛУГА НАРОДУ,2021-12-31,4,2021
Нежитлова будівля,"Луганська обл., м. Сєвєродонецьк, просп. Гвардійський, буд. 47/22",46.8,,17.02.2021,0,Оренда,,,Фізична особа,СЛУГА НАРОДУ,2021-12-31,4,2021
Нежитлова будівля,"Луганська обл., Новоайдарський р-н, смт Новоайдар, вул. Незалежності, буд. 1",53.5,,21.07.2021,0,Оренда,,,Юридична особа,СЛУГА НАРОДУ,2021-12-31,4,2021
Нежитлова будівля,"Луганська обл., Сватівський р-н, м. Сватове, вул. Леніна (вул. Державна; вул. Каштанова), буд. 60, частина приміщення на другому поверсі ""Торгівельно-офісного центру""",45.8,,06.08.2021,0,Оренда,,,Фізична особа,СЛУГА НАРОДУ,2021-12-31,4,2021
Нежитлова будівля,"Луганська обл., Старобільський р-н, м. Старобільськ, вул. Монастирська, буд. 28, приміщ. 1",51.5,,01.12.2021,0,Оренда,,,Фізична особа,СЛУГА НАРОДУ,2021-12-31,4,2021
Нежитлова будівля,"м. Одеса, пров. Маяковського, буд. № 9, нежитлове 10, на першому поверсі",89.5,,09.09.2021,0,Оренда,,,Фізична особа,СЛУГА НАРОДУ,2021-12-31,4,2021
Нежитлова будівля,"Одеська обл., Ізмаїльський р-н, м. Ізмаїл, просп. Суворова, буд. №33-Б, нежитлове приміщення будинку літера ""А"" на першому поверсі.",74.4,,16.09.2021,0,Оренда,,,Фізична особа,СЛУГА НАРОДУ,2021-12-31,4,2021
Нежитлова будівля,"Одеська обл., Подільський р-н, м. Подільськ, вул. Сільськогосподарська, буд. 2А, нежитлове приміщення №102, №103",72.8,,08.10.2021,0,Оренда,,,Фізична особа,СЛУГА НАРОДУ,2021-12-31,4,2021
Нежитлова будівля,"Одеська обл., Березівський р-н, м. Березівка, вул. Ворошилова, буд. 4, нежитлове приміщення на другому поверсі.",37.6,,07.12.2021,0,Оренда,,,Юридична особа,СЛУГА НАРОДУ,2021-12-31,4,2021
Нежитлова будівля,"м. Одеса, вул. Дворянська, буд. 8, нежитлове приміщення на першому поверсі.",153.5,,20.12.2021,0,Оренда,,,Фізична особа,СЛУГА НАРОДУ,2021-12-31,4,2021
Нежитлові приміщення,"м. Київ, Паркова Дорога, буд. № 16-А на другому поверсі будівлі №1(літА) КВЦ""Парковий""",1828.2,,28.11.2019,0,Оренда,,,Юридична особа,СЛУГА НАРОДУ,2021-12-31,4,2021
Нежитлове приміщення,"м. Київ, Паркова Дорога, буд. № 16-А на першому пов. будівлі №1(літВ) КВЦ""Парковий""",56.7,,01.03.2021,0,Оренда,,,Юридична особа,СЛУГА НАРОДУ,2021-12-31,4,2021
Нежитлове приміщення,"м. Київ, Паркова Дорога, буд. № 16-А на першому пов. будівлі №1(літА) КВЦ""Парковий""",597.84,,22.02.2021,0,Оренда,,,Юридична особа,СЛУГА НАРОДУ,2021-12-31,4,2021
