Партія,Місцева організація,Географічний обʼєкт,Ідентифікаційний код юридичної особи за ЄДРПОУ,Місцезнаходження,Фактичне місцезнаходження,"Реквізити банків, у яких відкрито рахунки"
УКРАЇНСЬКА ГАЛИЦЬКА ПАРТІЯ,Львівська міська організація,Львівська область,43350118,"Львівська обл., м. Львів, вул. Чукаріна В., буд. 7","Львівська обл., м. Львів, вул. Чукаріна В., буд. 7","АТ АКБ ""Львів"", ЄДРПОУ: 09801546, р/р № UA023252680000026005107244001"
УКРАЇНСЬКА ГАЛИЦЬКА ПАРТІЯ,ЛЬВІВСЬКА ОБЛАСНА організація,Львівська область,40014820,"Львівська обл., м. Львів, вул. Грюнвальдська, буд. 10","Львівська обл., м. Львів, вул. Грюнвальдська, буд. 10","АТ АКБ ""Львів"", ЄДРПОУ: 09801546, р/р № UA113252680000000002600477437"
УКРАЇНСЬКА ГАЛИЦЬКА ПАРТІЯ,ТЕРНОПІЛЬСЬКА ОБЛАСНА організація,Тернопільська область,40011526,"Тернопільська обл., м. Тернопіль, вул. Шашкевича м. ., буд. 8","Тернопільська обл., м. Тернопіль, вул. Шашкевича м. ., буд. 8","Тернопільська філія АТ КБ ""Приватбанк"", ЄДРПОУ: 14360570, р/р № UA263387830000026006055117228"
УКРАЇНСЬКА ГАЛИЦЬКА ПАРТІЯ,ІВАНО-ФРАНКІВСЬКА ОБЛАСНА організація,Івано-франківська область,40026836,"Івано-франківська обл., м. Івано-Франківськ, вул. Лятишевського Івана єпископа, буд. 9","Івано-франківська обл., м. Івано-Франківськ, вул. Лятишевського Івана єпископа, буд. 9","Івано-Франківська філія АТ КБ ""ПРИВАТБАНК"", ЄДРПОУ: 14360570, р/р № UA853366770000026005052517967; АТ АКБ ""Львів"", Івано-Франківське відділення, ЄДРПОУ: 09801546, р/р № UA063252680000026001103877001"
УКРАЇНСЬКА ГАЛИЦЬКА ПАРТІЯ,Центральний офіс,Львівська область,39481037,"Львівська обл., м. Львів, вул. Нечуя-Левицького І., буд. 17","Львівська обл., м. Львів, вул. Нечуя-Левицького І., буд. 17","АТ АКБ ""Львів"" , ЄДРПОУ: 09801546, р/р № UA203252680000000002600671275"
